MRNAdate,MRNAnews,MRNAsource11/20/20,IEEE InTech Virtual Forum Unites Global Leaders to Examine Tech Industry's Response to Covid-19,PRN11/17/20,"US Infectious Disease Physicians Predict a COVID-19 Vaccine by May 2021, According to InCrowd Data ",BW11/17/20,European Medicines Agency Begins Rolling Review of Moderna's mRNA Vaccine Candidate Against COVID-19 (mRNA-1273),BW11/17/20,DJ Press Release: European Medicines Agency Begins Rolling Review of Moderna's mRNA Vaccine Candidate Against COVID-19 (mRNA-1273),DJGM11/17/20,Moderna Announces Supply Agreement with United Kingdom Government to Supply mRNA Vaccine Against COVID-19 (mRNA-1273) if Approved for Use,BW11/17/20,DJ Press Release: Moderna Announces Supply Agreement -2-,DJGM11/17/20,DJ Press Release: Moderna Announces Supply Agreement with United Kingdom Government to Supply mRNA Vaccine Against COVID-19 (mRNA-1273) if Approved for Use,DJGM11/17/20,Diagnostic Testing Remains Vital as New Treatment Breakthroughs are Announced,PRN11/16/20,Moderna's COVID-19 Vaccine Candidate Meets its Primary Efficacy Endpoint in the First Interim Analysis of the Phase 3 COVE Study,BW11/16/20,DJ Press Release: Moderna's COVID-19 Vaccine -2-,DJGM11/16/20,DJ Press Release: Moderna's COVID-19 Vaccine Candidate Meets its Primary Efficacy Endpoint in the First Interim Analysis of the Phase 3 COVE Study,DJGM11/16/20,Moderna Announces Longer Shelf Life for its COVID-19 Vaccine Candidate at Refrigerated Temperatures,BW11/16/20,DJ Press Release: Moderna Announces Longer Shelf Life for its COVID-19 Vaccine Candidate at Refrigerated Temperatures,DJGM11/13/20,Swissmedic Begins Rolling Review of Moderna's mRNA Vaccine Against COVID-19 (mRNA-1273) ,BW11/13/20,DJ Press Release: Swissmedic Begins Rolling Review of Moderna's mRNA Vaccine Against COVID-19 (mRNA-1273),DJGM11/11/20,Moderna Has Completed Case Accrual for First Planned Interim Analysis of its mRNA Vaccine Against COVID-19 (mRNA-1273),BW11/11/20,DJ Press Release: Moderna Has Completed Case Accrual for First Planned Interim Analysis of its mRNA Vaccine Against COVID-19 (mRNA-1273),DJGM11/11/20,Moderna Announces Clinical Updates on Personalized Cancer Vaccine Program,BW11/11/20,DJ Press Release: Moderna Announces Clinical Updates on Personalized Cancer Vaccine Program,DJGM11/02/20,"Moderna, Inc.(MRNA-US) Schedules Jefferies Healthcare Conference for 18-November-2020 11:25 AM ET",FCSTEV11/02/20,"Moderna, Inc.(MRNA-US) Schedules Credit Suisse Healthcare Conference for 11-November-2020 8:00 AM ET",FCSTEV11/02/20,Moderna to Present at Upcoming Investor Conferences in November 2020,BW11/02/20,DJ Press Release: Moderna to Present at Upcoming Investor Conferences in November 2020,DJGM10/30/20,Moderna Named Top Employer by Science for Sixth Consecutive Year,BW10/30/20,DJ Press Release: Moderna Named Top Employer by Science for Sixth Consecutive Year,DJGM10/29/20,Takeda _largit ses r_serves de vaccins contre la COVID-19 au Japon gr‰ce ˆ un partenariat avec Moderna et le gouvernement japonais ,BW10/29/20,Takeda erweitert Kapazit_ten zur COVID-19-Impfstoffversorgung in Japan durch Partnerschaft mit Moderna und japanischer Regierung ,BW10/29/20,DJ Press Release: Moderna Reports Third Quarter 2020 -4-,DJGM10/29/20,DJ Press Release: Moderna Reports Third Quarter 2020 Financial Results and Provides Business Updates,DJGM10/29/20,DJ Press Release: Moderna Reports Third Quarter 2020 -2-,DJGM10/29/20,DJ Press Release: Moderna Reports Third Quarter 2020 -3-,DJGM10/29/20,"Moderna Reports Third Quarter 2020 Financial Results and Provides Business Updates",BW10/29/20,"Moderna, Inc. to Host Earnings Call",NEWS_ACW10/28/20,DJ Press Release: Moderna Partners with Takeda and the Government of Japan to Supply 50 Million Doses of mRNA Vaccine Against COVID-19 (mRNA-1273) to Japan,DJGM10/28/20,DJ Press Release: Takeda Expands COVID-19 Vaccine Supply in Japan Through Partnership with Moderna and Government of Japan,DJGM10/28/20,Moderna Partners with Takeda and the Government of Japan to Supply 50 Million Doses of mRNA Vaccine Against COVID-19 (mRNA-1273) to Japan,BW10/27/20,DJ Press Release: UK Medicines and Healthcare products Regulatory Agency Begins Rolling Review of Moderna's mRNA Vaccine Against COVID-19 (mRNA-1273),DJGM10/27/20,UK Medicines and Healthcare products Regulatory Agency Begins Rolling Review of Moderna's mRNA Vaccine Against COVID-19 (mRNA-1273) ,BW10/26/20,DJ Press Release: Moderna Announces Supply Agreement with the Ministry of Public Health to Supply Qatar with mRNA Vaccine Against COVID-19 (mRNA-1273),DJGM10/26/20,Moderna Announces Supply Agreement with the Ministry of Public Health to Supply Qatar with mRNA Vaccine Against COVID-19 (mRNA-1273) ,BW10/22/20,DJ Press Release: Moderna Completes Enrollment of Phase 3 COVE Study of mRNA Vaccine Against COVID-19 (mRNA-1273),DJGM10/22/20,Moderna Completes Enrollment of Phase 3 COVE Study of mRNA Vaccine Against COVID-19 (mRNA-1273),BW10/19/20,"Moderna, Inc.(MRNA-US) Schedules Gabelli Funds - Columbia Business School Healthcare Symposium for 13-November-2020 9:10 AM ET",FCSTEV10/15/20,"Moderna, Inc.(MRNA-US) Schedules Q3 2020 Earnings Call for 29-October-2020 8:00 AM ET",FCSTEV10/15/20,"Moderna, Inc.(MRNA-US) Schedules Q3 2020 Earnings Release for 29-October-2020 7:00 AM ET",FCSTEV10/15/20,"DJ Press Release: Moderna to Report Third Quarter 2020 Financial Results on Thursday, October 29, 2020",DJGM10/15/20,"Moderna to Report Third Quarter 2020 Financial Results on Thursday, October 29, 2020",BW10/14/20,DJ Press Release: Moderna Receives Confirmation of -2-,DJGM10/14/20,DJ Press Release: Moderna Receives Confirmation of Eligibility for Submission of Marketing Authorization Application to the European Medicines Agency for mRNA Vaccine Against COVID-19 (mRNA-1273),DJGM10/14/20,Moderna Receives Confirmation of Eligibility for Submission of Marketing Authorization Application to the European Medicines Agency for mRNA Vaccine Against COVID-19 (mRNA-1273),BW10/13/20,"Moderna, Inc.(MRNA-US) Schedules BioNJ C-Suite Summit for 30-October-2020",FCSTEV10/13/20,Moderna Announces Initiation of Rolling Submission to Health Canada for mRNA Vaccine Against COVID-19 (mRNA-1273),BW10/13/20,DJ Press Release: Moderna Announces Initiation of -2-,DJGM10/13/20,DJ Press Release: Moderna Announces Initiation of Rolling Submission to Health Canada for mRNA Vaccine Against COVID-19 (mRNA-1273),DJGM10/08/20,"Moderna, Inc.(MRNA-US) Schedules Business Update Call for 8-October-2020 8:00 AM ET",FCSTEV10/08/20,"DARPA Awards Moderna up to $56 Million to Enable Small-Scale, Rapid Mobile Manufacturing of Nucleic Acid Vaccines and Therapeutics",BW10/08/20,"DJ Press Release: DARPA Awards Moderna up to $56 Million to Enable Small-Scale, Rapid Mobile Manufacturing of Nucleic Acid Vaccines and Therapeutics",DJGM10/08/20,Moderna Announces Updates on Respiratory Syncytial Virus (RSV) Vaccine Program,BW10/08/20,DJ Press Release: Moderna Announces Updates on Respiratory Syncytial Virus (RSV) Vaccine Program,DJGM10/08/20,DJ Press Release: Moderna Announces Updates on -2-,DJGM10/02/20,"Thinking about trading options or stock in Moderna, Twilio, Johnson & Johnson, General Electric, or Carnival Corp?",PRN09/29/20,Moderna Announces Publication in The New England Journal of Medicine of Interim Results From Older Adult Age Cohorts in Phase 1 Study of its mRNA Vaccine Against COVID-19 (mRNA-1273),BW09/29/20,DJ Press Release: Moderna Announces Publication in -2-,DJGM09/29/20,DJ Press Release: Moderna Announces Publication in The New England Journal of Medicine of Interim Results From Older Adult Age Cohorts in Phase 1 Study of its mRNA Vaccine Against COVID-19 (mRNA-1273),DJGM09/28/20,"Moderna, Inc.(MRNA-US) Schedules Chardan Genetic Medicines Conference for 5-October-2020 2:00 PM ET",FCSTEV09/28/20,DJ Press Release: Moderna to Present at the Chardan Virtual 4th Annual Genetic Medicines Conference,DJGM09/28/20,Moderna to Present at the Chardan Virtual 4th Annual Genetic Medicines Conference,BW09/25/20,EuropeFX Adds Pharma Stocks To Asset List,PRN09/22/20,Canada Exercises Increased Option for 20 Million Doses of mRNA Vaccine Against COVID-19 (mRNA-1273),BW09/22/20,DJ Press Release: Canada Exercises Increased Option for 20 Million Doses of mRNA Vaccine Against COVID-19 (mRNA-1273),DJGM09/18/20,Moderna e Grupo Chiesi firmam acordo para desenvolver tratamento de Hipertens‹o Arterial Pulmonar (HAP),PRNL09/17/20,Moderna Announces Progress Across Broad Portfolio and all Three Clinical Stage Therapeutic Areas at 2020 R&D Day,BW09/17/20,DJ Press Release: Moderna Announces Progress Across -3-,DJGM09/17/20,DJ Press Release: Moderna Announces Progress Across Broad Portfolio and all Three Clinical Stage Therapeutic Areas at 2020 R&D Day,DJGM09/17/20,DJ Press Release: Moderna Announces Progress Across -2-,DJGM09/16/20,Moderna and Vertex Establish New Collaboration to Treat Cystic Fibrosis Using Gene Editing,BW09/16/20,Moderna and Chiesi Group Establish Collaboration to Discover and Develop mRNA Therapeutics for Pulmonary Arterial Hypertension (PAH),BW09/16/20,DJ Press Release: Moderna and Chiesi Group Establish Collaboration to Discover and Develop mRNA Therapeutics for Pulmonary Arterial Hypertension (PAH),DJGM09/16/20,Moderna Announces First Commercial Organization Outside North America in Switzerland,BW09/16/20,DJ Press Release: Moderna Announces First Commercial Organization Outside North America in Switzerland,DJGM09/10/20,"Moderna, Inc.(MRNA-US) Schedules Bank of America Merrill Lynch Global Healthcare Conference for 18-September-2020 10:05 AM ET",FCSTEV09/10/20,"Moderna, Inc.(MRNA-US) Schedules Morgan Stanley Global Healthcare Conference for 14-September-2020 9:45 AM ET",FCSTEV09/10/20,DJ Press Release: Moderna Names Michael Mullette as Managing Director of New Canadian Subsidiary,DJGM09/10/20,Moderna Names Michael Mullette as Managing Director of New Canadian Subsidiary,BW09/09/20,DJ Press Release: Moderna to Present at Upcoming Investor Conferences in September 2020,DJGM09/09/20,Moderna to Present at Upcoming Investor Conferences in September 2020,BW09/08/20,Biopharma Leaders Unite to Stand With Science,BW09/08/20,DJ Press Release: Biopharma Leaders Unite to Stand -2-,DJGM09/08/20,DJ Press Release: Biopharma Leaders Unite to Stand -3-,DJGM09/08/20,DJ Press Release: Biopharma Leaders Unite to Stand with Science,DJGM09/08/20,DJ Press Release: Biopharma Leaders Unite To Stand -3-,DJGM09/08/20,DJ Press Release: Biopharma Leaders Unite To Stand -2-,DJGM09/08/20,DJ Press Release: Biopharma Leaders Unite To Stand With Science,DJGM09/08/20,Biopharma Leaders Unite To Stand With Science,BW09/08/20,Biopharma Leaders Unite to Stand with Science,BW09/03/20,"DJ Press Release: Moderna to Host Virtual R&D Day on September 17, 2020",DJGM09/03/20,"Moderna to Host Virtual R&D Day on September 17, 2020",BW09/01/20,Testing is in High Demand as Spread of Infection Remains,PRN08/28/20,"Moderna Confirms Discussions with the Ministry of Health, Labour and Welfare to Supply Japan with 40 Million Doses of mRNA Vaccine Against COVID-19 (mRNA-1273)",BW08/28/20,"DJ Press Release: Moderna Confirms Discussions with the Ministry of Health, Labour and Welfare to Supply Japan with 40 Million Doses of mRNA Vaccine Against COVID-19 (mRNA-1273)",DJGM08/26/20,Moderna to Present New Interim Clinical Data About mRNA Vaccine Against COVID-19 (mRNA-1273) at Advisory Committee on Immunization Practices (ACIP) Meeting,BW08/26/20,DJ Press Release: Moderna to Present New Interim Clinical Data About mRNA Vaccine Against COVID-19 (mRNA-1273) at Advisory Committee on Immunization Practices (ACIP) Meeting,DJGM08/24/20,Moderna Confirms Advanced Discussions with European Commission to Supply Europe with 80 Million Doses of mRNA Vaccine Against COVID-19 (mRNA-1273),BW08/24/20,DJ Press Release: Moderna Confirms Advanced -2-,DJGM08/24/20,DJ Press Release: Moderna Confirms Advanced Discussions with European Commission to Supply Europe with 80 Million Doses of mRNA Vaccine Against COVID-19 (mRNA-1273),DJGM08/19/20,Innovative Medical Devices Help Healthcare Systems Become More Efficient,PRN08/11/20,Moderna Announces Supply Agreement with U.S. Government for Initial 100 Million Doses of mRNA Vaccine Against COVID-19 (mRNA-1273),BW08/11/20,DJ Press Release: Moderna Announces Supply Agreement -2-,DJGM08/11/20,DJ Press Release: Moderna Announces Supply Agreement with U.S. Government for Initial 100 Million Doses of mRNA Vaccine Against COVID-19 (mRNA-1273),DJGM08/10/20,"DJ Press Release: John Lepore Joins Moderna as Senior Vice President, Government Engagement",DJGM08/10/20,"John Lepore Joins Moderna as Senior Vice President, Government Engagement",BW08/05/20,DJ Press Release: AWS Powers Moderna's Digital Biotechnology Platform to Develop New Class of Vaccines and Therapeutics,DJGM08/05/20,AWS Powers Moderna's Digital Biotechnology Platform to Develop New Class of Vaccines and Therapeutics,BW08/05/20,DJ Press Release: Moderna Reports Second Quarter -2-,DJGM08/05/20,DJ Press Release: Moderna Reports Second Quarter -3-,DJGM08/05/20,DJ Press Release: Moderna Reports Second Quarter 2020 Financial Results and Provides Business Updates,DJGM08/05/20,DJ Press Release: Moderna Reports Second Quarter -4-,DJGM08/05/20,Moderna Reports Second Quarter 2020 Financial Results and Provides Business Updates,BW07/30/20,DJ Press Release: CORRECTING AND REPLACING: Moderna Announces Resignation of Dr. Elizabeth Nabel From Board of Directors,DJGM07/30/20,Moderna Announces Resignation of Dr. Elizabeth Nabel From Board of Directors,BW07/30/20,"Thinking about buying stock in MobileIron Inc, Waitr Holdings, Electrameccanica Vehicles, Boeing, or Moderna Inc?",PRN07/28/20,"Moderna, Inc.(MRNA-US) Schedules mRNA-1273 Vaccine Update Call for 29-July-2020 8:00 AM ET",FCSTEV07/28/20,Moderna Announces Publication in The New England Journal of Medicine of Non-Human Primate Preclinical Viral Challenge Study of its mRNA Vaccine Against COVID-19 (mRNA-1273),BW07/28/20,DJ Press Release: Moderna Announces Publication in -2-,DJGM07/28/20,DJ Press Release: Moderna Announces Publication in The New England Journal of Medicine of Non-Human Primate Preclinical Viral Challenge Study of its mRNA Vaccine Against COVID-19 (mRNA-1273),DJGM07/27/20,Moderna Announces Phase 3 COVE Study of mRNA Vaccine Against COVID-19 (mRNA-1273) Begins,BW07/27/20,DJ Press Release: Moderna Announces Phase 3 COVE -2-,DJGM07/27/20,DJ Press Release: Moderna Announces Phase 3 COVE Study of mRNA Vaccine Against COVID-19 (mRNA-1273) Begins,DJGM07/26/20,Moderna Announces Expansion of BARDA Agreement to Support Larger Phase 3 Program for Vaccine (mRNA-1273) Against COVID-19,BW07/26/20,DJ Press Release: Moderna Announces Expansion of -2-,DJGM07/26/20,DJ Press Release: Moderna Announces Expansion of BARDA Agreement to Support Larger Phase 3 Program for Vaccine (mRNA-1273) Against COVID-19,DJGM07/24/20,Statement from Moderna on Patent Trial and Appeal Board (PTAB) Ruling,BW07/24/20,DJ Press Release: Statement from Moderna on Patent Trial and Appeal Board (PTAB) Ruling,DJGM07/23/20,"Moderna, Inc.(MRNA-US) Schedules Q2 2020 Earnings Release for 5-August-2020 7:00 AM ET",FCSTEV07/22/20,DJ Press Release: Medidata Supports Moderna's COVID-19 Vaccine Clinical Trials with Rave Clinical Cloud Platform,DJGM07/22/20,Medidata Supports Moderna's COVID-19 Vaccine Clinical Trials with Rave Clinical Cloud Platform,BW07/22/20,DJ Press Release: Dassault Systèmes: Medidata Supports Moderna's COVID-19 Vaccine Clinical Trials with Rave Clinical Cloud Platform,DJGM07/22/20,"Moderna, Inc.(MRNA-US) Schedules Q2 2020 Earnings Call for 5-August-2020 8:00 AM ET",FCSTEV07/22/20,"DJ Press Release: Moderna to Report Second Quarter 2020 Financial Results on Wednesday, August 5, 2020",DJGM07/22/20,"Moderna to Report Second Quarter 2020 Financial Results on Wednesday, August 5, 2020",BW07/16/20,Headlands Research Sites Chosen for Crucial COVID-19 Vaccine Trials,PMZ07/15/20,Distancing Measures Force Innovations in Patient Monitoring Procedures,PRN07/14/20,"Moderna, Inc.(MRNA-US) Schedules mRNA-1273 Phase 1 Study Results Call for 15-July-2020 8:00 AM ET",FCSTEV07/14/20,Moderna Announces Publication in The New England Journal of Medicine of Interim Results From Phase 1 Study of Its mRNA Vaccine Against COVID-19 (mRNA-1273),BW07/14/20,DJ Press Release: Moderna Announces Publication in The New England Journal of Medicine of Interim Results From Phase 1 Study of Its mRNA Vaccine Against COVID-19 (mRNA-1273),DJGM07/14/20,DJ Press Release: Moderna Announces Publication in -2-,DJGM07/14/20,DJ Press Release: Moderna Announces Publication in -3-,DJGM07/14/20,"Thinking about trading options or stock in Overstock.com, Moderna, Alibaba, Boeing, or Ford?",PRN07/14/20,"Moderna to Join the NASDAQ-100 Index Beginning July 20, 2020",BW07/14/20,"DJ Press Release: Moderna to Join the NASDAQ-100 Index Beginning July 20, 2020",DJGM07/13/20,"Moderna, Inc. to Join the NASDAQ-100 Index Beginning July 20, 2020",PMZ07/13/20,"DJ Press Release: Moderna, Inc. to Join the NASDAQ-100 Index Beginning July 20, 2020",DJGM07/09/20,DJ Press Release: Moderna and ROVI Announce -2-,DJGM07/09/20,DJ Press Release: Moderna and ROVI Announce Collaboration for OUS Fill-Finish Manufacturing of Moderna's COVID-19 Vaccine Candidate,DJGM07/09/20,Moderna and ROVI Announce Collaboration for OUS Fill-Finish Manufacturing of Moderna's COVID-19 Vaccine Candidate,BW07/08/20,DJ Press Release: Moderna Completes Enrollment of -2-,DJGM07/08/20,DJ Press Release: Moderna Completes Enrollment of Phase 2 Study of its mRNA Vaccine Against COVID-19 (mRNA-1273),DJGM07/08/20,Moderna Completes Enrollment of Phase 2 Study of its mRNA Vaccine Against COVID-19 (mRNA-1273),BW07/07/20,DJ Press Release: Flagship Pioneering's Scientists Invent a New Category of Genome Engineering Technology: Gene Writing,DJGM07/07/20,Flagship Pioneering's Scientists Invent a New Category of Genome Engineering Technology: Gene Writing,PRN07/07/20,"Moderna, Inc.(MRNA-US) Schedules Sachs Novel Coronavirus Investment Forum - Panel for 8-July-2020 9:00 AM ET",FCSTEV07/03/20," SHAREHOLDER ALERT: Pomerantz Law Firm Investigates Claims On Behalf of Investors of Moderna, Inc. - MRNA",PMZ07/01/20,DJ Press Release: Elizabeth Tallett Joins Moderna's Board of Directors,DJGM07/01/20,Elizabeth Tallett Joins Moderna's Board of Directors,BW06/25/20,DJ Press Release: Moderna and Catalent Announce -2-,DJGM06/25/20,DJ Press Release: Moderna and Catalent Announce Collaboration for Fill-Finish Manufacturing of Moderna's COVID-19 Vaccine Candidate,DJGM06/25/20,Moderna and Catalent Announce Collaboration for Fill-Finish Manufacturing of Moderna's COVID-19 Vaccine Candidate,BW06/22/20,"SHAREHOLDER ALERT: Pomerantz Law Firm Investigates Claims On Behalf of Investors of Moderna, Inc. - MRNA",PMZ06/18/20,Are Antivirals For COVID-19 More Likely to Be Developed and Approved Before a Vaccine,PRN06/17/20,Race For Vaccine Intensifies As COVID-19 Second Wave of Outbreaks Threatens,PRN06/16/20,"SHAREHOLDER ALERT: Pomerantz Law Firm Investigates Claims On Behalf of Investors of Moderna, Inc. - MRNA",PMZ06/16/20,"Moderna, Inc.(MRNA-US) Schedules BMO Capital Markets Prescription for Success Healthcare Conference for 23-June-2020 3:00 PM ET",FCSTEV06/16/20,DJ Press Release: Moderna to Present at BMO 2020 Prescriptions for Success Healthcare Conference,DJGM06/16/20,Moderna to Present at BMO 2020 Prescriptions for Success Healthcare Conference,BW06/15/20,"HAGENS BERMAN, NATIONAL TRIAL ATTORNEYS, Reminds Moderna, Inc. (MRNA) Investors of Ongoing Investigation into Possible Securities Fraud and Insider Trading, Encourages Investors with Significant Losses to Contact Firm",PMZ06/15/20,DJ Press Release: Ray Jordan Joins Moderna as Chief Corporate Affairs Officer,DJGM06/15/20,Ray Jordan Joins Moderna as Chief Corporate Affairs Officer,BW06/12/20,"MODERNA INVESTIGATION INITIATED BY FORMER LOUISIANA ATTORNEY GENERAL: Kahn Swick & Foti, LLC Investigates Claims On Behalf of Investors of Moderna, Inc. - MRNA",PMZ06/11/20,Moderna Advances Late-Stage Development of its Vaccine (mRNA-1273) Against COVID-19,BW06/11/20,DJ Press Release: Moderna Advances Late-Stage -2-,DJGM06/11/20,DJ Press Release: Moderna Advances Late-Stage Development of its Vaccine (mRNA-1273) Against COVID-19,DJGM06/08/20,"SHAREHOLDER ALERT: Pomerantz Law Firm Investigates Claims On Behalf of Investors of Moderna, Inc. - MRNA",PMZ06/08/20,Groundbreaking Designs Expand Remote Patient Monitoring Capabilities,PRN06/05/20,"MODERNA INVESTIGATION INITIATED BY FORMER LOUISIANA ATTORNEY GENERAL: Kahn Swick & Foti, LLC Investigates Claims On Behalf of Investors of Moderna, Inc. - MRNA",PMZ06/04/20,DJ Press Release: David Meline Joins Moderna as Chief Financial Officer,DJGM06/04/20,David Meline Joins Moderna as Chief Financial Officer,BW06/03/20,"SHAREHOLDER ALERT: Pomerantz Law Firm Investigates Claims On Behalf of Investors of Moderna, Inc. - MRNA",PMZ06/02/20,"HAGENS BERMAN, NATIONAL TRIAL ATTORNEYS, Announces Investigation into Moderna, Inc. (MRNA) for Possible Securities Fraud and Insider Trading, Encourages Investors with Significant Losses to Contact Firm",PMZ06/02/20,"MRNA Shareholder Alert: Bronstein, Gewirtz & Grossman, LLC Announces Moderna, Inc. Investigation and Encourages Investors to Contact the Firm",PRN06/02/20,Moderna Highlights Advances in Platform Science and Innovative Vaccine Research at Third Annual Science Day,BW06/02/20,DJ Press Release: Moderna Highlights Advances in -2-,DJGM06/02/20,DJ Press Release: Moderna Highlights Advances in Platform Science and Innovative Vaccine Research at Third Annual Science Day,DJGM06/01/20,"MODERNA INVESTIGATION INITIATED BY FORMER LOUISIANA ATTORNEY GENERAL: Kahn Swick & Foti, LLC Investigates Claims On Behalf of Investors of Moderna, Inc. - MRNA",PMZ06/01/20,"DJ Press Release: HAGENS BERMAN, NATIONAL TRIAL ATTORNEYS, Investigating Possible Securities Fraud and Insider Trading, Encourages Moderna, Inc. (MRNA) Investors with Significant Losses to Contact Firm",DJGM06/01/20,"HAGENS BERMAN, NATIONAL TRIAL ATTORNEYS, Investigating Possible Securities Fraud and Insider Trading, Encourages Moderna, Inc. (MRNA) Investors with Significant Losses to Contact Firm",PRN05/29/20,Moderna Announces First Participants in Each Age Cohort Dosed in Phase 2 Study of mRNA Vaccine (mRNA-1273) Against Novel Coronavirus,BW05/29/20,DJ Press Release: Moderna Announces First Participants in Each Age Cohort Dosed in Phase 2 Study of mRNA Vaccine (mRNA-1273) Against Novel Coronavirus,DJGM05/28/20,CordenPharma y Moderna colaboran en la obtenci—n de la vacuna contra el coronavirus,PRNE05/28/20,"CordenPharma und Moderna erweitern strategische Fertigungsvereinbarung, um Lipidhilfsstoffe fŸr Modernas Impfstoff (mRNA-1273) gegen das neuartige Coronavirus SARS-CoV-2 bereitzustellen",PRNE05/28/20,DJ Press Release: Flagship Pioneering Bolsters Executive Team with Appointment of Fabrice Chouraqui in Newly Created Dual Role of Flagship CEO-Partner and CEO of Cellarity,DJGM05/28/20,CordenPharma et Moderna _tendent leur accord strat_gique de services de fabrication pour la fourniture d'excipients lipidiques destin_s ˆ être utilis_s dans le vaccin de Moderna (ARNm-1273) contre le nouveau coronavirus SRAS-CoV-2,PRNE05/27/20,DJ Press Release: CordenPharma & Moderna Extend Strategic Manufacturing Services Agreement for the Supply of Lipid Excipients to be used in Moderna's Vaccine (mRNA-1273) Against the Novel Coronavirus SARS-CoV-2,DJGM05/27/20,CordenPharma & Moderna Extend Strategic Manufacturing Services Agreement for the Supply of Lipid Excipients to be used in Moderna's Vaccine (mRNA-1273) Against the Novel Coronavirus SARS-CoV-2,PRN05/27/20,"MODERNA INVESTIGATION INITIATED BY FORMER LOUISIANA ATTORNEY GENERAL: Kahn Swick & Foti, LLC Investigates Claims On Behalf of Investors of Moderna, Inc. - MRNA",PMZ05/27/20,"Moderna, Inc.(MRNA-US) Schedules Jefferies Virtual Healthcare Conference for 3-June-2020 10:30 AM ET",FCSTEV05/27/20,"Moderna, Inc.(MRNA-US) Schedules Goldman Sachs Global Healthcare Conference for 11-June-2020 2:10 PM ET",FCSTEV05/27/20,"SHAREHOLDER ALERT: Pomerantz Law Firm Investigates Claims On Behalf of Investors of Moderna, Inc. - MRNA",PMZ05/27/20,DJ Press Release: Moderna to Present at Upcoming Investor Conferences,DJGM05/27/20,Moderna to Present at Upcoming Investor Conferences,BW05/26/20,"MODERNA ALERT: Bragar Eagel & Squire, P.C. is Investigating Moderna, Inc. on Behalf of Stockholders and Encourages Investors to Contact the Firm",BW05/26/20,"DJ Press Release: Moderna to Host Virtual Science Day on June 2, 2020",DJGM05/26/20,"Moderna to Host Virtual Science Day on June 2, 2020",BW05/22/20,"DJ Press Release: MODERNA INVESTIGATION INITIATED BY FORMER LOUISIANA ATTORNEY GENERAL: Kahn Swick & Foti, LLC Investigates Claims On Behalf of Investors of Moderna, Inc. - MRNA",DJGM05/22/20,"MODERNA INVESTIGATION INITIATED BY FORMER LOUISIANA ATTORNEY GENERAL: Kahn Swick & Foti, LLC Investigates Claims On Behalf of Investors of Moderna, Inc. - MRNA",PRN05/18/20,Moderna Announces Pricing of Public Offering of Shares of Common Stock,BW05/18/20,DJ Press Release: Moderna Announces Pricing of Public Offering of Shares of Common Stock,DJGM05/18/20,Moderna Announces Proposed Public Offering of Shares of Common Stock,BW05/18/20,DJ Press Release: Moderna Announces Proposed Public Offering of Shares of Common Stock,DJGM05/18/20,"Moderna, Inc.(MRNA-US) Schedules mRNA-1273 Interim Phase 1 Data Results Call for 18-May-2020 8:30 AM ET",FCSTEV05/18/20,DJ Press Release: Moderna Announces Positive Interim -2-,DJGM05/18/20,DJ Press Release: Moderna Announces Positive Interim Phase 1 Data for its mRNA Vaccine (mRNA-1273) Against Novel Coronavirus,DJGM