MRNAdate,MRNAnews,MRNAsource05/18/20,Moderna Announces Positive Interim Phase 1 Data for its mRNA Vaccine (mRNA-1273) Against Novel Coronavirus,BW05/15/20,Moderna Congratulates Dr. Moncef Slaoui on His Appointment to Oversee the White House's Operation Warp Speed Initiative,BW05/15/20,DJ Press Release: Moderna Congratulates Dr. Moncef Slaoui on His Appointment to Oversee the White House's Operation Warp Speed Initiative,DJGM05/13/20,"Moderna, Inc.(MRNA-US) Schedules UBS Global Virtual Healthcare Conference for 18-May-2020 1:20 PM ET",FCSTEV05/12/20,"Moderna, Inc.(MRNA-US) Schedules Bank of America Merrill Lynch Virtual Healthcare Conference for 12-May-2020 2:20 PM ET",FCSTEV05/12/20,DJ Press Release: Moderna Receives FDA Fast Track Designation for mRNA Vaccine (mRNA-1273) Against Novel Coronavirus,DJGM05/12/20,Moderna Receives FDA Fast Track Designation for mRNA Vaccine (mRNA-1273) Against Novel Coronavirus,BW05/08/20,DJ Press Release: Moderna to Present at Upcoming Investor Conferences,DJGM05/08/20,Moderna to Present at Upcoming Investor Conferences,BW05/07/20,DJ Press Release: Moderna Reports First Quarter 2020 Financial Results and Provides Business Updates,DJGM05/07/20,DJ Press Release: Moderna Reports First Quarter 2020 -2-,DJGM05/07/20,DJ Press Release: Moderna Reports First Quarter 2020 -3-,DJGM05/07/20,DJ Press Release: Moderna Reports First Quarter 2020 -4-,DJGM05/07/20,Moderna Reports First Quarter 2020 Financial Results and Provides Business Updates,BW04/30/20,Moderna and Lonza Announce Worldwide Strategic Collaboration to Manufacture Moderna's Vaccine (mRNA-1273) Against Novel Coronavirus,BW04/30/20,DJ Press Release: Moderna and Lonza Announce -2-,DJGM04/30/20,DJ Press Release: Moderna and Lonza Announce Worldwide Strategic Collaboration to Manufacture Moderna's Vaccine (mRNA-1273) Against Novel Coronavirus,DJGM04/27/20,DJ Press Release: Moderna Announces IND Submitted to -2-,DJGM04/27/20,DJ Press Release: Moderna Announces IND Submitted to U.S. FDA for Phase 2 Study of mRNA Vaccine (mRNA-1273) Against Novel Coronavirus,DJGM04/27/20,Moderna Announces IND Submitted to U.S. FDA for Phase 2 Study of mRNA Vaccine (mRNA-1273) Against Novel Coronavirus ,BW04/24/20,"Moderna, Inc.(MRNA-US) Schedules Q1 2020 Earnings Call for 7-May-2020 8:00 AM ET",FCSTEV04/24/20,"Moderna, Inc.(MRNA-US) Schedules Q1 2020 Earnings Release for 7-May-2020 7:00 AM ET",FCSTEV04/23/20,"Moderna to Report First Quarter 2020 Financial Results on Thursday, May 7th, 2020",BW04/16/20,"Moderna, Inc.(MRNA-US) Schedules mRNA-1273 Update Call for 17-April-2020 8:00 AM ET",FCSTEV04/16/20,Moderna Announces Award from U.S. Government Agency BARDA for up to $483 Million to Accelerate Development of mRNA Vaccine (mRNA-1273) Against Novel Coronavirus ,BW04/16/20,DJ Press Release: Moderna Announces Award from U.S. -2-,DJGM04/16/20,DJ Press Release: Moderna Announces Award from U.S. Government Agency BARDA for up to $483 Million to Accelerate Development of mRNA Vaccine (mRNA-1273) Against Novel Coronavirus,DJGM04/15/20,DJ Press Release: Ginkgo Bioworks Provides Support on Process Optimization to Moderna for COVID-19 Response,DJGM04/15/20,Ginkgo Bioworks Provides Support on Process Optimization to Moderna for COVID-19 Response,PRN04/14/20,DJ Press Release: Moderna Highlights Opportunity of -2-,DJGM04/14/20,DJ Press Release: Moderna Highlights Opportunity of mRNA Vaccines at its First Vaccines Day,DJGM04/14/20,Moderna Highlights Opportunity of mRNA Vaccines at its First Vaccines Day ,BW04/10/20,Moderna Announces that Its 2020 Annual Meeting of Stockholders Will be Held in Virtual Format,BW04/10/20,DJ Press Release: Moderna Announces that Its 2020 Annual Meeting of Stockholders Will be Held in Virtual Format,DJGM04/08/20,"Moderna, Inc.(MRNA-US) Schedules Needham Virtual Healthcare Conference for 15-April-2020 10:40 AM ET",FCSTEV04/08/20,Moderna to Present at 19th Annual Needham Healthcare Conference,BW04/07/20,DJ Press Release: FDA Accelerates Development of -2-,DJGM04/07/20,DJ Press Release: FDA Accelerates Development of Novel Therapies for COVID-19,DJGM04/07/20,"DJ Press Release: Moderna to Host Virtual Vaccines Day on April 14, 2020",DJGM04/07/20,"Moderna to Host Virtual Vaccines Day on April 14, 2020",BW04/01/20,"Thinking about buying stock in Advanced Micro Devices, Aytu Bioscience, Inseego, Moderna, or SuperCom?",PRN03/30/20,"Moderna, Inc.(MRNA-US) Schedules Business Update Call for 30-March-2020 8:00 AM ET",FCSTEV03/29/20,Moderna Provides Update on the Impact of COVID-19 on Business Operations and Clinical Program Development,BW03/29/20,DJ Press Release: Moderna Provides Update on the -2-,DJGM03/29/20,DJ Press Release: Moderna Provides Update on the Impact of COVID-19 on Business Operations and Clinical Program Development,DJGM03/25/20,DJ Press Release: Moderna to Present at MIT Lecture Series,DJGM03/25/20,Moderna to Present at MIT Lecture Series,BW03/17/20,Coronavirus Puts Drug Repurposing on the Fast Track,PRNE03/17/20,"Moderna, Inc.(MRNA-US) Schedules Annual General Meeting for 29-April-2020 8:00 AM ET",FCSTEV03/16/20,Moderna Announces First Participant Dosed in NIH-led Phase 1 Study of mRNA Vaccine (mRNA-1273) Against Novel Coronavirus,BW03/16/20,DJ Press Release: Moderna Announces First Participant Dosed in NIH-led Phase 1 Study of mRNA Vaccine (mRNA-1273) Against Novel Coronavirus,DJGM03/16/20,DJ Press Release: Moderna Announces First -2-,DJGM03/03/20,Moderna Completes Enrollment of Cytomegalovirus (CMV) Vaccine (mRNA-1647) Phase 2 Study,BW03/03/20,DJ Press Release: Moderna Completes Enrollment of -2-,DJGM03/03/20,DJ Press Release: Moderna Completes Enrollment of Cytomegalovirus (CMV) Vaccine (mRNA-1647) Phase 2 Study,DJGM03/03/20,Aggressive Infectious Diseases Prompt the Development of Powerful New Blood Tests,PRN03/02/20,Moderna Announces Updated Plans for its March 4 Manufacturing & Digital Day Event,BW03/02/20,DJ Press Release: Moderna Announces Updated Plans for its March 4 Manufacturing & Digital Day Event,DJGM02/27/20,"Moderna, Inc.(MRNA-US) Schedules Analysts and Investor Meeting - Manufacturing & Digital Day for 4-March-2020 1:00 PM ET",FCSTEV02/26/20,"DJ Press Release: Moderna to Host Manufacturing & Digital Day on March 4, 2020",DJGM02/26/20,"Moderna to Host Manufacturing & Digital Day on March 4, 2020",BW02/26/20,Moderna Reports 2019 Fourth Quarter and Full Year Financial Results and Highlights Advancements in Core Modalities,BW02/26/20,DJ Press Release: Moderna Reports 2019 Fourth Quarter and Full Year Financial Results and Highlights Advancements in Core Modalities,DJGM02/26/20,DJ Press Release: Moderna Reports 2019 Fourth -4-,DJGM02/26/20,DJ Press Release: Moderna Reports 2019 Fourth -2-,DJGM02/26/20,DJ Press Release: Moderna Reports 2019 Fourth -3-,DJGM02/24/20,Moderna Ships mRNA Vaccine Against Novel Coronavirus (mRNA-1273) for Phase 1 Study,BW02/24/20,DJ Press Release: Moderna Ships mRNA Vaccine Against Novel Coronavirus (mRNA-1273) for Phase 1 Study,DJGM02/24/20,"Moderna, Inc.(MRNA-US) Schedules Oppenheimer Healthcare Conference for 17-March-2020 11:30 AM ET",FCSTEV02/24/20,"Moderna, Inc.(MRNA-US) Schedules Barclays Virtual Global Healthcare Conference for 11-March-2020 9:30 AM ET",FCSTEV02/24/20,"Moderna, Inc.(MRNA-US) Schedules Cowen Health Care Conference for 3-March-2020 11:20 AM ET",FCSTEV02/24/20,DJ Press Release: Moderna to Present at Upcoming Investor Conferences,DJGM02/24/20,Moderna to Present at Upcoming Investor Conferences,BW02/12/20,"Moderna, Inc.(MRNA-US) Schedules Q4 2019 Earnings Call for 26-February-2020 8:00 AM ET",FCSTEV02/12/20,"Moderna, Inc.(MRNA-US) Schedules Q4 2019 Earnings Release for 26-February-2020 7:00 AM ET",FCSTEV02/12/20,"DJ Press Release: Moderna to Report Fourth Quarter and Full Year 2019 Financial Results on Wednesday, February 26th, 2020",DJGM02/12/20,"Moderna to Report Fourth Quarter and Full Year 2019 Financial Results on Wednesday, February 26th, 2020",BW02/11/20,Moderna Announces Pricing of Public Offering of Shares of Common Stock,BW02/11/20,DJ Press Release: Moderna Announces Pricing of Public Offering of Shares of Common Stock,DJGM02/10/20,Moderna Announces Progress in Prophylactic Vaccines Modality with CMV Vaccine Phase 2 Study Data Now Expected in Third Quarter 2020 and Expands Investment in This Core Modality with Three New Development Candidates,BW02/10/20,DJ Press Release: Moderna Announces Progress in -2-,DJGM02/10/20,DJ Press Release: Moderna Announces Progress in Prophylactic Vaccines Modality with CMV Vaccine Phase 2 Study Data Now Expected in Third Quarter 2020 and Expands Investment in This Core Modality with Three New Development Candidates,DJGM02/10/20,Moderna Announces First Patient Enrolled in Phase 1/2 Study of mRNA-3704 for Methylmalonic Acidemia,BW02/10/20,DJ Press Release: Moderna Announces First Patient Enrolled in Phase 1/2 Study of mRNA-3704 for Methylmalonic Acidemia,DJGM02/10/20,Moderna Announces Proposed Public Offering of Shares of Common Stock,BW02/10/20,DJ Press Release: Moderna Announces Proposed Public Offering of Shares of Common Stock,DJGM02/03/20,"DJ Press Release: Sandra Horning, M.D. To Join Moderna's Board of Directors",DJGM02/03/20,"Sandra Horning, M.D. To Join Moderna's Board of Directors",BW01/30/20,"DJ Press Release: Melanie Ivarsson, Ph.D. Joins Moderna as Chief Development Officer",DJGM01/30/20,"Melanie Ivarsson, Ph.D. Joins Moderna as Chief Development Officer",BW01/29/20,Several Drugmakers are Racing to Create and Test a Vaccine for China's Deadly Coronavirus,PRN01/23/20,Moderna Announces Funding Award from CEPI to Accelerate Development of Messenger RNA (mRNA) Vaccine Against Novel Coronavirus ,BW01/23/20,DJ Press Release: Moderna Announces Funding Award from CEPI to Accelerate Development of Messenger RNA (mRNA) Vaccine Against Novel Coronavirus,DJGM01/12/20,Moderna Builds on Clinical Validation of Systemic Delivery with Two Additional Development Candidates in New Autoimmune Therapeutic Area ,BW01/12/20,DJ Press Release: Moderna Builds on Clinical Validation of Systemic Delivery with Two Additional Development Candidates in New Autoimmune Therapeutic Area,DJGM01/12/20,DJ Press Release: Moderna Builds on Clinical -3-,DJGM01/12/20,DJ Press Release: Moderna Builds on Clinical -2-,DJGM01/10/20,"Moderna, Inc.(MRNA-US) Schedules mRNA-1647 Phase 2 Study Results Call for 10-January-2020 8:00 AM ET",FCSTEV01/09/20,Moderna Announces Additional Positive Phase 1 Data from Cytomegalovirus (CMV) Vaccine (mRNA-1647) and First Participant Dosed in Phase 2 Study,BW01/09/20,DJ Press Release: Moderna Announces Additional -2-,DJGM01/09/20,DJ Press Release: Moderna Announces Additional Positive Phase 1 Data from Cytomegalovirus (CMV) Vaccine (mRNA-1647) and First Participant Dosed in Phase 2 Study,DJGM01/06/20,"Moderna, Inc.(MRNA-US) Schedules JP Morgan Health Care Conference - Q&A for 13-January-2020 8:00 PM ET",FCSTEV01/06/20,"Moderna, Inc.(MRNA-US) Schedules JP Morgan Health Care Conference for 13-January-2020 7:30 PM ET",FCSTEV01/06/20,DJ Press Release: Moderna to Provide Business and Pipeline Updates at the 2020 J.P. Morgan Healthcare Conference,DJGM01/06/20,Moderna to Provide Business and Pipeline Updates at the 2020 J.P. Morgan Healthcare Conference,BW12/23/19,"Moderna, Inc.(MRNA-US) Schedules Investor Meeting - Vaccines Day for 14-April-2020 8:00 AM ET",FCSTEV12/23/19,"Moderna, Inc.(MRNA-US) Schedules R&D Day for 17-September-2020 8:00 AM ET",FCSTEV12/23/19,"Moderna, Inc.(MRNA-US) Schedules Investor Meeting - Manufacturing & Digital Day for 4-March-2020 1:00 PM ET",FCSTEV12/23/19,"Moderna, Inc.(MRNA-US) Schedules Investor Meeting - Science Day for 2-June-2020 8:00 AM ET",FCSTEV12/19/19,DJ Press Release: Flagship Unveils Newest Pioneering Platform: Ring Therapeutics,DJGM12/11/19,DJ Press Release: Moderna Announces Key 2020 Investor and Analyst Events,DJGM12/11/19,Moderna Announces Key 2020 Investor and Analyst Events,BW12/10/19,"DJ Press Release: François Nader, M.D., Joins Moderna's Board of Directors",DJGM12/10/19,"François Nader, M.D., Joins Moderna's Board of Directors",BW11/26/19,"Moderna, Inc.(MRNA-US) Schedules Piper Jaffray Healthcare Conference for 3-December-2019 9:00 AM ET",FCSTEV11/26/19,DJ Press Release: Moderna to Present at 31st Annual Piper Jaffray Healthcare Conference,DJGM11/26/19,Moderna to Present at 31st Annual Piper Jaffray Healthcare Conference ,BW11/06/19,DJ Press Release: Moderna Provides Business Updates and Reports Third Quarter 2019 Financial Results,DJGM11/06/19,DJ Press Release: Moderna Provides Business Updates -3-,DJGM11/06/19,DJ Press Release: Moderna Provides Business Updates -2-,DJGM11/06/19,Moderna Provides Business Updates and Reports Third Quarter 2019 Financial Results,BW11/05/19,DJ Press Release: Moderna to Present at Credit Suisse 28th Annual Healthcare Conference,DJGM11/05/19,Moderna to Present at Credit Suisse 28th Annual Healthcare Conference,BW10/24/19,Moderna Named Top Employer by Science for Fifth Consecutive Year,BW10/24/19,DJ Press Release: Moderna Named Top Employer by Science for Fifth Consecutive Year,DJGM10/22/19,DJ Press Release: Moderna Receives FDA Fast Track Designation for Propionic Acidemia Program (mRNA-3927),DJGM10/22/19,Moderna Receives FDA Fast Track Designation for Propionic Acidemia Program (mRNA-3927),BW10/22/19,"Moderna, Inc.(MRNA-US) Schedules Q3 2019 Earnings Release for 6-November-2019 7:00 AM ET",FCSTEV10/22/19,"Moderna, Inc.(MRNA-US) Schedules Q3 2019 Earnings Call for 6-November-2019 8:00 AM ET",FCSTEV10/22/19,"DJ Press Release: Moderna to Report Third Quarter 2019 Financial Results on Wednesday, November 6th, 2019",DJGM10/22/19,"Moderna to Report Third Quarter 2019 Financial Results on Wednesday, November 6th, 2019",BW10/14/19,"Moderna, Inc.(MRNA-US) Schedules Credit Suisse Healthcare Conference for 13-November-2019 11:45 AM ET",FCSTEV10/05/19,"Moderna, Inc.(MRNA-US) Schedules IDWeek Conference - Abstract 2904 for 5-October-2019 4:00 PM ET",FCSTEV10/05/19,"Moderna, Inc.(MRNA-US) Schedules IDWeek Conference - Abstract 2754 for 5-October-2019 12:15 PM ET",FCSTEV10/02/19,Moderna to Present Data From Two of Its Prophylactic mRNA Vaccines at IDWeek 2019,BW09/30/19,Moderna Announces Open IND for Propionic Acidemia Program (mRNA-3927),BW09/26/19,Harvard University Establishes mRna Immunotherapy Research Collaboration With Moderna,BW09/26/19,Moderna Announces mRNA Immunotherapy Research Collaboration with Harvard University,BW09/25/19,"Moderna, Inc.(MRNA-US) Schedules Chardan Genetic Medicines Conference for 8-October-2019 11:30 AM ET",FCSTEV09/25/19,"Moderna, Inc.(MRNA-US) Schedules Cantor Global Health Care Conference for 3-October-2019 10:05 AM ET",FCSTEV09/25/19,Moderna to Present at Upcoming Investor Conferences ,BW09/12/19,Moderna Announces Positive Phase 1 Results for the First Systemic Messenger RNA Therapeutic Encoding a Secreted Protein (mRNA-1944),BW09/12/19,Moderna Announces Positive Interim Results from Phase 1 Cytomegalovirus (CMV) Vaccine (mRNA-1647) Study and Progress Toward Phase 2 and Pivotal Trials,BW09/04/19,Moderna Appoints Tracey Franklin as Chief Human Resources Officer,BW08/29/19,"Moderna to Host R&D Day on September 12, 2019",BW08/27/19,"Moderna, Inc.(MRNA-US) Schedules Morgan Stanley Global Health Care Conference for 9-September-2019 4:15 PM ET",FCSTEV08/27/19,"Moderna, Inc.(MRNA-US) Schedules Wells Fargo Health Care Conference for 4-September-2019 9:40 AM ET",FCSTEV08/27/19,Moderna to Present at Upcoming Investor Conferences,BW08/19/19,Moderna Receives FDA Fast Track Designation for Zika Vaccine mRNA-1893,BW08/07/19,"Moderna, Inc.(MRNA-US) Schedules IDWeek Conference for 2-October-2019",FCSTEV08/07/19,Moderna Provides Business Updates and Reports Second Quarter 2019 Financial Results,BW07/24/19,"Moderna, Inc.(MRNA-US) Schedules Q2 2019 Earnings Call for 7-August-2019 8:00 AM ET",FCSTEV07/24/19,"Moderna, Inc.(MRNA-US) Schedules Q2 2019 Earnings Release for 7-August-2019 7:00 AM ET",FCSTEV07/24/19,"Moderna to Report Second Quarter 2019 Financial Results on Wednesday, August 7th, 2019",BW07/10/19,Moderna to Present at ROTH RNA Revolution Conference ,BW06/28/19,"Moderna, Inc.(MRNA-US) Schedules ROTH Capital Partners RNA Revolution Conference for 17-July-2019",FCSTEV06/18/19,"Moderna, Inc.(MRNA-US) Schedules BMO Prescription for Success Healthcare Conference for 25-June-2019 3:20 PM ET",FCSTEV06/18/19,Moderna to Present at BMO 2019 Prescriptions for Success Healthcare Conference,BW06/07/19,"Moderna, Inc.(MRNA-US) Schedules Goldman Sachs Global Health Care Conference for 12-June-2019 5:00 PM ET",FCSTEV06/07/19,Moderna to Present at Goldman Sachs 40th Annual Global Healthcare Conference,BW06/02/19,"Moderna, Inc.(MRNA-US) Schedules American Society of Clinical Oncology Meeting for 3-June-2019 8:00 AM ET",FCSTEV06/01/19,ModernaÊAnnounces Presentation of Interim Data from Phase 1 Study of mRNA Personalized Cancer Vaccine at 2019 ASCO Annual Meeting,BW06/01/19,"Moderna, Inc.(MRNA-US) Schedules American Society of Clinical Oncology Meeting - Abstract 2523 for 1-June-2019 9:00 AM ET",FCSTEV05/17/19,Moderna Announces Publication of Preclinical Data for Chikungunya Antibody Program,BW05/16/19,"Moderna, Inc.(MRNA-US) Schedules Annual General Meeting for 27-June-2019 8:00 AM ET",FCSTEV05/10/19,Moderna Announces Publication of Phase 1 Data for mRNA Vaccines Against Two Potential Pandemic Influenza Strains,BW05/08/19,"Moderna, Inc.(MRNA-US) Schedules American Society of Clinical Oncology Meeting - Poster for 1-June-2019 2:15 PM ET",FCSTEV05/08/19,"Moderna, Inc.(MRNA-US) Schedules American Society of Clinical Oncology Meeting - Abstract 2643 for 1-June-2019 9:00 AM ET",FCSTEV05/08/19,Moderna Reports First Quarter 2019 Financial Results and Provides Business Updates,BW05/06/19,"Moderna, Inc.(MRNA-US) Schedules Bank of America Merrill Lynch Health Care Conference for 14-May-2019 12:20 PM ET",FCSTEV05/06/19,Moderna to Present at Bank of America Merrill Lynch 2019 Health Care Conference,BW04/29/19,Moderna to Present Preclinical Data at 2019 American Society of Gene & Cell Therapy (ASGCT) Annual Meeting,BW04/16/19,"Moderna, Inc.(MRNA-US) Schedules Q1 2019 Earnings Call for 8-May-2019 8:00 AM ET",FCSTEV04/16/19,"Moderna, Inc.(MRNA-US) Schedules Q1 2019 Earnings Release for 8-May-2019 7:00 AM ET",FCSTEV04/16/19,"Moderna to Host Science Day on May 7, 2019 and Report First Quarter Financial Results on May 8, 2019",BW04/03/19,Moderna to Present at 18th Annual Needham Healthcare Conference,BW03/18/19,"Moderna, Inc.(MRNA-US) Schedules Oppenheimer Health Care Conference for 19-March-2019 8:35 AM ET",FCSTEV03/06/19,"Moderna, Inc.(MRNA-US) Schedules Investor Day for 7-May-2019 9:00 AM ET",FCSTEV03/06/19,"Moderna, Inc.(MRNA-US) Schedules R&D Day for 12-September-2019 8:30 AM ET",FCSTEV03/06/19,Moderna Reports 2018 Fourth Quarter and Full Year Financial Results and Highlights Recent Pipeline Progress,BW03/04/19,Moderna to Present at Upcoming Investor Conferences in March,BW02/21/19,"Moderna, Inc.(MRNA-US) Schedules Q4 2018 Earnings Release for 6-March-2019 7:00 AM ET",FCSTEV02/21/19,"Moderna, Inc.(MRNA-US) Schedules Q4 2018 Earnings Call for 6-March-2019 8:00 AM ET",FCSTEV02/21/19,"Moderna to Report Fourth Quarter and Full Year 2018 Financial Results on Wednesday, March 6, 2019",BW02/20/19,Phase 1 Data Published in Nature Communications Show Potential of mRNA Encoding VEGF-A as a Regenerative Therapeutic,BW02/12/19,"Moderna, Inc.(MRNA-US) Schedules mRNA-1653 Phase 1 Study Results Call for 12-February-2019 5:00 PM ET",FCSTEV02/12/19,Moderna Announces Positive Interim Phase 1 Data for First Combination Vaccine Against the Respiratory Viruses hMPV and PIV3,BW02/05/19,Moderna Announces Dosing of the First Monoclonal Antibody Encoded by mRNA in a Clinical Trial,BW01/30/19,Newly Published Pre-Clinical Data Show Intratumoral Injections of Messenger RNA Encoding Three Immune Modulators Stimulate Durable Anti-Cancer Responses in Treated and Distal Tumors,BW01/18/19,Dr. John Mendlein to Transition to an Advisory Role at Moderna and Join Flagship Pioneering as an Executive Partner,BW01/08/19,Moderna Announces Recent Progress in Its Immuno-Oncology and Rare Disease Programs and Highlights Corporate Objectives,BW01/02/19,"Moderna, Inc.(MRNA-US) Schedules J.P. Morgan Healthcare Conference for 8-January-2019 1:30 PM ET",FCSTEV01/02/19,Moderna to Provide Business and Pipeline Updates at the 2019 J.P. Morgan Healthcare Conference,BW12/07/18,"Nasdaq Welcomes Moderna, Inc. (Nasdaq: MRNA) to The Nasdaq Stock Market",PMZ12/06/18,Moderna Announces Pricing of Initial Public Offering,BW