Date,Symbol,Headline,Source11/28/17,NFLX-US,"Analysis: Positioning to Benefit within Netflix, Texas Instruments, Walt Disney, United Parcel Service, Laredo Petroleum, and Corning - Research Highlights Growth, Revenue, and Consolidated Results",PMZ11/21/17,NFLX-US,"Avant-première mardi 19 décembre 2017 sur Netflix Worldwide de The Indian Detective (Le policier indien), avec Russell Peters dans le rôle principal.",BW10/26/17,NFLX-US,Jessica Neal Promoted to Chief Talent Officer at Netflix,PRN10/25/17,NFLX-US,Long Live The Television,PRNE10/23/17,NFLX-US,Netflix Prices $1.6 Billion Offering of Senior Notes,PRN10/23/17,NFLX-US,Netflix Announces Proposed $1.6 Billion Offering of Senior Notes,PRN10/19/17,NFLX-US,"Today's Research Report Coverage on CATV Systems Stocks -- Charter Communications, Discovery Communications, Liberty Global, and Netflix",PRN10/16/17,NFLX-US,Netflix Q3 2017 Letter to Shareholders and Financial Results,NEWS_CR10/16/17,NFLX-US,Netflix Releases Third-Quarter 2017 Financial Results,PRN10/3/17,NFLX-US,"Netflix, Inc.(NFLX-US) Schedules Deutsche Bank U.S. Leveraged Finance Conference for 3-October-2017 11:20 AM ET",FCSTTS9/15/17,NFLX-US,"Netflix, Inc.(NFLX-US) Schedules Q3 2017 Earnings Release for 16-October-2017 4:05 PM ET",FCSTEV9/15/17,NFLX-US,"Netflix, Inc.(NFLX-US) Schedules Q3 2017 Earnings Call for 16-October-2017 6:00 PM ET",FCSTTS9/15/17,NFLX-US,Netflix to Announce Third-Quarter 2017 Financial Results,PRN9/14/17,NFLX-US,Orange and Netflix ink major international agreement,NEWS_CR9/12/17,NFLX-US,Innovative Subscription Platforms are Exploding With Consumer Interest and Subscription-Based Revenue Growth,PRNE9/11/17,NFLX-US,Netflix Chief Financial Officer to Present at the Goldman Sachs 26th Annual Communacopia Conference,PRN9/10/17,NFLX-US,"Netflix, Inc.(NFLX-US) Schedules Goldman Sachs Communacopia Conference for 12-September-2017 11:20 AM ET",FCSTTS8/9/17,NFLX-US,TM BOOSTS ITS CONTENT PROPOSITION WITH NETFLIX,NEWS_CR8/7/17,NFLX-US,Netflix Acquires Millarworld,PRN7/26/17,NFLX-US,"Technical Reports on CATV Systems Equities -- Netflix, Liberty Global, Discovery Communications, and DISH Network",PRN7/17/17,NFLX-US,Netflix Q2 2017 Letter to Shareholders and Financial Results,NEWS_CR7/17/17,NFLX-US,Netflix Releases Second-Quarter 2017 Financial Results,PRN6/20/17,NFLX-US,TV Experts TVmaze Report Marketshare for Streaming TV Channels Has Nearly Doubled in 2017,PRN6/19/17,NFLX-US,"Netflix, Inc.(NFLX-US) Schedules Q2 2017 Earnings Release for 17-July-2017 4:05 PM ET",FCSTEV6/19/17,NFLX-US,"Netflix, Inc.(NFLX-US) Schedules Q2 2017 Earnings Call for 17-July-2017 6:00 PM ET",FCSTEV6/19/17,NFLX-US,Netflix to Announce Second-Quarter 2017 Financial Results,PRN6/13/17,NFLX-US,Today's Research Reports on Stocks to Watch: Facebook and Netflix,NEWS_ACW6/12/17,NFLX-US,AIS and Netflix bring world-class entertainment to AIS customers with exclusive promotion and billing integration,NEWS_CR5/31/17,NFLX-US,Blog Coverage: Netflix All Set to Entertain Israeli Customers as it Collaborates with Israel's Partner Communications Company,NEWS_ACW5/23/17,NFLX-US,"Four Years After House Of Cards, Netflix Members Elect Their Own TV Schedule",PRN5/5/17,NFLX-US,"CATV Systems Stocks Under Review -- Netflix, DISH Network, Liberty Global, and Discovery Communications",PRN4/28/17,NFLX-US,"NETFLIX 72 HOUR DEADLINE ALERT: Approximately 72 Hours Remain; Former Louisiana Attorney General and Kahn Swick & Foti, LLC Remind Investors of Deadline in First-Filed Class Action Lawsuit against Netflix, Inc. - (NFLX)",BW4/27/17,NFLX-US,iQIYI and Netflix Sign Licensing Agreement,PRN4/27/17,NFLX-US,"NFLX LOSS NOTICE: Rosen Law Firm Reminds Netflix, Inc. Investors of Important May 1, 2017 Deadline in Class Action",BW4/27/17,NFLX-US,"The Klein Law Firm Reminds Shareholders of a Class Action Filed on Behalf of Netflix, Inc. Shareholders and a Lead Plaintiff Deadline of May 1, 2017 (NFLX)",PMZ4/27/17,NFLX-US,"DEADLINE ALERT: Bronstein, Gewirtz & Grossman, LLC Reminds Investors of Class Action Against Netflix, Inc. (NFLX) & Lead Plaintiff Deadline - May 1, 2017",PMZ4/27/17,NFLX-US,Netflix_______Bill Nye______________,PRNA4/26/17,NFLX-US,"DEADLINE ALERT: Brower Piven Reminds Investors of the Upcoming Deadline in Class Action Lawsuit and Encourages Investors with Losses in Excess of $100,000 from Investment in Netflix, Inc. to Contact the Firm",BW4/26/17,NFLX-US,Netflix Prices €1.3 Billion Offering of Senior Notes,PRN4/26/17,NFLX-US,"NFLX INVESTOR ALERT: The Law Offices of Vincent Wong Reminds Investors of a Class Action Involving Netflix, Inc. and a Lead Plaintiff Deadline of May 1, 2017",NEWS_ACW4/26/17,NFLX-US,"Netflix, Inc.(NFLX-US) Schedules Annual General Meeting for 6-June-2017",FCSTEV4/24/17,NFLX-US,"KAHN SWICK & FOTI, LLC REMINDS INVESTORS of Lead Plaintiff Deadline in First-Filed Class Action Lawsuit Against Netflix, Inc.",NEWS_ACW4/24/17,NFLX-US,"INVESTOR ALERT: Levi & Korsinsky, LLP Reminds Shareholders of Netflix, Inc. of a Class Action Lawsuit and a Lead Plaintiff Deadline of May 1, 2017 - NFLX",PMZ4/24/17,NFLX-US,Netflix Announces Proposed €1 Billion Offering of Senior Notes,PRN4/21/17,NFLX-US,"NETFLIX SHAREHOLDER ALERT BY FORMER LOUISIANA ATTORNEY GENERAL: KAHN SWICK & FOTI, LLC REMINDS INVESTORS of Lead Plaintiff Deadline in First-Filed Class Action Lawsuit Against Netflix, Inc. - (NFLX)",PMZ4/21/17,NFLX-US,"DEADLINE ALERT: Bronstein, Gewirtz & Grossman, LLC Reminds Investors of Class Action Against Netflix, Inc. (NFLX) and Lead Plaintiff Deadline - May 1, 2017",NEWS_ACW4/20/17,NFLX-US,"EQUITY ALERT: Levi & Korsinsky, LLP Reminds Shareholders of Netflix, Inc. of a Class Action Lawsuit and a Lead Plaintiff Deadline of May 1, 2017 - NFLX",NEWS_ACW4/20/17,NFLX-US,Post Earnings Coverage as Netflix Revenue Soared 35%; Earnings Jumped Six Times,NEWS_ACW4/19/17,NFLX-US,"INVESTOR ALERT: Levi & Korsinsky, LLP Reminds Shareholders of Netflix, Inc. of Commencement of a Class Action Lawsuit and a Lead Plaintiff Deadline of May 1, 2017 - NFLX",NEWS_ACW4/18/17,NFLX-US,"KAHN SWICK & FOTI, LLC REMINDS INVESTORS of Lead Plaintiff Deadline in First-Filed Class Action Lawsuit Against Netflix, Inc. ",NEWS_ACW4/17/17,NFLX-US,Netflix Q1 2017 Letter to Shareholders and Financial Results,NEWS_CR4/17/17,NFLX-US,Netflix Releases First-Quarter 2017 Financial Results,PRN4/14/17,NFLX-US,"KAHN SWICK & FOTI, LLC REMINDS INVESTORS of Lead Plaintiff Deadline in First-Filed Class Action Lawsuit Against Netflix, Inc.",NEWS_ACW4/14/17,NFLX-US,"NFLX SHAREHOLDER ALERT: The Law Offices of Vincent Wong Reminds Investors of Commencement of a Class Action Involving Netflix, Inc. and a Lead Plaintiff Deadline of May 1, 2017",PMZ4/14/17,NFLX-US,"SHAREHOLDER ALERT: Bronstein, Gewirtz & Grossman, LLC Reminds Investors of Class Action Against Netflix, Inc. (NFLX) and Lead Plaintiff Deadline - May 1, 2017",NEWS_ACW4/13/17,NFLX-US,"The Klein Law Firm Announces a Class Action Filed on Behalf of Netflix, Inc. Shareholders and a Lead Plaintiff Deadline of May 1, 2017 (NFLX)",PMZ4/7/17,NFLX-US,"NETFLIX SHAREHOLDER ALERT by Former Louisiana Attorney General: Kahn Swick & Foti, LLC Reminds Investors of Lead Plaintiff Deadline in First-Filed Class Action Lawsuit Against Netflix, Inc. - (NFLX)",BW4/7/17,NFLX-US,Greg Peters to Become Netflix Chief Product Officer in July,PRN4/6/17,NFLX-US,"SHAREHOLDER ALERT: Levi & Korsinsky, LLP Reminds Shareholders of Netflix, Inc. of a Class Action Lawsuit and a Lead Plaintiff Deadline of May 1, 2017 - NFLX",NEWS_ACW4/5/17,NFLX-US,Netflix Changes Start Time of First-Quarter 2017 Earnings Video Interview,PRN4/5/17,NFLX-US,"SHAREHOLDER ALERT: Bronstein, Gewirtz & Grossman, LLC Notifies Investors of Class Action Against Netflix, Inc. (NFLX) and Lead Plaintiff Deadline: May 1, 2017",NEWS_ACW4/4/17,NFLX-US,"NFLX INVESTOR ALERT: The Law Offices of Vincent Wong Notifies Investors of Commencement of a Class Action Involving Netflix, Inc. and a Lead Plaintiff Deadline of May 1, 2017",NEWS_ACW4/4/17,NFLX-US,"Finkelstein & Krinsk LLP Has Filed a Shareholder Class Action Against Netflix, Inc., Reminds Investors of Important May 1, 2017 Deadline - NFLX",PRN4/3/17,NFLX-US,"EQUITY ALERT: Levi & Korsinsky, LLP Reminds Shareholders of Netflix, Inc. of Commencement of a Class Action Lawsuit and a Lead Plaintiff Deadline of May 1, 2017 - NFLX",NEWS_ACW4/3/17,NFLX-US,"SHAREHOLDER ALERT: Brower Piven Encourages Investors Who Have Losses In Excess Of $100,000 From Investment In Netflix, Inc. (NFLX) To Contact Brower Piven Before The Lead Plaintiff Deadline In Class Action Lawsuit",PMZ3/31/17,NFLX-US,"The Klein Law Firm Announces a Class Action Filed on Behalf of Netflix, Inc. Shareholders and a Lead Plaintiff Deadline of May 1, 2017 (NFLX)",NEWS_ACW3/29/17,NFLX-US,"SHAREHOLDER ALERT: Bronstein, Gewirtz & Grossman, LLC Notifies Investors of Class Action Against Netflix, Inc. (NFLX) and Lead Plaintiff Deadline: May 1, 2017",NEWS_ACW3/24/17,NFLX-US,"NETFLIX SHAREHOLDER ALERT BY FORMER LOUISIANA ATTORNEY GENERAL: KAHN SWICK & FOTI, LLC REMINDS INVESTORS of Lead Plaintiff Deadline in First-Filed Class Action Lawsuit Against Netflix, Inc. - (NFLX)",PRN3/24/17,NFLX-US,"Lifshitz & Miller LLP Announces Investigation of Delta Natural Gas Company, Inc., DigitalGlobe, Inc., FBR & Co., FTD Companies, Inc., Inventure Foods, Inc., Netflix, Inc. Rentech, Inc. and ZELTIQ Aesthetics, Inc.",PRN3/24/17,NFLX-US,"INVESTOR ALERT: Levi & Korsinsky, LLP Reminds Shareholders of Netflix, Inc. of Commencement of a Class Action Lawsuit and a Lead Plaintiff Deadline of May 1, 2017 - NFLX",NEWS_ACW3/24/17,NFLX-US,"SHAREHOLDER ALERT - Bronstein, Gewirtz & Grossman, LLC Notifies Investors of Class Action Against Netflix, Inc. (NFLX) & Lead Plaintiff Deadline: May 1, 2017",PMZ3/22/17,NFLX-US,"SHAREHOLDER ALERT: Levi & Korsinsky, LLP Reminds Shareholders of Netflix, Inc. of a Class Action Lawsuit and a Lead Plaintiff Deadline of May 1, 2017 - NFLX",PMZ3/21/17,NFLX-US,"INVESTOR ALERT: Brower Piven Encourages Shareholders Who Have Losses In Excess Of $100,000 From Investment In Netflix, Inc. To Contact Brower Piven Before The Lead Plaintiff Deadline In Class Action Lawsuit",BW3/20/17,NFLX-US,"SHAREHOLDER ALERT - Bronstein, Gewirtz & Grossman, LLC Notifies Investors of Class Action Against Netflix, Inc. (NFLX) and Lead Plaintiff Deadline: May 1, 2017",NEWS_ACW3/17/17,NFLX-US,"IMPORTANT INVESTOR ALERT: Khang & Khang LLP Announces Securities Class Action Lawsuit against Netflix, Inc., and Encourages Investors with Losses to Contact the Firm",BW3/16/17,NFLX-US,Shift From Traditional Cable to Digital Streaming Services Continues to Gain Momentum,PRN3/15/17,NFLX-US,"Netflix, Inc.(NFLX-US) Schedules Q1 2017 Earnings Call for 17-April-2017 6:00 PM ET",FCSTEV3/15/17,NFLX-US,"Netflix, Inc.(NFLX-US) Schedules Q1 2017 Earnings Release for 17-April-2017 4:05 PM ET",FCSTEV3/15/17,NFLX-US,Netflix to Announce First-Quarter 2017 Financial Results,PRN3/15/17,NFLX-US,"IMPORTANT INVESTOR ALERT: Lundin Law PC Announces Securities Class Action Lawsuit against Netflix, Inc. and Encourages Investors with Losses to Contact the Firm",BW3/15/17,NFLX-US,"Pawar Law Group Announces Filing of Securities Class Action Lawsuit Against Netflix, Inc. - NFLX",NEWS_ACW3/15/17,NFLX-US,RMS TITANIC Gets Own SVOD Channel,PRNE3/15/17,NFLX-US,Wingz Lands in San Antonio with 50% off Rides Through the End of March,PMZ3/14/17,NFLX-US,"SHAREHOLDER ALERT: Goldberg Law PC Announces the filing of a Class Action Lawsuit against Netflix, Inc., and Advises Investors with Losses to Contact the Firm",BW3/14/17,NFLX-US,"EQUITY ALERT: Rosen Law Firm Announces Filing of Securities Class Action Lawsuit Against Netflix, Inc. - NFLX",BW3/14/17,NFLX-US,"SHAREHOLDER ALERT: Brower Piven Notifies Investors of Class Action Lawsuit And Encourages Those Who Have Losses In Excess Of $100,000 From Investment In Netflix, Inc. (NFLX) To Contact Brower Piven Before The Lead Plaintiff Deadline",PMZ3/13/17,NFLX-US,"INVESTOR ALERT: Levi & Korsinsky, LLP Notifies Shareholders of Netflix, Inc. of a Class Action Lawsuit and a Lead Plaintiff Deadline of May 1, 2017 - NFLX",NEWS_ACW3/5/17,NFLX-US,Two Of Korea's Top Storytellers Unite For Kingdom - A New Netflix Original Series,PRN3/1/17,NFLX-US,"Kahn Swick & Foti, LLC and Former Louisiana Attorney General File Suit Against Netflix, Inc.: Remind Investors With Large Financial Interests of Important May 1, 2017 Deadline - NFLX",PMZ2/28/17,NFLX-US,AIS partners with Netflix in Thailand,NEWS_CR2/23/17,NFLX-US,"Netflix and Terry Crews to Kick Off Premiere of New Show ""Ultimate Beastmaster"" with USO Screening Event at Edwards Air Force Base",INW2/13/17,NFLX-US,Netflix Cheating is on the Rise Globally and Shows No Signs of Stopping,PRN2/8/17,NFLX-US,There's Never Enough TV On Netflix,PRN1/27/17,NFLX-US,"CATV Systems Stocks Under Scanner -- Netflix, Discovery Communications, Liberty Global, and Charter Communications",PRN1/20/17,NFLX-US,Latest Reports on Stocks to Watch: Netflix and American Express Post Earnings,NEWS_ACW1/20/17,NFLX-US,Post Earnings Coverage as Netflix Delivers Largest Quarterly Net Subscriber Additions in its History,NEWS_ACW1/19/17,NFLX-US,DJ IRW-PRESS: Netflix Inc. : Millionendepot: Netflix - Weitere Kursgewinne sind zu erwarten,DJIR1/18/17,NFLX-US,Netflix Q4 2016 Letter to Shareholders and Financial Results,NEWS_CR1/18/17,NFLX-US,Netflix Releases Fourth-Quarter 2016 Financial Results,PRN1/4/17,NFLX-US,Love Alarm Set To Become Netflix First Korean Original Series,PRN12/20/16,NFLX-US,"Netflix, Inc.(NFLX-US) Schedules Citi Global Internet, Media and Telecommunications Conference for 5-January-2017 3:30 PM ET",FCSTEV12/15/16,NFLX-US,"Netflix, Inc.(NFLX-US) Schedules Q4 2016 Earnings Call for 18-January-2017 5:00 PM ET",FCSTEV12/15/16,NFLX-US,"Netflix, Inc.(NFLX-US) Schedules Q4 2016 Earnings Release for 18-January-2017 4:05 PM ET",FCSTEV12/15/16,NFLX-US,Netflix to Announce Fourth-Quarter 2016 Financial Results,PRN12/14/16,NFLX-US,Netflix Is the New Home of King Khan,PRN12/12/16,NFLX-US,DJ newsbox.ch/ App Netflix da ora disponibile sull'Horizon HD Recorder,DJTS12/12/16,NFLX-US,DJ newsbox.ch/ Netflix app is now available on the Horizon HD Recorder,DJTS12/12/16,NFLX-US,DJ newsbox.ch/ L'app Netflix dès maintenant sur Horizon HD Recorder,DJTS12/7/16,NFLX-US,"Series, Movie, Series, Repeat: A New Netflix Binge Routine",PRN12/1/16,NFLX-US,"InvestorsObserver releases covered-call reports for Netflix, Cisco Systems, Apache Corporation, Bristol-Myers Squibb and Caterpillar Inc.",PRN11/28/16,NFLX-US,"Netflix, Inc.(NFLX-US) Schedules UBS Global Media & Communications Conference for 5-December-2016 12:15 PM ET",FCSTEV11/28/16,NFLX-US,TiVo and Netflix Enter Into Product and Intellectual Property Agreements,BW11/28/16,NFLX-US,Netflix Chief Content Officer to Present at the UBS 44th Annual Global Media and Communications Conference,PRN11/21/16,NFLX-US,"DJ pressetext.de: Australien: Kaum Piraterie dank Netflix und Co - Illegale Film-Downloads nehmen ab, während Spiele-Branche leidet",DJPA11/16/16,NFLX-US,Netflix And...Mom?,PRN11/4/16,NFLX-US,Comcast to Launch Netflix on X1 to Millions of Customers Nationwide,BW11/4/16,NFLX-US,COMCAST LANZA NETFLIX EN LA PLATAFORMA X1 PARA MILLONES DE CLIENTES A NIVEL NACIONAL,BW10/25/16,NFLX-US,The Ringing of the (Door) Bells,PRN10/24/16,NFLX-US,Netflix Prices $1 Billion Offering of Senior Notes,PRN10/24/16,NFLX-US,Netflix Announces Proposed $800 Million Offering of Senior Notes,PRN10/17/16,NFLX-US,Netflix Q3 2016 Letter to Shareholders and Financial Results,NEWS_CR10/17/16,NFLX-US,Netflix Releases Third-Quarter 2016 Financial Results,PRN10/11/16,NFLX-US,Netflix confirma nueva serie original en México creada y dirigida por Manolo Caro,PRNL10/11/16,NFLX-US,"Netflix Confirms A New, Mexican Original Series Created And Directed By Manolo Caro",PRN9/21/16,NFLX-US,Estás enganchado y Netflix sabe por qué,PRNL9/21/16,NFLX-US,You're Still Hooked and Netflix Knows Why,PRN9/19/16,NFLX-US,"Internet and Online Retail Industry Earnings Review for Netflix, Amazon.com, Duluth, and Priceline",NEWS_ACW9/14/16,NFLX-US,"Netflix, Inc.(NFLX-US) Schedules Q3 2016 Earnings Call for 17-October-2016 5:00 PM ET",FCSTEV9/14/16,NFLX-US,"Netflix, Inc.(NFLX-US) Schedules Q3 2016 Earnings Release for 17-October-2016 4:05 PM ET",FCSTEV9/14/16,NFLX-US,Netflix to Announce Third-Quarter 2016 Financial Results,PRN9/14/16,NFLX-US,DJ newsbox.ch/ UPC amplia l'offerta TV grazie alla partnership globale con Netflix,DJTS9/14/16,NFLX-US,DJ newsbox.ch/ UPC lights up TV screens with global Netflix partnership,DJTS9/8/16,NFLX-US,"Netflix, Inc.(NFLX-US) Schedules Goldman Sachs Communacopia Conference for 20-September-2016 3:45 PM ET",FCSTEV9/8/16,NFLX-US,Netflix Chief Financial Officer to Present at the Goldman Sachs 25th Annual Communacopia Conference,PRN9/7/16,NFLX-US,"EQUITY ALERT: Finkelstein & Krinsk LLP Announces Investigation of Securities Claims Against Netflix, Inc.",PRN8/29/16,NFLX-US,Showcase Delivers Bold Hits and Daring New Dramas This Fall,CNW8/29/16,NFLX-US,Canada's most powerful home Wi-Fi and the world's first fully wireless 4K IPTV service - now available only from Bell Fibe,CNW8/22/16,NFLX-US,"Netflix Teams with Northwood Entertainment on New TV Series ANNE, An Iconic Story Based On The Famous Novel ""Anne of Green Gables""",PRN8/18/16,NFLX-US,Lever Reaches Diversity Milestone With Appointment of CFO Eileen Treanor,PMZ8/17/16,NFLX-US,Netflix expande oferta para hotelaria por meio do contrato ampliado com a Enseo,BW8/17/16,NFLX-US,Netflix vergrößert Gastgewerbeangebot durch erweiterten Enseo-Vertrag,BW8/16/16,NFLX-US,"Netflix, Inc.(NFLX-US) Schedules Nomura Media, Telecom & Internet Conference for 16-August-2016",FCSTEV8/4/16,NFLX-US,LIONSGATE REPORTS RESULTS FOR FIRST QUARTER FISCAL 2017,CNW7/25/16,NFLX-US,Netflix y 20th Century Fox Television Distribution anuncian su primer acuerdo global,PRNL7/25/16,NFLX-US,Netflix e Fox Television Distribution anunciam seu primeiro acordo global,PRNL7/25/16,NFLX-US,Netflix And 20th Century Fox Television Distribution Announce First Global Agreement,PRN7/18/16,NFLX-US,Netflix Q2 2016 Letter to Shareholders and Financial Results,NEWS_CR7/18/16,NFLX-US,Netflix Releases Second-Quarter 2016 Financial Results,PRN7/18/16,NFLX-US,"Netflix lançará a nova série de TV da CBS ""Star Trek"" em 188 países pelo mundo",PRNL7/18/16,NFLX-US,"Netflix teletransportará la nueva serie ""Star Trek"" de CBS a 188 países alrededor del mundo",PRNL7/18/16,NFLX-US,"Netflix To Beam New CBS ""Star Trek"" Television Series In 188 Countries Around The World",PRN7/5/16,NFLX-US,Netflix And The CW Network Announce New Agreement,PRN6/24/16,NFLX-US,DJ pressetext.de: Android TV: Google ergänzt Suche mit Netflix - Implementierung via Update in den kommenden beiden Wochen,DJPA6/17/16,NFLX-US,"Netflix, Inc.(NFLX-US) Schedules Q2 2016 Earnings Call for 18-July-2016 5:00 PM ET",FCSTEV6/17/16,NFLX-US,"Netflix, Inc.(NFLX-US) Schedules Q2 2016 Earnings Release for 18-July-2016 4:05 PM ET",FCSTEV6/17/16,NFLX-US,Netflix to Announce Second-Quarter 2016 Financial Results,PRN6/16/16,NFLX-US,Netflix Finds Fans of Orange is the New Black Are Repeat Offenders,PRN6/13/16,NFLX-US,Millicom International Cellular: Millicom (Tigo) partners with Netflix in Latin America,BW6/8/16,NFLX-US,Netflix y los maratones: un nuevo índice revela qué series devoramos y cuáles saboreamos,PRNL6/8/16,NFLX-US,A Netflix e as maratonas: novo gráfico de maratonas revela as séries que são devoradas e as que são saboreadas,PRNL6/8/16,NFLX-US,Netflix And Binge: New Binge Scale Reveals TV Series We Devour And Those We Savor,PRN6/5/16,NFLX-US,Netflix Announces First Original Series From India In Partnership With Phantom Films Based On The Critically Acclaimed Novel Sacred Games,PRN6/2/16,NFLX-US,"A Netflix anuncia a estreia mundial de ""Na Sala da Julie"", nova série original para crianças em idade pré-escolar da produtora The Jim Henson Company, cocriada e estrelada pela lendária Julie Andrews",PRNL6/2/16,NFLX-US,"Netflix anuncia el debut mundial de Julie's Greenroom, una nueva serie para niños en edad preescolar de The Jim Henson Company que celebra las artes escénicas, protagonizada y co-creada por la legendaria Julie Andrews",PRNL6/2/16,NFLX-US,"Netflix Announces The Worldwide Debut Of Julie's Greenroom, A New Preschool Series From The Jim Henson Company Celebrating The Performing Arts, Starring And Co-Created By The Legendary Julie Andrews",PRN5/17/16,NFLX-US,"DJ pressetext.de: TV statt Freunde treffen: Amis sind Netflix-süchtig - Sechs Mal so viel Zeit für Serien als für Einkaufen, Sport oder Soziales",DJPA5/17/16,NFLX-US,"Netflix and Univision Story House to Co-Produce ""El Chapo"" Series",BW4/30/16,NFLX-US,"Netflix, Inc.(NFLX-US) Schedules Annual General Meeting for 9-June-2016 6:30 PM ET",FCSTEV4/19/16,NFLX-US,DJ IRW-PRESS: Netflix Inc. : Perlentrader: Netflix -2-,DJIR4/19/16,NFLX-US,DJ IRW-PRESS: Netflix Inc. : Perlentrader: Netflix Nutzen sie die Kursschwäche,DJIR4/18/16,NFLX-US,Netflix Q1 2016 Letter to Shareholders and Financial Results,NEWS_CR4/18/16,NFLX-US,Netflix Releases First-Quarter 2016 Financial Results,PRN4/15/16,NFLX-US,Netflix confirma nova série original baseada nas atuais investigações de corrupção no Brasil,PRNL4/15/16,NFLX-US,"Netflix confirma nueva serie original, basada en la actual investigación de corrupción brasileña",PRNL4/15/16,NFLX-US,Netflix confirms new original series based on current Brazilian corruption investigation,PRN4/6/16,NFLX-US,Project Mc2 Is Full STEAM Ahead on Netflix this Summer with Two New Seasons,PRN4/1/16,NFLX-US,"Find out Why These Stocks are on Investors' Scanner - NFLX, LBTYK, LBTYA, and DISCA",NEWS_ACW3/31/16,NFLX-US,"Do diretor e produtores de Velvet e Gran Hotel, chega a primeira série original da Netflix produzida e gravada na Espanha",PRNL3/31/16,NFLX-US,"Del director y los productores de Velvet y Gran Hotel, llega la primera serie original de Netflix filmada y producida en España",PRNL3/16/16,NFLX-US,"Netflix, Inc.(NFLX-US) Schedules Q1 2016 Earnings Release for 18-April-2016 4:00 PM ET",FCSTEV3/16/16,NFLX-US,"Netflix, Inc.(NFLX-US) Schedules Q1 2016 Earnings Call for 18-April-2016 5:00 PM ET",FCSTEV3/16/16,NFLX-US,Netflix to Announce First-Quarter 2016 Financial Results,PRN2/24/16,NFLX-US,"Netflix Brings New Original Anime Series, ""Perfect Bones"", to Members Worldwide",PRN2/10/16,NFLX-US,"Familias en todo el mundo podrán disfrutar de BEAT BUGS, la serie infantil original de Netflix, inspirada en la música de los Beatles",PRNL2/10/16,NFLX-US,"Famílias do mundo todo vão se reunir em torno de ""BEAT BUGS"", a série infantil Original Netflix inspirada nos Beatles",PRNL2/10/16,NFLX-US,"Families Around The World Will Come Together with BEAT BUGS, the Netflix Original Series for Kids Inspired By The Music Of The Beatles",PRN2/9/16,NFLX-US,"Finding Value in Flicks-- Netflix, Liberty Global, Cablevision Systems, and Liberty Global",NEWS_ACW2/3/16,NFLX-US,DJ pressetext.de: Chrome-App warnt vor Schock-Szenen in Serien - Menschen mit psychischen Störungen profitieren von Warnungen,DJPA1/31/16,NFLX-US,India's Sundance Sensation Brahman Naman To Premiere Exclusively And Globally On Netflix,PRN1/27/16,NFLX-US,"Netflix, Inc.(NFLX-US) Schedules MicroStrategy World Conference for 8-February-2016",FCSTEV1/19/16,NFLX-US,Netflix Q4 2015 Letter to Shareholders and Financial Results,NEWS_CR1/19/16,NFLX-US,Netflix Releases Fourth-Quarter 2015 Financial Results,PRN1/6/16,NFLX-US,A Netflix está agora disponível no mundo todo,PRNL1/6/16,NFLX-US,Netflix se expande por todo el mundo,PRNL1/6/16,NFLX-US,Netflix Is Now Available Around the World,PRN1/5/16,NFLX-US,Netflix and DreamWorks Animation Expand Global Relationship,PRN12/28/15,NFLX-US,Netflix Finds 9:00 p.m. is the New Midnight This New Year's Eve,PRN12/21/15,NFLX-US,"Netflix, Inc.(NFLX-US) Schedules Q4 2015 Earnings Call for 19-January-2016 5:00 PM ET",FCSTTS12/21/15,NFLX-US,"Netflix, Inc.(NFLX-US) Schedules Q4 2015 Earnings Release for 19-January-2016 4:05 PM ET",FCSTTS12/21/15,NFLX-US,Netflix to Announce Fourth-Quarter 2015 Financial Results,PRN12/15/15,NFLX-US,"Netflix, Inc.(NFLX-US) Schedules Citi Global Internet, Media and Telecommunications Conference for 6-January-2016 2:45 PM ET",FCSTEV12/15/15,NFLX-US,"Netflix Chief Financial Officer to Present at the Citi 26th Annual Global Internet, Media and Telecommunications Conference",PRN12/8/15,NFLX-US,"Studying the Charts - Research on Netflix, Amazon.com, Alphabet and Facebook",NEWS_ACW12/3/15,NFLX-US,Lemony Snicket's A Series of Unfortunate Events Announces Worldwide Casting Call For Key Roles In Upcoming Netflix Original Series,PRN11/19/15,NFLX-US,"Netflix, Inc.(NFLX-US) Schedules UBS Global Media and Communications Conference for 7-December-2015 10:00 AM ET",FCSTTS11/19/15,NFLX-US,Netflix Chief Content Officer to Present at the UBS 43rd Annual Global Media and Communications Conference,PRN11/4/15,NFLX-US,"Padres, cuando sus hijos estén negociando la hora de ir a dormir, cuenten con una pequeña ayuda de Netflix",PRNL11/4/15,NFLX-US,"Pais, quando seus filhos estiverem negociando a hora de ir dormir, contem com uma ajudinha da Netflix",PRNL11/4/15,NFLX-US,"Parents, Kiss Bedtime Battles Goodnight with A Little Help from Netflix",PRN10/15/15,NFLX-US,DJ IRW-PRESS: Netflix Inc. : Das Millionendepot: -2-,DJIR10/15/15,NFLX-US,DJ IRW-PRESS: Netflix Inc. : Das Millionendepot: Netflix Inc. Kursschwäche zum Kauf nutzen,DJIR10/14/15,NFLX-US,Netflix Q3 2015 Letter to Shareholders and Financial Results,NEWS_CR10/14/15,NFLX-US,Netflix Releases Third-Quarter 2015 Financial Results,PRN