Date,Symbol,Headline,Source10/1/15,NFLX-US,Netflix Adds Seven New Original Series For Older Kids Bringing Its Global Original Line Up To More Than 35 Series For Kids Of All Ages,PRN9/29/15,NFLX-US,Back Stabber Show Producers To Drop Netflix And Move Show To Network TV,PMZ9/28/15,NFLX-US,Jane The Virgin And Zoo Coming To Netflix Members Around The World,PRN9/28/15,NFLX-US,"Netflix Licenses Global Streaming Rights For ""COLONY"" From Legendary Television And Universal Cable Productions",PRN9/23/15,NFLX-US,Você sabe quando você foi fisgado? A Netflix sabe!,PRNL9/23/15,NFLX-US,Do You Know When You Were Hooked? Netflix Does,PRN9/18/15,NFLX-US,"Netflix To Be The Exclusive Global Streaming Home For Season One Episodes Of ABC's ""How To Get Away With Murder""",PRN9/17/15,NFLX-US,Las Leyendas Será la Primera Serie Original Animada de Netflix Producida en América Latina,PRNL9/17/15,NFLX-US,Las Leyendas Será a Primeira Série Original de Animação da Netflix Produzida na América Latina,PRNL9/15/15,NFLX-US,"Netflix, Inc.(NFLX-US) Schedules Q3 2015 Earnings Call for 14-October-2015 5:00 PM ET",FCSTTS9/15/15,NFLX-US,"Netflix, Inc.(NFLX-US) Schedules Q3 2015 Earnings Release for 14-October-2015 4:05 PM ET",FCSTTS9/15/15,NFLX-US,Netflix to Announce Third-Quarter 2015 Financial Results,PRN9/15/15,NFLX-US,Upcoming Projects and Events - Research Report on Netflix,PRN9/8/15,NFLX-US,Netflix to Launch in Hong Kong and Taiwan in Early 2016,INW9/8/15,NFLX-US,"Netflix To Launch In South Korea, Singapore, Hong Kong And Taiwan In Early 2016",PRN8/6/15,NFLX-US,"Netflix Original Documentary Winter on Fire: Ukraine's Fight For Freedom Premieres October 9, 2015 to Netflix Members Globally",PRN7/23/15,NFLX-US,"Angelina Jolie Pitt dirige First They Killed My Father, corajoso relato de guerra por uma criança, um filme original Netflix",PRNL7/23/15,NFLX-US,"Angelina Jolie dirigirá para Netflix la película original First They Killed My Father, un retrato de guerra inquebrantable a través de los ojos de una niña",PRNL7/23/15,NFLX-US,"Angelina Jolie Pitt To Direct First They Killed My Father, An Unflinching Portrayal Of War Through The Eyes Of A Child, As A Netflix Original Film",PRN7/23/15,NFLX-US,"Earnings exceed estimates, Impressive subscription numbers - Report on Netflix",PRN7/15/15,NFLX-US,Netflix Q2 2015 Letter to Shareholders and Financial Results,NEWS_CR7/15/15,NFLX-US,Netflix Releases Second-Quarter 2015 Financial Results,PRN6/23/15,NFLX-US,Netflix Announces Seven-For-One Stock Split,PRN6/15/15,NFLX-US,La Reliquia De La Familia Ya No Es El Anillo De La Abuela O El Reloj Del Abuelo...Son Las Tortugas Ninja Y Scooby Doo,PRNL6/15/15,NFLX-US,"Hoje em dia, Herança de Família Não São as Joias da Vovó Nem o Relógio do Vovô, Mas Sim as Tartarugas Ninja e o Scooby Doo",PRNL6/15/15,NFLX-US,"Today's Family Heirloom Isn't Grandma's Diamond Ring Or Grandad's Watch, It's The Teenage Mutant Ninja Turtles And Scooby Doo",PRN6/12/15,NFLX-US,"Netflix, Inc.(NFLX-US) Schedules Q2 2015 Earnings Release for 15-July-2015 4:05 PM ET",FCSTTS6/12/15,NFLX-US,"Netflix, Inc.(NFLX-US) Schedules Q2 2015 Earnings Call for 15-July-2015 4:30 PM ET",FCSTTS6/12/15,NFLX-US,Netflix to Announce Second-Quarter 2015 Financial Results,PRN6/8/15,NFLX-US,"Club de Cuervos, una serie original de Netflix del cineasta mexicano Gaz Alazraki, se estrenará en todos los territorios de Netflix el 7 de agosto",PRNL6/8/15,NFLX-US,"Club de Cuervos, a Netflix Original Series From Mexican Filmmaker Gaz Alazraki, to Debut in All Netflix Territories on August 7",PRN6/3/15,NFLX-US,Netflix Announces Four New Original Animated Series For Kids,PRN5/11/15,NFLX-US,Netflix estrenará La Dictadura Perfecta en exclusiva a partir del 1 de junio,PRNL5/5/15,NFLX-US,Netflix Chief Content Officer to Present at the MoffettNathanson Media & Communications Summit,PRN5/1/15,NFLX-US,"Netflix, Inc.(NFLX-US) Schedules MoffettNathanson Media & Communications Summit for 13-May-2015 10:00 AM ET",FCSTTS4/29/15,NFLX-US,Netflix Orders Green Eggs and Ham - Thirteen Episodes For The Whole Fam,PRN4/29/15,NFLX-US,"Netflix, Inc.(NFLX-US) Schedules Annual General Meeting for 9-June-2015 6:00 PM ET",FCSTTS4/17/15,NFLX-US,DJ pressetext.de: Netflix: Piraterie bestimmt Preisgestaltung mit - Günstigere Angebote als Kampfansage an illegale Downloads,DJPA4/15/15,NFLX-US,Netflix Q1 2015 Letter to Shareholders and Financial Results,NEWS_CR4/15/15,NFLX-US,Netflix Releases First-Quarter 2015 Financial Results,PRN4/15/15,NFLX-US,"Netflix Teams With Silverback Films and WWF to Create Our Planet, A Landmark Follow Up to the Seminal Natural History Series, Planet Earth",PRN4/9/15,NFLX-US,"The Other One: The Long, Strange Trip of Bob Weir To Debut Exclusively On Netflix",PRN4/2/15,NFLX-US,Netflix Announces New Original Series Montauk Written And Directed By The Duffer Brothers,PRN3/30/15,NFLX-US,Anne Sweeney And Brad Smith Joining Netflix Board Of Directors,PRN3/26/15,NFLX-US,"Netflix, Inc.(NFLX-US) Schedules Q1 2015 Earnings Release for 15-April-2015 4:05 PM ET",FCSTTS3/26/15,NFLX-US,"Netflix, Inc.(NFLX-US) Schedules Q1 2015 Earnings Call for 15-April-2015 6:00 PM ET",FCSTTS3/26/15,NFLX-US,Netflix estrenará La Dictadura Perfecta en exclusiva a partir del 27 de marzo,PRNL3/25/15,NFLX-US,Netflix to Announce First-Quarter 2015 Financial Results,PRN3/23/15,NFLX-US,Netflix To Premiere Chris Tucker's First-Ever Stand-Up Comedy Special,PRN3/11/15,NFLX-US,"DJ pressetext.de: Zensurwahn in China löst Piraterie-Hype aus - ""House of Cards"" in 24 Stunden auf 60.538 Endgeräte geladen",DJPA2/25/15,NFLX-US,Netflix Expands Its Portfolio Of Original And Exclusive TV Series With New Programmes For Kids Of All Ages,PRNE2/25/15,NFLX-US,Netflix Expands Its Portfolio Of Original And Exclusive TV Series With Five New Shows For Kids Of All Ages,PRN2/24/15,NFLX-US,Netflix And Judd Apatow Team Up To Bring The World Pee-wee Herman's Next Big Adventure,PRN2/16/15,NFLX-US,"Netflix To Premiere Jadotville, A Tale Of War, Impossible Odds And Incredible Bravery, Starring Jaime Dornan And Guillaume Canet",PRNE2/16/15,NFLX-US,"Netflix Présente Jadotville, L'histoire Du Courage Inouï D'une Poignée De Soldats Assiégés, Avec Jamie Dornan Et Guillaume Canet",PRNE2/16/15,NFLX-US,"Jadotville, Eine Fesselnde Geschichte Über Krieg, Das Überkommen Von Widrigkeiten Und Unglaublichen Mut Mit Jamie Dornan Und Guillaume Canet In Den Hauptrollen Wird Auf Netflix Premiere Feiern",PRNE2/16/15,NFLX-US,"Netflix Lançará Jadotville, Uma História De Guerra, Heroísmo E Coragem Estrelada Por Jamie Dornan E Guillaume Canet",PRNL2/16/15,NFLX-US,"Netflix Estrenará Jadotville, Una Historia De Guerra Y Valentía Increíble, Protagonizada Por Jamie Dornan Y Guillaume Canet",PRNL2/16/15,NFLX-US,"Netflix To Premiere Jadotville, A Tale Of War, Impossible Odds And Incredible Bravery, Starring Jamie Dornan And Guillaume Canet",PRN2/9/15,NFLX-US,"Netflix, Inc.(NFLX-US) Schedules Morgan Stanley Technology Media & Telecom Conference for 4-March-2015 1:15 PM ET",FCSTTS2/9/15,NFLX-US,"Netflix CFO to Present at the Morgan Stanley Technology, Media and Telecom Conference",PRN2/9/15,NFLX-US,Netflix llega hoy a Cuba,PRNL2/9/15,NFLX-US,Netflix chega a Cuba,PRNL2/9/15,NFLX-US,Netflix Is Available in Cuba,PRN2/5/15,NFLX-US,"Only On Netflix: The Get Down, An All-New Music-Driven Drama Series From Baz Luhrmann Set In New York City In The 70s",PRN2/4/15,NFLX-US,Netflix To Launch In Japan This Fall,PRN2/2/15,NFLX-US,Netflix Prices $1.5 Billion Offering of Senior Notes,PRN2/2/15,NFLX-US,Netflix Announces Proposed $1 Billion Offering of Senior Notes,PRN1/30/15,NFLX-US,Aziz Ansari Returns To Netflix With Brand New Stand-Up Comedy Special,PRN1/20/15,NFLX-US,Netflix Q4 2014 Letter to Shareholders and Financial Results,NEWS_CR1/20/15,NFLX-US,Netflix Releases Fourth-Quarter 2014 Financial Results,PRN1/14/15,NFLX-US,"Comienza la producción de Club de Cuervos, la serie de comedia original de Netflix hablada en español y que será lanzada globalmente en el 2015",PRNL1/13/15,NFLX-US,The Kudelski Group and Netflix Enter into Long Term Business Relationship and Resolve All Pending Patent Litigation,BW1/13/15,NFLX-US,DJ Kudelski Group Re Agreement,DJTS1/7/15,NFLX-US,"Marco Polo will Return for a Second All-New Adventure and Netflix Announces Premiere Dates for New Original Series Unbreakable Kimmy Schmidt, Bloodline, Marvel's Daredevil and Grace and Frankie",PRN1/5/15,NFLX-US,Netflix Announces 'Netflix Recommended TV' Program,PRN1/5/15,NFLX-US,The Legend Makes History Yet Again When THE ADVENTURES OF PUSS IN BOOTS Premieres on Netflix Jan. 16,PRN12/30/14,NFLX-US,"Netflix, Inc.(NFLX-US) Schedules Q4 2014 Earnings Call for 20-January-2015 5:00 PM ET",FCSTTS12/30/14,NFLX-US,"Netflix, Inc.(NFLX-US) Schedules Q4 2014 Earnings Release for 20-January-2015 4:05 PM ET",FCSTTS12/30/14,NFLX-US,Netflix to Announce Fourth-Quarter 2014 Financial Results,PRN12/11/14,NFLX-US,Netflix Garners Seven Nominations For The 2015 Golden Globe Awards Including Best Television Series Nominations For 'House Of Cards' And 'Orange Is The New Black',PRN11/21/14,NFLX-US,Netflix To Premiere Globally In March 2015 The New Tina Fey And Robert Carlock Comedy Series Starring Ellie Kemper,PRN11/19/14,NFLX-US,Netflix Orders Fourth Season Of Longmire,PRN11/18/14,NFLX-US,Netflix To Launch In Australia And New Zealand In March 2015,PRN11/11/14,NFLX-US,"WOW! TO OFFER EASY, INSTANT NETFLIX ACCESS VIA ULTRA TV Netflix Integration Simplifies Customer Viewing Experience",NEWS_CR11/3/14,NFLX-US,Atlantic Broadband Expands Its Netflix Partnership to Include Special Promotional Offers,BW11/3/14,NFLX-US,The Wildest Party Ever Hits the Jungle When the Netflix Original Series ALL HAIL KING JULIEN Debuts Dec. 19,PRN11/3/14,NFLX-US,La fiesta más salvaje azotará la jungla con el estreno el 19 de diciembre de la nueva serie original de Netflix All Hail King Julien,PRNL11/3/14,NFLX-US,"A festa mais maluca do mundo agitará a selva com a estreia da nova série original da Netflix ""All Hail King Julien"" em 19 de dezembro",PRNL11/3/14,NFLX-US,Rendez-vous le 19 décembre pour une fête endiablée avec la nouvelle série Netflix Original ALL HAIL KING JULIEN,PRNE10/28/14,NFLX-US,"Netflix, Inc.(NFLX-US) Schedules UBS Global Media and Communications Conference for 8-December-2014 1:30 PM ET",FCSTTS10/28/14,NFLX-US,"Netflix, Inc.(NFLX-US) Schedules RBC Technology, Internet, Media & Telecommunications Conference for 11-November-2014 9:05 AM ET",FCSTTS10/28/14,NFLX-US,Netflix Announces Upcoming Schedule of Events with the Financial Community,PRN10/22/14,NFLX-US,"F is for Family: Original, Animated Series From Bill Burr Coming Exclusively to Netflix",PRN10/20/14,NFLX-US,"City, Netflix, and shomi™ Collaborate To Bring Viewers ""Between"", A New Premium Original Drama Series",PRN10/15/14,NFLX-US,Netflix Q3 2014 Letter to Shareholders and Financial Results,NEWS_CR10/15/14,NFLX-US,Netflix Releases Third-Quarter 2014 Financial Results,PRN10/1/14,NFLX-US,"Netflix, Arad Animation And 41 Entertainment Announce Kong - King of the Apes™, A New Original Series For Kids",PRN10/1/14,NFLX-US,"Netflix, Arad Animation And 41 Entertainment Announce Kong - King Of The Apes™, A New Original Series For Kids",PRNE10/1/14,NFLX-US,"Netflix, Arad Animation et 41 Entertainment présentent Kong - King of the Apes™, la nouvelle série Netflix Original pour enfants",PRNE10/1/14,NFLX-US,"Netflix, Arad Animation und 41 Entertainment stellen vor: Kong - King of the Apes™, eine neue Netflix-Originalserie für kinder",PRNE9/25/14,NFLX-US,"Netflix, Inc.(NFLX-US) Schedules Q3 2014 Earnings Release for 15-October-2014 4:05 PM ET",FCSTTS9/25/14,NFLX-US,"Netflix, Inc.(NFLX-US) Schedules Q3 2014 Earnings Call for 15-October-2014 6:00 PM ET",FCSTTS9/25/14,NFLX-US,Netflix to Announce Third-Quarter 2014 Financial Results,PRN9/25/14,NFLX-US,Netflix and Rainbow Studios Announce Spin-off of Winx Club as a New Original TV Series for Kids,PRN9/24/14,NFLX-US,"Netflix And Saban Brands Announce ""Popples"", A New Original Series For Kids",PRN9/23/14,NFLX-US,DJ pressetext.de: Spoiler zu Filmen in Großbritannien verpönt - 76 Prozent der Amerikaner hingegen plaudern Szenen gerne aus,DJPA9/22/14,NFLX-US,Netflix Uncovers: We're Too British to be Spoilers... Or Are We?,PRNE9/18/14,NFLX-US,"Netflix Now In France, Germany, Austria, Switzerland, Belgium And Luxembourg",PRN9/16/14,NFLX-US,"Netflix e Legendary Television lançam nova série original, Love, uma produção divertida e diferente criada por Judd Apatow, Paul Rust e Lesley Arfin",PRNL9/16/14,NFLX-US,"Netflix y Legendary Television realizarán Love, una serie original novedosa y divertida de Judd Apatow, Paul Rust y Lesley Arfin que se estrenará en 2016",PRNL9/16/14,NFLX-US,"Netflix And Legendary Television To Make Love, A Fresh, Funny New Original Series From Judd Apatow, Paul Rust And Lesley Arfin",PRN9/2/14,NFLX-US,Gothan llegará en exclusiva a los miembros de Netflix en todo el mundo,PRNL9/2/14,NFLX-US,Gotham será exibida com exclusividade para os assinantes da Netflix no mundo inteiro,PRNL9/2/14,NFLX-US,Gotham Coming Exclusively To Netflix Members Around The World,PRN8/27/14,NFLX-US,"From Dan Franck, Writer Of Carlos And Florent Emilio Siri, Director Of Cloclo, Comes The First French Netflix Original Series: Marseille",PRN8/27/14,NFLX-US,"El guionista de Carlos, Dan Franck, y el director de Cloclo, Florent Emilio Siri, presentan la primera serie original de Netflix francesa: Marseille",PRNL8/27/14,NFLX-US,"De Dan Franck, roteirista de Carlos e Florent-Emilio Siri, diretor de Cloclo, surge a primeira série original Netflix francesa: Marseille",PRNL8/14/14,NFLX-US,Netflix Announces Upcoming Stand-Up Comedy Slate,PRN8/14/14,NFLX-US,Netflix anuncia novas aquisições para sua lista de comédias stand-up,PRNL8/14/14,NFLX-US,Netflix anuncia una nueva programación de comedia de stand-up,PRNL8/14/14,NFLX-US,Netflix Announces Forthcoming Stand-Up Comedy Productions,PRNE7/21/14,NFLX-US,Netflix Releases Second-Quarter 2014 Financial Results,PRN7/17/14,NFLX-US,Netflix and The Walt Disney Studios Announce Multi-Year Premium Pay TV Window Agreement in Canada,CNW6/30/14,NFLX-US,"Netflix, Inc.(NFLX-US) Schedules Q2 2014 Earnings Call for 21-July-2014 5:00 PM ET",FCSTTS6/30/14,NFLX-US,"Netflix, Inc.(NFLX-US) Schedules Q2 2014 Earnings Release for 21-July-2014 4:05 PM ET",FCSTTS6/30/14,NFLX-US,Netflix to Announce Second-Quarter 2014 Financial Results,PRN6/25/14,NFLX-US,"Must Know News: QUALCOMM, Facebook Inc, Netflix, Yahoo! Inc",NEWS_ACW6/19/14,NFLX-US,Chelsea Handler Teams With Netflix To Revolutionize The Talk Show,PRN6/19/14,NFLX-US,Chelsea Handler hace equipo con Netflix para revolucionar los programas de entrevistas,PRNL6/19/14,NFLX-US,Chelsea Handler e Netflix se juntam para revolucionar o formato de talk-show,PRNL6/19/14,NFLX-US,Chelsea Handler Teams With Netflix To Revolutionise The Talk Show,PRNE6/16/14,NFLX-US,Mattel's Spellbinding Fairytale Ever After High™ Unfolds as a Netflix Original Series for Kids,PRN6/11/14,NFLX-US,"Scholastic Media's The Magic School Bus Continues Legacy with The Magic School Bus 360 degrees, A New Netflix Original Series for Kids",PRN6/11/14,NFLX-US,"Série da Scholastic Media, ""Ônibus Mágico"", acelera com ""The Magic School Bus 360°"", uma nova série original Netflix para crianças",PRNL6/11/14,NFLX-US,The Magic School Bus de Scholastic Media continúa su legado con el estreno de una serie Original de Netflix para niños: The Magic School Bus 360°,PRNL6/3/14,NFLX-US,"Netflix Will Premiere 'This is Not a Ball', A Film That Explores The Global Passion For Soccer, On June 13",PRN6/3/14,NFLX-US,"Netflix lança no dia 13 de junho, 'Atrás da Bola', um filme que explora a paixão mundial pelo futebol",PRNL6/3/14,NFLX-US,"Netflix estrenará en el documental ""MÁS que un BALÓN"", el próximo 13 de junio, el cual explora la pasión mundial por el fútbol",PRNL5/29/14,NFLX-US,New Seasons Of DreamWorks Dragons To Take Flight On Netflix In 2015,PRN5/29/14,NFLX-US,Novas temporadas de DreamWorks Dragons chegam à Netflix em 2015,PRNL5/29/14,NFLX-US,Las nuevas temporadas de Dragones de DreamWorks aterrizarán en Netflix en 2015,PRNL5/29/14,NFLX-US,Nieuwe seizoenen van DreamWorks Dragons zijn klaar voor de start op Netflix in 2015,PRNE5/27/14,NFLX-US,"Europe Expansion, Dividends, Quarterly Results, and Conference Participations - Analyst Notes on Netflix, Time Warner Cable, Discovery Communications, TiVo and New York Times",PRN5/20/14,NFLX-US,"Netflix To Launch In Germany, Austria, Switzerland, France, Belgium And Luxembourg In Late 2014",PRN5/15/14,NFLX-US,"Consumer Discretionary Stocks Technical Briefing -- Research on Netflix, Best Buy, GameStop, and Conn's",PRN5/14/14,NFLX-US,"Critical Alerts For AT&T, Johnson and Johnson, Finisar, Rackspace Hosting, and Netflix Released By InvestorsObserver",PRN5/6/14,NFLX-US,Suddenlink to Provide Netflix on TiVo Devices,NEWS_CR4/30/14,NFLX-US,"Netflix, Inc.(NFLX-US) Schedules Annual General Meeting for 9-June-2014 1:00 PM ET",FCSTTS4/29/14,NFLX-US,"Netflix, Inc.(NFLX-US) Schedules J.P. Morgan Global Technology, Media and Telecom Conference for 20-May-2014 10:40 AM ET",FCSTTS4/29/14,NFLX-US,"Netflix CFO to Present at the J.P. Morgan Technology, Media and Telecom Conference",PRN4/25/14,NFLX-US,"Atlantic Broadband, Grande Communications and RCN are First U.S. Cable Providers to Bring Netflix to their Customers",BW4/24/14,NFLX-US,"Netflix Good Long Term Potential Despite High Valuation by BrokerBank Securities, Inc.",PRN4/23/14,NFLX-US,Only on Netflix: A New Spanish Language Original Comedy Series Set in the World of Futbol from Mexican Hitmaker Gaz Alazraki,PRN4/23/14,NFLX-US,Netflix emplaca mais um gol na América Latina com nova série original que será lançada globalmente,PRNL4/23/14,NFLX-US,"¡Golazo! Netflix producirá nueva serie original con el equipo detrás de ""Nosotros Los Nobles""",PRNL4/23/14,NFLX-US,Only On Netflix: A New Spanish Language Original Comedy Series Set in the World of Futbol from Mexican Hitmaker Gaz Alazraki,PRNE4/22/14,NFLX-US,"Wall Street Fundamentals Releases New In-Depth Stock Reports on NFLX, RMBS, STI and ZION",NEWS_ACW4/21/14,NFLX-US,Netflix Releases First-Quarter 2014 Financial Results,PRN4/14/14,NFLX-US,"Eli Roth's Supernatural Thriller ""Hemlock Grove"" Returns To Netflix For Second Season On Friday, July 11",PRN4/14/14,NFLX-US,"El Thriller sobrenatural de Eli Roth, Hemlock Grove, regresa a Netflix el 11 de julio",PRNL4/14/14,NFLX-US,"Suspense sobrenatural de Eli Roth, ""Hemlock Grove"", volta à Netflix com nova temporada no dia 11 de julho",PRNL4/14/14,NFLX-US,"Eli Roth's Supernatural Thriller ""Hemlock Grove"" Returns To Netflix For Second Season On Friday, 11th July",PRNE4/8/14,NFLX-US,"Production Is Underway On Epic Netflix Original Series ""Marco Polo"" Produced By The Weinstein Company",PRN4/8/14,NFLX-US,"Inicia la producción de la serie épica original de Netflix ""Marco Polo"" a cargo de Weinstein Company",PRNL4/8/14,NFLX-US,"Começa a produção da série original da Netflix ""Marco Polo"" produção da Weinstein Company",PRNL4/7/14,NFLX-US,"Netflix to Launch Second Season of Ricky Gervais' Original Series ""Derek"" on Friday, May 30",PRN4/7/14,NFLX-US,"Netflix lanzará la segunda temporada de Derek, la serie original de Ricky Gervais, el viernes 30 de mayo",PRNL4/7/14,NFLX-US,"Netflix Lança Dia 30 de Maio a Segunda Temporada de ""Derek"", Série Original de Ricky Gervais",PRNL4/7/14,NFLX-US,"Netflix to Launch Second Season of Ricky Gervais' Original Series ""Derek"" on Friday, 30th May",PRNE4/1/14,NFLX-US,"Sólo en Netflix: Wagner Moura será Pablo Escobar en Narcos, que se estrenará en el 2015",PRNL4/1/14,NFLX-US,Only On Netflix: Wagner Moura As Pablo Escobar In Narcos Coming In 2015,PRN4/1/14,NFLX-US,"Só na Netflix: Wagner Moura interpretará Pablo Escobar em Narcos, com estreia em 2015",PRNL3/31/14,NFLX-US,"Netflix, Inc.(NFLX-US) Schedules Q1 2014 Earnings Release for 21-April-2014 4:05 PM ET",FCSTTS3/31/14,NFLX-US,"Netflix, Inc.(NFLX-US) Schedules Q1 2014 Earnings Call for 21-April-2014 5:00 PM ET",FCSTTS3/31/14,NFLX-US,Netflix to Announce First-Quarter 2014 Financial Results,PRN3/26/14,NFLX-US,"Netflix adquire ""Print The Legend"", premiado documentário do festival SXSW",PRNL3/26/14,NFLX-US,"Netflix adquiere documental premiado en el festival de cine SXSW: ""Print The Legend""",PRNL3/25/14,NFLX-US,"Wall Street Fundamentals Releases New In-Depth Stock Reports on LGF, LMT, NFLX and XRX",NEWS_ACW3/20/14,NFLX-US,"Fargo, The Icy True-Crime Limited Series Coming Exclusively To Netflix In The Netherlands Beginning April 16",PRN3/20/14,NFLX-US,"FARGO, de ijzingwekkende true-crime misdaadserie, exclusief voor NETFLIX-leden in Nederland vanaf 16 april a.s.",PRNE3/19/14,NFLX-US,"Jane Fonda And Lily Tomlin Back Together Again In ""Grace and Frankie,"" A New Original Comedy Series On Netflix",PRN3/19/14,NFLX-US,"Jane Fonda y Lily Tomlin Juntas de Nuevo en Grace and Frankie, Una Nueva Serie de Comida Original de Netflix",PRNL3/19/14,NFLX-US,"Jane Fonda e Lily Tomlin encontram-se novamente em ""Grace and Frankie"", uma série cômica original da Netflix",PRNL3/13/14,NFLX-US,Puss in Boots And King Julien Add Their Legendary Panache To DreamWorks Animation's Netflix Original Series Line-Up,PRN3/13/14,NFLX-US,Gato de Botas e Rei Julien estrelam em grande estilo as novas séries originais Netflix da DreamWorks Animation,PRNL3/13/14,NFLX-US,El Gato con Botas y el Rey Julien se suman con su legendaria simpatía a la lista de series originales de Netflix de DreamWorks Animation,PRNL3/12/14,NFLX-US,"New U.S. Sci-Fi/Adventure Series The 100 Will Premiere Only on Netflix in Canada, via Deal with Warner Bros. International Television Distribution",CNW3/12/14,NFLX-US,Homeland And American Horror Story Coming to Netflix in the UK and Ireland from 13 March,PRNE3/6/14,NFLX-US,Eigen Netflix-serie 'From Dusk Till Dawn' van de hand van Robert Rodriguez wordt vanaf maart exclusief aan Netflix-leden in internationale regio's aangeboden,PRNE3/6/14,NFLX-US,"""Um drink no inferno: uma série original Netflix"", de Robert Rodriguez, estreia exclusivamente nos territórios internacionais da Netflix em março",PRNL3/6/14,NFLX-US,"De Robert Rodriguez, Del crepúsculo al amanecer: Una serie original de Netflix llegará en exclusiva a los territorios internacionales de Netflix en marzo",PRNL3/6/14,NFLX-US,Robert Rodriguez's 'From Dusk Till Dawn: A Netflix Original Series' Coming Exclusively To Netflix Members In International Territories This March,CNW3/5/14,NFLX-US,Only On Netflix: Canada's Incomparably-Entertaining Trailer Park Boys Return For Seasons 8 & 9 Beginning This Fall,CNW3/3/14,NFLX-US,"DJ pressetext.de: ""Sleep Tracker"" stoppt Filme beim Einnicken - Software nutzt Fitbit-Device und übermittelt Bewegungsdaten",DJPA2/23/14,NFLX-US,Comcast And Netflix Team Up To Provide Customers Excellent User Experience,PRN2/23/14,NFLX-US,Comcast and Netflix Team Up to Provide Customers Excellent User Experience,BW2/13/14,NFLX-US,"The Force is with Netflix: Final Season of Lucasfilm's Star Wars: The Clone Wars ""The Lost Missions"" to Premiere Only on Netflix in U.S. and Canada On March 7th",PRN2/10/14,NFLX-US,Brasil e Chile têm melhor banda larga da América Latina,PRNL2/10/14,NFLX-US,Brasil y Chile son líderes en banda ancha en latinoamérica,PRNL2/6/14,NFLX-US,"Netflix, Inc.(NFLX-US) Schedules Morgan Stanley Technology, Media & Telecom Conference for 3-March-2014 4:55 PM ET",FCSTTS2/6/14,NFLX-US,"Netflix CFO to Present at the Morgan Stanley Technology, Media and Telecom Conference",PRN2/6/14,NFLX-US,Netflix and Scholastic Send Kids and Families A BIG Red Valentine....Clifford The Big Red Dog®!,PRN2/6/14,NFLX-US,Netflix y Scholastic les desean a los niños y sus familias un hermoso Día de San Valentín en compañía de Clifford,PRNL2/6/14,NFLX-US,"O que é grande, vermelho, muito fofo e novo na Netflix? É o Clifford!",PRNL2/4/14,NFLX-US,Netflix Prices $400 Million Offering of 5.750% Senior Notes,PRN2/4/14,NFLX-US,"Pioneer Prison Consultant, John ""Doc"" Fuller Pens ""The Ten Prison Commandments - The Ten Rules You Must Know Before You Enter a County Jail, State or Federal Prison"" for White Collar Offenders",PRN2/4/14,NFLX-US,Netflix Announces Proposed $400 Million Offering of Senior Notes,PRN2/3/14,NFLX-US,NETFLIX INC : Press Release,NEWS_CR1/22/14,NFLX-US,Netflix Releases Fourth-Quarter 2013 Financial Results,PRN1/14/14,NFLX-US,Série original da Netflix baseada nas épicas aventuras de Marco Polo estreia no final de 2014,PRNL1/14/14,NFLX-US,Netflix estrenará serie original sobre las épicas aventuras de Marco Polo a finales del 2014,PRNL1/14/14,NFLX-US,Netflix Original Series Based on the Epic Adventures of Marco Polo to Premiere in Late 2014,PRNE1/13/14,NFLX-US,"""Lilyhammer"" volta à Netflix para uma terceira temporada",PRNL1/13/14,NFLX-US,"Netflix To Bring Back Original Series ""Lilyhammer"" For Third Season",PRN1/13/14,NFLX-US,"Lilyhammer, serie original de Netflix, volverá con una tercera temporada",PRNL1/8/14,NFLX-US,"Netflix, Inc.(NFLX-US) Schedules Q4 2013 Earnings Call for 22-January-2014 5:00 PM ET",FCSTTS1/8/14,NFLX-US,"Netflix, Inc.(NFLX-US) Schedules Q4 2013 Earnings Release for 22-January-2014 4:05 PM ET",FCSTTS1/8/14,NFLX-US,Netflix to Announce Fourth-Quarter 2013 Financial Results,PRN12/30/13,NFLX-US,Netflix Announces Termination of Stockholder Rights Plan,PRN12/30/13,NFLX-US,Netflix Finds More Than Half of Americans Willing To Trade Their Couches For Treadmills When Binge Watching In 2014,PRN12/16/13,NFLX-US,"""Breaking Bad"" Spin-off ""Better Call Saul"" Coming to Netflix Streaming Members Globally in 2014",PRN