Date,Symbol,Headline,Source11/17/20,NFLX-US,"Netflix, Inc.(NFLX-US) Schedules RBC Capital Markets Global Technology, Internet, Media and Telecommunications Conference for 17-November-2020 1:20 PM ET",FCSTEV11/6/20,NFLX-US,DJ Press Release: S&PGR Revises Netflix Inc. Outlook -2-,DJGM11/6/20,NFLX-US,DJ Press Release: S&PGR Revises Netflix Inc. Outlook To Positive; Affirms Rtgs,DJGM11/6/20,NFLX-US,Headline: DJ S&PGR Revises Netflix Inc. Outlook To Positive; Affirms Rtgs,DJGM10/20/20,NFLX-US,Netflix Q3 2020 Letter to Shareholders and Financial Results,NEWS_CR10/20/20,NFLX-US,DJ Press Release: Netflix Releases Third-Quarter 2020 Financial Results,DJGM10/20/20,NFLX-US,Netflix Releases Third-Quarter 2020 Financial Results,PRN10/20/20,NFLX-US,"Telefilm Canada Joins Netflix, the National Bank and Canada Media Fund as a Major Partner of the Fabienne Colas Foundation's Being Black in Canada Program",CNW10/9/20,NFLX-US,"DJ Moody's Announces Completion Of A Periodic Review Of Ratings Of Netflix, Inc.",DJGM9/22/20,NFLX-US,DJ Press Release: Xilam Animation's CGI Slapstick Comedy Trico Heading to Netflix,DJGM9/15/20,NFLX-US,"Netflix, Inc.(NFLX-US) Schedules Q3 2020 Earnings Call for 20-October-2020 6:00 PM ET",FCSTEV9/15/20,NFLX-US,"Netflix, Inc.(NFLX-US) Schedules Q3 2020 Earnings Release for 20-October-2020 4:00 PM ET",FCSTEV9/15/20,NFLX-US,DJ Press Release: Netflix to Announce Third-Quarter 2020 Financial Results,DJGM9/15/20,NFLX-US,Netflix to Announce Third-Quarter 2020 Financial Results,PRN9/9/20,NFLX-US,Is Direct-to-Consumer Media the Future of Digital Sport Content Delivery,PRNE7/28/20,NFLX-US,DJ Press Release: S&PGR Raises Netflix Ratings To -2-,DJGM7/28/20,NFLX-US,"Headline: DJ S&PGR Raises Netflix Ratings To 'BB' From 'BB-', Otlk Stable",DJGM7/28/20,NFLX-US,"DJ Press Release: S&PGR Raises Netflix Ratings To 'BB' From 'BB-', Otlk Stable",DJGM7/22/20,NFLX-US,DJ Press Release: New Cross-Industry Partnership Supports Expansion of Being Black in Canada,DJGM7/22/20,NFLX-US,New Cross-Industry Partnership Supports Expansion of Being Black in Canada,CNW7/16/20,NFLX-US,Netflix Q2 2020 Letter to Shareholders and Financial Results,NEWS_CR7/16/20,NFLX-US,DJ Press Release: Netflix Releases Second-Quarter 2020 Financial Results,DJGM7/16/20,NFLX-US,Netflix Releases Second-Quarter 2020 Financial Results,PRN7/13/20,NFLX-US,"DJ Press Release: Thinking about trading options or stock in Sorrento Therapeutics, Netflix, United Airlines, Royal Caribbean Cruises, or Plug Power?",DJGM6/15/20,NFLX-US,"Netflix, Inc.(NFLX-US) Schedules Q2 2020 Earnings Call for 16-July-2020 6:00 PM ET",FCSTEV6/15/20,NFLX-US,"Netflix, Inc.(NFLX-US) Schedules Q2 2020 Earnings Release for 16-July-2020 4:00 PM ET",FCSTEV6/15/20,NFLX-US,DJ Press Release: Netflix to Announce Second-Quarter 2020 Financial Results,DJGM6/15/20,NFLX-US,Netflix to Announce Second-Quarter 2020 Financial Results,PRN4/23/20,NFLX-US,DJ Press Release: Netflix Prices Offerings of Senior Notes,DJGM4/23/20,NFLX-US,Netflix Prices Offerings of Senior Notes,PRN4/23/20,NFLX-US,"Netflix, Inc.(NFLX-US) Schedules Annual General Meeting for 4-June-2020 6:00 PM ET",FCSTEV4/22/20,NFLX-US,"DJ Moody's Affirms Netflix's Ba3 Cfr, Changes Outlook To Positive",DJGM4/22/20,NFLX-US,DJ Press Release: S&PGR Rts Netflix Inc.'s Prpsd Sr Unsecured Notes 'BB-' (RR:3),DJGM4/22/20,NFLX-US,Headline: DJ S&PGR Rts Netflix Inc.'s Prpsd Sr Unsecured Notes 'BB-' (RR:3),DJGM4/22/20,NFLX-US,DJ Press Release: Netflix Announces Proposed $1.0 Billion Offering of Senior Notes,DJGM4/22/20,NFLX-US,Netflix Announces Proposed $1.0 Billion Offering of Senior Notes,PRN4/21/20,NFLX-US,Netflix Q1 2020 Letter to Shareholders and Financial Results,NEWS_CR4/21/20,NFLX-US,DJ Press Release: Netflix Releases First-Quarter 2020 Financial Results,DJGM4/21/20,NFLX-US,Netflix Releases First-Quarter 2020 Financial Results,PRN4/3/20,NFLX-US,Netflix: Gewinnträchtige #Stay-at-home Aktie oder etwa doch nicht?,NEWS_DGAP3/30/20,NFLX-US,"Thinking about trading options or stock in Advanced Micro Devices, Boeing, Johnson & Johnson, Netflix, or Square?",PRN3/20/20,NFLX-US,"Netflix, Inc.(NFLX-US) Schedules Q1 2020 Earnings Call for 21-April-2020 6:00 PM ET",FCSTEV3/20/20,NFLX-US,"Netflix, Inc.(NFLX-US) Schedules Q1 2020 Earnings Release for 21-April-2020 4:00 PM ET",FCSTEV3/20/20,NFLX-US,DJ Press Release: Netflix to Announce First-Quarter 2020 Financial Results,DJGM3/20/20,NFLX-US,Netflix to Announce First-Quarter 2020 Financial Results,PRN3/16/20,NFLX-US,"DJ Press Release: Thinking about trading options or stock in Biogen, Clorox, Centene, Netflix, or Walmart?",DJGM3/13/20,NFLX-US,DJ pressetext.de: Netflix-Werbung auf Bestell-Button unzulässig - vzbv-Klage stattgegeben - Hinweis auf Gratismonat lenkt von späteren Kosten für Abonnement ab,DJPA3/12/20,NFLX-US,"Coronavirus Sparks Interest in These Five Stocks: Chewy, Campbell Soup, Hormel Foods, Johnson & Johnson, and Netflix",PRN2/28/20,NFLX-US,"Netflix, Inc.(NFLX-US) Schedules Morgan Stanley Technology Media & Telecom Conference for 2-March-2020 2:45 PM ET",FCSTEV2/28/20,NFLX-US,"DJ Press Release: Netflix Chief Financial Officer to Present at the Morgan Stanley Technology, Media & Telecom Conference",DJGM2/28/20,NFLX-US,"Netflix Chief Financial Officer to Present at the Morgan Stanley Technology, Media & Telecom Conference",PRN2/19/20,NFLX-US,"DJ Press Release: S&PGR Report: Netflix, Tesla, Uber, And WeWork Set Fast Pace",DJGM2/19/20,NFLX-US,"Headline: DJ S&PGR Report: Netflix, Tesla, Uber, And WeWork Set Fast Pace",DJGM2/10/20,NFLX-US,DJ Press Release: Liberty Global Extends Partnership With Netflix Across Its European Footprint,DJGM1/24/20,NFLX-US,"Thinking about trading options or stock in Citrix Systems, Expedia, Netflix, TransDigm Group, or Teradyne?",PRN1/21/20,NFLX-US,Netflix Q4 2019 Letter to Shareholders and Financial Results,NEWS_CR1/21/20,NFLX-US,DJ Press Release: Netflix Releases Fourth-Quarter 2019 Financial Results,DJGM1/21/20,NFLX-US,Netflix Releases Fourth-Quarter 2019 Financial Results,PRN12/17/19,NFLX-US,"Big Brothers Big Sisters Enlists Netflix's Klaus To Answer 6,000 Holiday Wishes From Children Across The Country",PRN12/13/19,NFLX-US,"Netflix, Inc.(NFLX-US) Schedules Q4 2019 Earnings Call for 21-January-2020 6:00 PM ET",FCSTEV12/13/19,NFLX-US,"Netflix, Inc.(NFLX-US) Schedules Q4 2019 Earnings Release for 21-January-2020 4:00 PM ET",FCSTEV12/13/19,NFLX-US,DJ Press Release: Netflix to Announce Fourth-Quarter 2019 Financial Results,DJGM12/13/19,NFLX-US,Netflix to Announce Fourth-Quarter 2019 Financial Results,PRN12/3/19,NFLX-US,"Netflix, Inc.(NFLX-US) Schedules UBS Global TMT Conference for 10-December-2019 1:15 PM ET",FCSTEV12/3/19,NFLX-US,DJ Press Release: Netflix Chief Content Officer to Present at the UBS Global TMT Conference,DJGM12/3/19,NFLX-US,Netflix Chief Content Officer to Present at the UBS Global TMT Conference,PRN11/26/19,NFLX-US,"Thinking about trading options or stock in Amgen, The Medicines Company, Netflix, NVIDIA, or Charles Schwab?",PRN11/26/19,NFLX-US,DJ pressetext.de: Netflix darf Personal von Fox nicht abwerben - Klage wegen unlauterem Wettbewerb - Führungskräfte nach Disney-Übernahme unzufrieden,DJPA11/17/19,NFLX-US,DJ Press Release: TCL Electronics Renews Global Partnership with Netflix,DJGM10/24/19,NFLX-US,"DJ Press Release: Xilam Animation to Produce Oggy Oggy, Netflix's First French Animated Original Series",DJGM10/23/19,NFLX-US,"Netflix, Inc.(NFLX-US) Schedules ONWARD Conference for 29-October-2019",FCSTEV10/22/19,NFLX-US,DJ Press Release: Netflix Prices Offerings of Senior Notes,DJGM10/22/19,NFLX-US,Netflix Prices Offerings of Senior Notes,PRN10/21/19,NFLX-US,DJ Moody's Assigns Ba3 Rating To Netflix's Proposed Notes Offering,DJGM10/21/19,NFLX-US,DJ Press Release: S&PGR Rates Netflix $2B (US$/EUR Tranches) Unsecd Nts 'BB-',DJGM10/21/19,NFLX-US,Headline: DJ S&PGR Rates Netflix $2B (US$/EUR Tranches) Unsecd Nts 'BB-',DJGM10/21/19,NFLX-US,DJ Press Release: Netflix Announces Proposed $2.0 Billion Offering of Senior Notes,DJGM10/21/19,NFLX-US,Netflix Announces Proposed $2.0 Billion Offering of Senior Notes,PRN10/16/19,NFLX-US,Netflix Q3 2019 Letter to Shareholders and Financial Results,NEWS_CR10/16/19,NFLX-US,Netflix Releases Third-Quarter 2019 Financial Results,PRN9/20/19,NFLX-US,"INVESTOR ALERT - Netflix, Inc. (NFLX) - Bronstein, Gewirtz & Grossman, LLC Notifies Shareholders of Class Action and Lead Deadline: September 20, 2019",PMZ9/18/19,NFLX-US,"The Klein Law Firm Reminds Investors of Class Actions on Behalf of Shareholders of NFLX, CARB, TWOU and SRPT",PMZ9/17/19,NFLX-US,"CLASS ACTION UPDATE for NFLX, KPTI, GTT and EVH: Levi & Korsinsky, LLP Reminds Investors of Class Actions on Behalf of Shareholders",PMZ9/16/19,NFLX-US,"Netflix, Inc.(NFLX-US) Schedules Q3 2019 Earnings Call for 16-October-2019 6:00 PM ET",FCSTEV9/16/19,NFLX-US,"Netflix, Inc.(NFLX-US) Schedules Q3 2019 Earnings Release for 16-October-2019 4:00 PM ET",FCSTEV9/16/19,NFLX-US,Netflix to Announce Third-Quarter 2019 Financial Results,PRN9/15/19,NFLX-US,"FRIDAY DEADLINE ALERT: The Schall Law Firm Announces the Filing of a Class Action Lawsuit Against Netflix, Inc. and Encourages Investors with Losses in Excess of $100,000 to Contact the Firm",PMZ9/12/19,NFLX-US,"ROSEN, A GLOBALLY RECOGNIZED LAW FIRM, Reminds Netflix, Inc. Investors of Important September 20th Deadline in Securities Class Action First Filed by the Firm - NFLX",PMZ9/6/19,NFLX-US,"ROSEN, A LEADING LAW FIRM, Reminds Netflix, Inc. Investors of Important September 20th Deadline in Securities Class Action First Filed by the Firm; Investors with Losses in Excess of $1 Million Are Encouraged to Contact Firm - NFLX",PMZ9/5/19,NFLX-US,SHAREHOLDER ALERT: VNTR RLGY NFLX NGHC: The Law Offices of Vincent Wong Reminds Investors of Important Class Action Deadlines,PMZ9/4/19,NFLX-US,"LEAD PLAINTIFF DEADLINE ALERT: Faruqi & Faruqi, LLP Encourages Investors Who Suffered Losses Exceeding $500,000 Investing In Netflix, Inc. To Contact The Firm",PMZ9/4/19,NFLX-US,"The Klein Law Firm Reminds Investors of Class Actions on Behalf of Shareholders of VNTR, NFLX, EGBN and GTT",PMZ8/24/19,NFLX-US,"SHAREHOLDER ALERT:  Pomerantz Law Firm Reminds Shareholders with Losses on their Investment in Netflix, Inc. of Class Action Lawsuit and Upcoming Deadline - NFLX",PRN8/23/19,NFLX-US,"FILING DEADLINE--Kuznicki Law PLLC Announces Class Actions on Behalf of Shareholders of NFLX, EGBN and GVA",NEWS_ACW8/23/19,NFLX-US,"Helius Medical Technologies, Inc. (HSDT), Ideanomics Inc. (IDEX) & Netflix, Inc. (NFLX) -Bronstein, Gewirtz & Grossman, LLC - Class Action Update",PMZ8/18/19,NFLX-US,"The Klein Law Firm Reminds Investors of Class Actions on Behalf of Shareholders of RBGLY, NFLX and CVS",NEWS_ACW8/15/19,NFLX-US,"SHAREHOLDER ALERT:  Pomerantz Law Firm Reminds Shareholders with Losses on their Investment Netflix, Inc. of Class Action Lawsuit and Upcoming Deadline - NFLX",PMZ8/15/19,NFLX-US,"CLASS ACTION UPDATE for NFLX, PS and IFF: Levi & Korsinsky, LLP Reminds Investors of Class Actions on Behalf of Shareholders",NEWS_ACW8/15/19,NFLX-US,"The Klein Law Firm Reminds Investors of Class Actions on Behalf of Shareholders of NFLX, PS and IFF",NEWS_ACW8/15/19,NFLX-US,"The Klein Law Firm Reminds Investors of Class Actions on Behalf of Shareholders of STG, NFLX, LB and PS",PMZ8/14/19,NFLX-US,"CLASS ACTION UPDATE for STG, NFLX, LB and TWOU: Levi & Korsinsky, LLP Reminds Investors of Class Actions on Behalf of Shareholders",PMZ8/13/19,NFLX-US,"The Klein Law Firm Reminds Investors of Class Actions on Behalf of Shareholders of NFLX, KPTI, NGHC and TWOU",PMZ8/11/19,NFLX-US,"Bragar Eagel & Squire, P.C. Reminds Investors That Class Action Lawsuits Have Been Filed Against Netflix, EQT, Eagle Bancorp, and Karyopharm and Encourages Investors to Contact the Firm",PMZ8/9/19,NFLX-US,"SHAREHOLDER ALERT:  Pomerantz Law Firm Reminds Shareholders with Losses on their Investment Netflix, Inc. of Class Action Lawsuit and Upcoming Deadline - NFLX",PMZ8/9/19,NFLX-US,"ROSEN, A TOP RANKED LAW FIRM, Reminds Netflix, Inc. Investors of Important September 20th Deadline in Securities Class Action First Filed by the Firm - NFLX",PMZ8/9/19,NFLX-US,"Pivotal Software, Inc. (PVTL), Ideanomics Inc. (IDEX) & Netflix, Inc. (NFLX) - Class Action Reminder - Bronstein, Gewirtz & Grossman, LLC",PMZ8/7/19,NFLX-US,SHAREHOLDER ALERT: DBD NFLX EGBN: The Law Offices of Vincent Wong Reminds Investors of Important Class Action Deadlines,NEWS_ACW8/7/19,NFLX-US,"The Klein Law Firm Reminds Investors of Class Actions on Behalf of Shareholders of CTST, NFLX, NGHC and CURLF",PMZ8/5/19,NFLX-US,"SHAREHOLDER ALERT: Pomerantz Law Firm Reminds Shareholders with Losses on their Investment Netflix, Inc. of Class Action Lawsuit and Upcoming Deadline - NFLX",PMZ8/5/19,NFLX-US,"""Ang Babaeng Allergic Sa WiFi"" Hits Netflix This August",PRN8/2/19,NFLX-US,"ROSEN, A HIGHLY RANKED LAW FIRM, Files First Securities Class Action Lawsuit Against Netflix, Inc.; Encourages Investors with Losses in Excess of $750K to Contact the Firm - NFLX",PMZ7/31/19,NFLX-US,"Bragar Eagel & Squire, P.C. Announces That a Class Action Lawsuit Has Been Filed Against Netflix, Inc. (NASDAQ: NFLX) and Encourages Netflix Investors to Contact the Firm",PMZ7/31/19,NFLX-US,"ROSEN, A LEADING LAW FIRM, Files First Securities Class Action Lawsuit Against Netflix, Inc.; Encourages Investors with Losses in Excess of $1 Million to Contact the Firm   - NFLX",PRN7/31/19,NFLX-US,"Pomerantz Law Firm Announces the Filing of a Class Action against Netflix, Inc. and Certain Officers - NFLX",PMZ7/31/19,NFLX-US,"CLASS ACTION UPDATE for NFLX, NGHC and MNK: Levi & Korsinsky, LLP Reminds Investors of Class Actions on Behalf of Shareholders",NEWS_ACW7/30/19,NFLX-US,"The Gross Law Firm Announces Class Actions on Behalf of Shareholders of HRTX, NFLX and LB",NEWS_ACW7/29/19,NFLX-US,"Deadline Reminder: The Law Offices of Howard G. Smith Reminds Investors of Looming Deadline in the Class Action Lawsuit Against Netflix, Inc.",BW7/29/19,NFLX-US,"FILING DEADLINE--Kuznicki Law PLLC Announces Class Actions on Behalf of Shareholders of BOX, BUD, NFLX and LB",PMZ7/26/19,NFLX-US,SHAREHOLDER ALERT: BE RMED NFLX: The Law Offices of Vincent Wong Reminds Investors of Important Class Action Deadlines,NEWS_ACW7/26/19,NFLX-US,"Lifshitz & Miller LLP Announces Investigation of Anheuser-Busch Companies LLC, Cadence Corporation, CannTrust Holdings, Inc., Carolina Trust BancShares, Inc., Carrizo Oil & Gas, Inc., Netflix, Inc., Sealed Air Corporation, and Tower International, Inc.",PRN7/25/19,NFLX-US,"FILING DEADLINE--Kuznicki Law PLLC Announces Class Actions on Behalf of Shareholders of RMED, OMCL and NFLX",NEWS_ACW7/23/19,NFLX-US,"Glancy Prongay & Murray LLP Announces the Filing of a Securities Class Action on Behalf of Netflix, Inc. Investors",BW7/23/19,NFLX-US,"LEAD PLAINTIFF DEADLINE ALERT: Faruqi & Faruqi, LLP Encourages Investors Who Suffered Losses Exceeding $500,000 Investing In Netflix, Inc. To Contact The Firm",PRN7/23/19,NFLX-US,"INVESTOR ALERT: Law Offices of Howard G. Smith Announces the Filing of a Securities Class Action on Behalf of Netflix, Inc. Investors (NFLX)",BW7/23/19,NFLX-US,"CLASS ACTION UPDATE for HL, BUD, CTST and NFLX: Levi & Korsinsky, LLP Reminds Investors of Class Actions on Behalf of Shareholders",PMZ7/22/19,NFLX-US,"Glancy Prongay & Murray LLP Announces Investigation on Behalf of Netflix, Inc. Investors (NFLX)",BW7/22/19,NFLX-US,"INVESTOR ALERT: Law Offices of Howard G. Smith Announces Investigation on Behalf of Netflix, Inc. Investors (NFLX)",BW7/22/19,NFLX-US,"IMPORTANT INVESTOR ALERT: The Schall Law Firm Announces the Filing of a Class Action Lawsuit Against Netflix, Inc. and Encourages Investors with Losses in Excess of $100,000 to Contact the Firm",BW7/19/19,NFLX-US,"INVESTIGATION ALERT: The Schall Law Firm Announces it is Investigating Claims Against Netflix, Inc. and Encourages Investors with Losses in Excess of $100,000 to Contact the Firm",BW7/19/19,NFLX-US,"EQUITY ALERT: Rosen Law Firm Announces Investigation of Securities Claims Against Netflix, Inc. - NFLX",BW7/17/19,NFLX-US,Netflix Q2 2019 Letter to Shareholders and Financial Results,NEWS_CR7/17/19,NFLX-US,Netflix Releases Second-Quarter 2019 Financial Results,PRN7/12/19,NFLX-US,Jackie Lee-Joe named Netflix Chief Marketing Officer,PRN7/9/19,NFLX-US,"Thinking about buying stock in Beyond Meat, Check-Cap, Micron Technology, Netflix, or Uber Technologies?",PRN7/4/19,NFLX-US,"DJ pressetext.de: Auf Netflix wird zuviel geraucht - Vor allem ""Stranger Things"" zeigt oft Zigaretten - Streaming-Plattform verspricht Mäßigung",DJPA6/28/19,NFLX-US,The Latinx Millennial Love Affair with Netflix: New Horowitz Research Reveals How and Why the Streaming Service Dominates in Terms of Viewing and Appeal - But for How Long,PRN6/14/19,NFLX-US,"Netflix, Inc.(NFLX-US) Schedules Q2 2019 Earnings Call for 17-July-2019 6:00 PM ET",FCSTEV6/14/19,NFLX-US,"Netflix, Inc.(NFLX-US) Schedules Q2 2019 Earnings Release for 17-July-2019 4:00 PM ET",FCSTEV6/14/19,NFLX-US,Netflix to Announce Second-Quarter 2019 Financial Results,PRN6/6/19,NFLX-US,"Netflix, Inc.(NFLX-US) Schedules Presto Summit for 20-June-2019",FCSTEV5/27/19,NFLX-US,"XILAM ANIMATION ANNONCE UN ACCORD DE DISTRIBUTION MONDIAL AVEC NETFLIX POUR J'AI PERDU MON CORPS, GRAND PRIX DE LA SEMAINE DE LA CRITIQUE A CANNES",BW5/27/19,NFLX-US,"Xilam Animation Announces a Global Acquisition Agreement with Netflix for I Lost My Body, Winner of the International Critics' Week Grand Prize at Cannes",BW4/24/19,NFLX-US,Netflix Prices Offerings of Senior Notes,PRN4/24/19,NFLX-US,"Netflix, Inc.(NFLX-US) Schedules Annual General Meeting for 6-June-2019 6:00 PM ET",FCSTEV4/23/19,NFLX-US,Netflix Announces Proposed $2.0 Billion Offering of Senior Notes,PRN4/17/19,NFLX-US,"Option-trading opportunities on Boston Scientific Corp., DowDuPont Inc., HP Inc., Marvell Technology, and Netflix Inc.",PRN4/16/19,NFLX-US,Netflix Q1 2019 Letter to Shareholders and Financial Results,NEWS_CR4/16/19,NFLX-US,Netflix Releases First-Quarter 2019 Financial Results,PRN4/16/19,NFLX-US,"Netflix, Inc.(NFLX-US) Schedules ConnecTechAsia Summit for 18-June-2019",FCSTEV3/26/19,NFLX-US,Consumers Demand Innovative Over-The-Top Solutions for Media Sharing,PRN3/14/19,NFLX-US,"Netflix, Inc.(NFLX-US) Schedules Gartner IT Symposium for 3-June-2019",FCSTEV3/14/19,NFLX-US,"Netflix, Inc.(NFLX-US) Schedules Q1 2019 Earnings Call for 16-April-2019 6:00 PM ET",FCSTEV3/14/19,NFLX-US,"Netflix, Inc.(NFLX-US) Schedules Q1 2019 Earnings Release for 16-April-2019 4:00 PM ET",FCSTEV3/14/19,NFLX-US,Netflix to Announce First-Quarter 2019 Financial Results,PRN2/21/19,NFLX-US,"Research Report Identifies Netflix, Fortive, CareTrust REIT, World Acceptance, AxoGen, and Willis Towers Watson Public with Renewed Outlook - Fundamental Analysis, Calculating Forward Movement",PMZ2/19/19,NFLX-US,Netflix Co-Founder Marc Randolph Returns to HPU to Mentor Students,PMZ1/17/19,NFLX-US,Netflix Q4 2018 Letter to Shareholders and Financial Results,NEWS_CR1/17/19,NFLX-US,Netflix Releases Fourth-Quarter 2018 Financial Results,PRN1/3/19,NFLX-US,"Netflix, Inc.(NFLX-US) Schedules Data Science Leaders Summit for 23-May-2019",FCSTEV1/2/19,NFLX-US,Spencer Neumann named Netflix Chief Financial Officer,PRN12/20/18,NFLX-US,"Netflix, Inc.(NFLX-US) Schedules Q4 2018 Earnings Call for 17-January-2019 6:00 PM ET",FCSTEV12/20/18,NFLX-US,"Netflix, Inc.(NFLX-US) Schedules Q4 2018 Earnings Release for 17-January-2019 4:00 PM ET",FCSTEV12/20/18,NFLX-US,Netflix to Announce Fourth-Quarter 2018 Financial Results,PRN12/10/18,NFLX-US,Research Shows the U.S. Film Industry Growth Outpaces the Overall Economy,PRN11/27/18,NFLX-US,"Netflix, Inc.(NFLX-US) Schedules UBS Global Media and Communications Conference for 3-December-2018 1:00 PM ET",FCSTEV11/27/18,NFLX-US,Netflix Chief Content Officer to Present at the UBS 46th Annual Global Media and Communications Conference,PRN11/27/18,NFLX-US,"Option-trading opportunities on Adobe Systems, Alibaba, Micron, Netflix, and Tesla Motors",PRN10/23/18,NFLX-US,Netflix Prices Offerings of Senior Notes,PRN10/22/18,NFLX-US,Netflix Announces Proposed $2.0 Billion Offering of Senior Notes,PRN10/18/18,NFLX-US,"Thinking about buying stock in Alibaba Group, Caesars Entertainment Corporation, Netflix, Vale S.A, or Yulong Eco-Materials",PRN10/16/18,NFLX-US,Netflix Q3 2018 Letter to Shareholders and Financial Results,NEWS_CR10/16/18,NFLX-US,Netflix Releases Third-Quarter 2018 Financial Results,PRN10/12/18,NFLX-US,"Netflix, Inc.(NFLX-US) Schedules Aurea Experience Conference for 12-November-2018",FCSTEV10/9/18,NFLX-US,"Netflix, Inc.(NFLX-US) Schedules Carbon Black Connect Conference for 10-October-2018",FCSTEV10/3/18,NFLX-US,"Netflix, Inc.(NFLX-US) Schedules Hollywood Innovation & Technology Society Fall Conference for 4-October-2018",FCSTEV9/18/18,NFLX-US,"Netflix, Inc.(NFLX-US) Schedules Deutsche Bank Leveraged Financial Conference for 2-October-2018",FCSTEV9/18/18,NFLX-US,Mathias Döpfner Appointed to Netflix Board of Directors,PRN9/14/18,NFLX-US,"Netflix, Inc.(NFLX-US) Schedules Q3 2018 Earnings Release for 16-October-2018 4:05 PM ET",FCSTEV9/14/18,NFLX-US,"Netflix, Inc.(NFLX-US) Schedules Q3 2018 Earnings Call for 16-October-2018 6:00 PM ET",FCSTEV9/14/18,NFLX-US,Netflix to Announce Third-Quarter 2018 Financial Results,PRN9/12/18,NFLX-US,Global Entertainment Market Expands With Robust International Growth,PRN8/29/18,NFLX-US,"Vern_ Myers Joins Netflix as Vice President, Inclusion Strategy",PRN8/27/18,NFLX-US,Rachel Whetstone Named Netflix Chief Communications Officer,PRN8/13/18,NFLX-US,David Wells to Step Down as Netflix Chief Financial Officer,PRN7/31/18,NFLX-US,Grab a Box of Tissues and Watch as Real Fathers & Daughters With Complex Relationships Reconnect and Talk About How They May Be More Alike Than They Think,BW7/23/18,NFLX-US,Reel Cash Brings Full Transparency to Streaming Services Ratings for the Benefit of Subscribers and Talent Worldwide,BW7/17/18,NFLX-US,Netflix Announces First Slate Of Series And Films Based On The Stories Of Mark Millar,PRN7/16/18,NFLX-US,Netflix Q2 2018 Letter to Shareholders and Financial Results,NEWS_CR7/16/18,NFLX-US,Netflix Releases Second-Quarter 2018 Financial Results,PRN6/22/18,NFLX-US,Netflix 'Sets Up' Fun MLB Ballpark Promotions,PRN6/14/18,NFLX-US,"Netflix, Inc.(NFLX-US) Schedules Q2 2018 Earnings Call for 16-July-2018 6:00 PM ET",FCSTEV6/14/18,NFLX-US,"Netflix, Inc.(NFLX-US) Schedules Q2 2018 Earnings Release for 16-July-2018 4:05 PM ET",FCSTEV6/14/18,NFLX-US,Netflix to Announce Second-Quarter 2018 Financial Results,PRN5/24/18,NFLX-US,Telefónica to integrate Netflix service into its TV and video platforms,NEWS_CR5/14/18,NFLX-US,"All-New Horror Anthology Series GUILLERMO DEL TORO PRESENTS 10 AFTER MIDNIGHT, From The Acclaimed Academy Award-Winning Filmmaker, Coming Soon To Netflix",PRN5/8/18,NFLX-US,"Netflix, Inc.(NFLX-US) Schedules MoffettNathanson Media & Communications Summit for 14-May-2018 1:00 PM ET",FCSTTS5/8/18,NFLX-US,Netflix Chief Content Officer to Present at the MoffettNathanson 5th Annual Media and Communications Summit,PRN4/24/18,NFLX-US,"Netflix, Inc.(NFLX-US) Schedules Annual General Meeting for 6-June-2018 6:00 PM ET",FCSTEV4/23/18,NFLX-US,Netflix Prices $1.9 Billion Offering of Senior Notes,PRN4/23/18,NFLX-US,Netflix Announces Proposed $1.5 Billion Offering of Senior Notes,PRN4/17/18,NFLX-US,"New Research: Key Drivers of Growth for Mattel, Sprint, Charter Communications, Equifax, Netflix, and Whiting Petroleum - Factors of Influence, Major Initiatives and Sustained Production",PMZ4/16/18,NFLX-US,Netflix Q1 2018 Letter to Shareholders and Financial Results,NEWS_CR4/16/18,NFLX-US,Netflix Releases First-Quarter 2018 Financial Results,PRN4/13/18,NFLX-US,Comcast and Netflix Expand Partnership Following Successful Xfinity X1 Integration,BW3/28/18,NFLX-US,Ambassador Susan E. Rice Appointed to Netflix Board of Directors,PRN3/16/18,NFLX-US,"Netflix, Inc.(NFLX-US) Schedules Q1 2018 Earnings Release for 16-April-2018 4:05 PM ET",FCSTEV3/16/18,NFLX-US,"Netflix, Inc.(NFLX-US) Schedules Q1 2018 Earnings Call for 16-April-2018 6:00 PM ET",FCSTTS3/16/18,NFLX-US,Netflix to Announce First-Quarter 2018 Financial Results,PRN2/23/18,NFLX-US,"Netflix, Inc.(NFLX-US) Schedules Morgan Stanley Technology, Media & Telecom Conference for 27-February-2018 1:15 PM ET",FCSTTS2/23/18,NFLX-US,"Netflix Chief Financial Officer to Present at the Morgan Stanley Technology, Media & Telecom Conference",PRN2/13/18,NFLX-US,2018's Best Resolution: Netflix on 100% Fiber-optic Verizon Fios,PMZ1/30/18,NFLX-US,DJ pressetext.de: Netflix soll Bevölkerung bei Gefahrenlage warnen - US-Republikaner wollen Eilmeldungen wie bei Kabel-TV integrieren,DJPA1/22/18,NFLX-US,Netflix Q4 2017 Letter to Shareholders and Financial Results,NEWS_CR1/22/18,NFLX-US,Rodolphe Belmer To Join Netflix Board Of Directors,PRN1/22/18,NFLX-US,Netflix Releases Fourth-Quarter 2017 Financial Results,PRN1/5/18,NFLX-US,"Netflix, Inc.(NFLX-US) Schedules Citi Global TMT West Conference for 9-January-2018 5:45 PM ET",FCSTTS12/15/17,NFLX-US,"Netflix, Inc.(NFLX-US) Schedules Q4 2017 Earnings Release for 22-January-2018 4:05 PM ET",FCSTEV12/15/17,NFLX-US,"Netflix, Inc.(NFLX-US) Schedules Q4 2017 Earnings Call for 22-January-2018 6:00 PM ET",FCSTTS12/15/17,NFLX-US,Netflix to Announce Fourth-Quarter 2017 Financial Results,PRN11/29/17,NFLX-US,"Netflix, Inc.(NFLX-US) Schedules UBS Global Media and Communications Conference for 4-December-2017 12:00 PM ET",FCSTTS11/29/17,NFLX-US,Netflix Chief Content Officer to Present at the UBS 45th Annual Global Media and Communications Conference,PRN