Date,Symbol,Headline,Source9/5/12,NFLX-US,"Stocks Gaining Special Attention: Netflix (NFLX), Nokia Corporation (NOK), Yelp Inc, Amazon.com, Zynga Inc",NEWS_ACW9/4/12,NFLX-US,"Netflix, Inc.(NFLX-US) Schedules Bank of America Merrill Lynch Media, Communications & Entertainment Conference for 13-September-2012 6:15 PM ET",FCSTEV9/4/12,NFLX-US,"Netflix, Inc.(NFLX-US) Schedules Goldman Sachs Communacopia Conference for 19-September-2012 8:50 AM ET",FCSTEV9/4/12,NFLX-US,Netflix Announces Upcoming Schedule of Events with the Financial Community,PRN8/29/12,NFLX-US,"Special Equity News On Amazon.com, Netflix, Baidu.com",NEWS_ACW8/23/12,NFLX-US,Netflix And RADiUS-TWC Announce Multi-Year Output Deal In The United States To Bring Diverse Slate To Widest Possible Audience,PRN8/20/12,NFLX-US,UK And Ireland Embrace Netflix,PRN8/16/12,NFLX-US,Now Trending On Netflix ... Stand-up Comedy,PRN8/14/12,NFLX-US,"Netflix To Launch In Norway, Denmark, Sweden And Finland In Late 2012",PRN8/8/12,NFLX-US,"Netflix ""Just for Kids"" Now Available On XBOX 360",PRN8/5/12,NFLX-US,NIA Reports on NBC Breaking 'TV Everywhere' Record for Olympics,PRN8/1/12,NFLX-US,Current and Former Netflix Subscribers Could Be Affected by A Class Action Settlement,PRN7/26/12,NFLX-US,"Consumer Reports Survey: Most Viewers Rely On Netflix, But Streaming Rivals Are More Satisfying",PRN7/24/12,NFLX-US,Netflix Releases Second-Quarter 2012 Financial Results,PRN7/24/12,NFLX-US,thredUP Adds Former Netflix Executives to Upgrade Operations Team,BW7/23/12,NFLX-US,Kelly Bennett Joins Netflix as Chief Marketing Officer,PRN7/10/12,NFLX-US,Research and Markets: Netflix Inc: Can it succeed in the UK? - Netflix Expanded To the UK in January 2012,BW7/9/12,NFLX-US,"The Zacks Analyst Blog Highlights: Netflix, Facebook, Amazon.com,Comcast and Dish Network",PRN7/6/12,NFLX-US,"Daily Stocks Highlight by Pennystocksinsiders.com: Netflix, AT&T, Caterpillar, Walgreen, Avon Products, and Coach",PRN7/5/12,NFLX-US,"The Zacks Analyst Blog Highlights: Dish Network, AMC Networks, Netflix, Time Warner Cable and Comcast",PRN7/3/12,NFLX-US,"Netflix, Inc.(NFLX-US) Schedules Q2 2012 Earnings Release for 24-July-2012",FCSTEV7/3/12,NFLX-US,"Netflix, Inc.(NFLX-US) Schedules Q2 2012 Earnings Call for 24-July-2012 6:00 PM ET",FCSTEV7/3/12,NFLX-US,Netflix to Announce Second-Quarter 2012 Financial Results,PRN6/28/12,NFLX-US,Peel Introduces AllPlay TV Feature,PRN6/27/12,NFLX-US,"New Season of ""Arrested Development"" Coming Exclusively to Netflix UK and Ireland; Netflix to Offer Members More Complete Seasons of Great Twentieth Century Fox TV Shows",PRN6/19/12,NFLX-US,Netflix Watch Instantly Cannibalizes Pay-TV VOD & Premium Channels Thanks to Lower Costs and Better Availability,PRN6/14/12,NFLX-US,Netflix Appoints Bill Holmes to New Role of Chief Business Development Officer,PRN6/12/12,NFLX-US,Hunger Games Coming to Netflix Latin America August 18,PRN6/12/12,NFLX-US,"""Los juegos del hambre"" llega a Netflix el 18 de agosto",PRNL6/12/12,NFLX-US,Jogos Vorazes chega à Netflix em 18 de agosto,PRNL6/11/12,NFLX-US,Complete Previous Seasons of Pretty Little Liars and The Lying Game Coming Exclusively to Netflix,PRN6/8/12,NFLX-US,"The Zacks Analyst Blog Highlights: Netflix, Akamai Technologies, Limelight Networks, Level 3 Communications and Amazon.com",PRN6/8/12,NFLX-US,"Zacks' Voice of the People highlights opportunities with First Solar, Avon Products and NetFlix",PRN6/6/12,NFLX-US,Netflix presenta su oferta de contenidos del Ultimate Fighting Championship® para Latinoamérica,PRNL6/5/12,NFLX-US,Netflix Selects Intequus as Systems Integrator for Open Connect Initiative,PRN5/31/12,NFLX-US,"Netflix, Inc.(NFLX-US) Schedules Annual General Meeting for 1-June-2012 6:00 PM ET",FCSTEV5/29/12,NFLX-US,"The Zacks Analyst Blog Highlights: Amazon.com, CBS, Disney, Viacom and Netflix",PRN5/28/12,NFLX-US,Netflix Expands Ultimate Fighting Championship® Content Offering In Canada,CNW5/25/12,NFLX-US,"Conditions of Growth, Economic Analysis - Research Report on Netflix, Inc. and Chesapeake Energy Corporation ",INW5/23/12,NFLX-US,Sandvine CTO: Netflix Traffic Share Has Peaked,CNW5/22/12,NFLX-US,"Netflix Names Cindy Holland to new role as VP Original Content. Jason Ropell, VP Content Acquisition, takes charge of domestic television licensing for the U.S. market",PRN5/14/12,NFLX-US,"The Zacks Analyst Blog Highlights: Activision, Electronic Arts, Microsoft, Zynga and Netflix",PRN5/14/12,NFLX-US,"Most Active Stocks: Magnum Hunter, Zynga, Netflix, Freeport-McMoRan, Verizon, and Monster Worldwide",PRN5/14/12,NFLX-US,"""Being Elmo: A Puppeteer's Journey"" is available exclusively to Netflix members beginning May 14",CNW5/9/12,NFLX-US,Netflix and Twentieth Century Fox Announce Multi-Year Premium Pay TV Agreement in Latin America and Brazil,PRN5/9/12,NFLX-US,Netflix y Twentieth Century Fox anuncian un acuerdo de TV paga premium por varios años en Latinoamérica y Brasil,PRNL5/9/12,NFLX-US,Netflix e Twentieth Century Fox assinam contrato de vários anos de TV premium na América Latina e no Brasil,PRNL5/2/12,NFLX-US,"Netflix, Inc.(NFLX-US) Schedules Nomura U.S. Media & Telecom Summit for 30-May-2012 2:00 PM ET",FCSTEV5/2/12,NFLX-US,How to Spread Bet Falling Netflix Shares Following Apple Conflict,PRN5/1/12,NFLX-US,Netflix Announces Upcoming Schedule of Events with the Financial Community,PRN5/1/12,NFLX-US,"Today's Hot Stocks: Kraft Foods, UnitedHealth Group, Netflix, SandRidge Energy, Arch Coal, and Gen-Probe",PRN4/24/12,NFLX-US,"Research Reports for Amylin Pharmaceuticals, Melco Crown Entertainment, Advanced Micro Devices, Halliburton, Petroleo Brasileiro SA, and Netflix",PRN4/23/12,NFLX-US,Netflix Releases First-Quarter 2012 Financial Results,PRN4/23/12,NFLX-US,"Zacks Bull and Bear of the Day Highlights: CBS, Dril-Quip, Netflix, Amazon.com and Verizon Communications",PRN4/12/12,NFLX-US,"Netflix, Inc.(NFLX-US) Schedules J.P. Morgan Global Technology, Media and Telecom Conference for 16-May-2012 8:40 AM ET",FCSTEV4/11/12,NFLX-US,"Netflix Brings TV Shows and Movies to Windows Phone in Latin America, UK and Ireland",PRN4/5/12,NFLX-US,Hasbro Studios Signs Multi-Year Deal with Netflix to Provide Its Award-Winning Content across Multiple Platforms in the U.S.,BW4/2/12,NFLX-US,"Netflix, Inc.(NFLX-US) Schedules Q1 2012 Earnings Call for 23-April-2012 6:00 PM ET",FCSTEV4/2/12,NFLX-US,"Netflix, Inc.(NFLX-US) Schedules Q1 2012 Earnings Release for 23-April-2012",FCSTEV4/2/12,NFLX-US,Netflix to Announce First-Quarter 2012 Financial Results,PRN3/29/12,NFLX-US,More Than 40 Per Cent of Canadian Children Have Been Accidentally Exposed to Inappropriate Content on Television,CNW3/27/12,NFLX-US,DHX Media and Netflix Strike Kids' Content Deal,CNW3/21/12,NFLX-US,"Only on Netflix: Premier Horror Suspense Director Eli Roth Reanimates the Gothic Novel With ""Hemlock Grove""",PRN3/21/12,NFLX-US,Research and Markets: (NFLX) Netflix Inc. - Quantitative Valuation Report 2012,BW3/21/12,NFLX-US,Research and Markets: Gauging Consumer Reaction to Netflix's New Pricing Strategy - A Primary Research Perspective,BW3/12/12,NFLX-US,"Netflix ""Just for Kids"" Now Available on PlayStation® 3",PRN3/2/12,NFLX-US,Pomerantz Law Firm Reminds Shareholders of Netflix of Upcoming Deadline -- NFLX,PMZ2/29/12,NFLX-US,"Research and Markets: Netflix, Inc. - Strategy and SWOT Report - Detailed information on Netflix, Inc. required for Business and Competitor Intelligence Needs",BW2/25/12,NFLX-US,"Glancy Binkow & Goldberg LLP Announces Lead Plaintiff Deadline In The Class Action Lawsuit Against Netflix, Inc.",BW2/22/12,NFLX-US,"Critical Stock Alerts: MGM Resorts International, Kraft Foods, Threshold Pharmaceuticals, Netflix, and Cabot Oil & Gas",PRN2/22/12,NFLX-US,Netflix Brings TV Shows and Movies to PlayStation® Vita,PRN2/21/12,NFLX-US,"Netflix and The Weinstein Company Announce Multi-Year Film Agreement to Include 2012 Academy Award Nominee ""The Artist""",PRN2/21/12,NFLX-US,Netflix is Biggest E-Commerce Loser as Competition Ramps Up According to American Customer Satisfaction Index,PRN2/17/12,NFLX-US,Pomerantz Law Firm Reminds Shareholders of Netflix of Upcoming Deadline -- NFLX,PMZ2/7/12,NFLX-US,"Netflix, Inc.(NFLX-US) Schedules Morgan Stanley Technology, Media & Telecom Conference for 28-February-2012 2:30 PM ET",FCSTEV2/7/12,NFLX-US,"Newman Ferrara LLP Pursues Securities Fraud Claims Against Netflix, Inc. and Reminds Investors of March 13, 2012 Deadline",BW2/7/12,NFLX-US,"Netflix CEO to Present at the Morgan Stanley Technology, Media & Telecom Conference",PRN2/7/12,NFLX-US,Co-Founder of Netflix Set to Speak at Southeast Venture Conference 2012 in Northern Virginia ,INW2/6/12,NFLX-US,"A Netflix Original Series, ""Lilyhammer"" Available Now on Netflix",PRN2/6/12,NFLX-US,Hagens Berman Reminds Investors Thirty-six Days Remain Before March 13 Deadline in Case Against Netflix,PRN2/3/12,NFLX-US,Pomerantz Law Firm Reminds Shareholders of Netflix of Upcoming Deadline -- NFLX,PMZ2/2/12,NFLX-US,"Em NYC, Premiere de 'Lilyhammer', uma Serie Netflix Original, Resulta em uma Noite Repleta de Estrelas",PRNL2/2/12,NFLX-US,"Estreno en la Ciudad de Nueva York de ""Lilyhammer"", una serie original de Netflix, termina en una velada llena de estrellas",PRNL1/27/12,NFLX-US,Pomerantz Law Firm Has Filed a Class Action Against Netflix - NFLX,PMZ1/27/12,NFLX-US,"Hagens Berman Continues Netflix Investigation, Reminds Investors of March 13, 2012, Deadline",BW1/26/12,NFLX-US,Co-founder of Netflix Delivers Keynote at the 6th Annual Southeast Venture Conference,PRN1/25/12,NFLX-US,Netflix Releases Fourth-Quarter 2011 Financial Results,PRN1/25/12,NFLX-US,Shareholder Claims Against Netflix Board Investigated by Goldfarb Branham LLP Securities Lawyers,PRN1/23/12,NFLX-US,DreamBox Learning Extends Intelligent Adaptive Learning Platform to Serve K-5 Students,BW1/20/12,NFLX-US,Netflix Announces Management Changes,PRN1/20/12,NFLX-US,"Brower Piven Encourages Investors Who Have Losses in Excess of $1,000,000 From Investment in Netflix, Inc. to Inquire About the Lead Plaintiff Position in Securities Fraud Class Action Lawsuit Before the March 13, 2012 Lead Plaintiff Deadline ",INW1/18/12,NFLX-US,"Izard Nobel LLP Announces Class Action Lawsuit Against Netflix, Inc. ",INW1/18/12,NFLX-US,"CORRECTING and REPLACING Holzer Holzer & Fistel, LLC Announces Investigation into Potential Claims for Breaches of Fiduciary Duty by Certain Officers and Directors of Netflix, Inc.",BW1/17/12,NFLX-US,Hagens Berman Announces Netflix Investigation,PRN1/16/12,NFLX-US,"Netflix Investor Alert: The Briscoe Law Firm and Powers Taylor, LLP Investigate Possible Breaches of Fiduciary Duty by the Officers and Directors of Netflix, Inc.",PRN1/10/12,NFLX-US,Warner Bros. Home Entertainment to Make New Release DVD and Blu-ray Titles Available for Rental Only After 56-Day Sales-Only Window,PRN1/8/12,NFLX-US,Netflix Launches in The United Kingdom And Ireland,PRN1/5/12,NFLX-US,"Netflix, Inc.(NFLX-US) Schedules Q4 2011 Earnings Call for 25-January-2012 6:00 PM ET",FCSTEV1/5/12,NFLX-US,"Netflix, Inc.(NFLX-US) Schedules Q4 2011 Earnings Release for 25-January-2012 4:05 PM ET",FCSTEV1/5/12,NFLX-US,Netflix to Announce Fourth-Quarter 2011 Financial Results,PRN1/4/12,NFLX-US,Netflix Members Enjoy More Than Two Billion Hours of Movies and TV Shows in Fourth Quarter,PRN1/3/12,NFLX-US,"A Netflix Original Series ""Lilyhammer""",PRN12/28/11,NFLX-US,Amazon Soars; Netflix Plummets in ForeSee Holiday Study,PRN12/20/11,NFLX-US,Netflix and BBC Worldwide Announce Streaming Agreement for the United Kingdom and Ireland,PRN12/15/11,NFLX-US,Cave of Forgotten Dreams Acclaimed Documentary Now Being Watched Instantly by Netflix Members,PRN12/11/11,NFLX-US,DJ pressetext.de: USA: Nutzer-Streamingverhalten bald öffentlich - Datenschützer kritisieren neuen Gesetzesvorschlag von Netflix,DJPA12/7/11,NFLX-US,"Netflix Unveils New Xbox 360 Experience, Expands Xbox Support to Latin America",PRN12/7/11,NFLX-US,"Netflix Unveils New Xbox 360 Experience, Expands Xbox Support To Latin America",CNW12/5/11,NFLX-US,Luxembourg Selected for Netflix European Head Office,BW12/5/11,NFLX-US,Watch Great Holiday Movies and TV Shows on Netflix This Season,PRN12/5/11,NFLX-US,"Media Alert - Critically-acclaimed series, The Hour, debuts on Netflix",CNW12/1/11,NFLX-US,Netflix Names Christopher Libertelli as Its New Lead on Government Relations,PRN11/30/11,NFLX-US,"Netflix ""Just for Kids"" Experience Now on Wii in Canada",CNW11/23/11,NFLX-US,"The Zacks Analyst Blog Highlights: Bayer, Johnson & Johnson, Netflix, Lions Gate Entertainment and Google",PRN11/23/11,NFLX-US,"Critical Stock Price Alerts for Netflix, JPMorgan, Focus Media, Wells Fargo, British American Tobacco & AT&T",PRN11/22/11,NFLX-US,"Netflix ""Just for Kids"" Experience Now on Wii",PRN11/21/11,NFLX-US,Netflix Announces Pricing of $400 Million Concurrent Common Stock and Convertible Notes Financing,PRN11/18/11,NFLX-US,The Bluths Are Back and Only on Netflix,PRN11/18/11,NFLX-US,"The Zacks Analyst Blog Highlights: Netflix, Lions Gate Entertainment, Amazon.com, Apple and Google",PRN11/16/11,NFLX-US,Consumers Who Rented Online DVDs From Netflix May Be Affected By A Class Action Lawsuit and A Settlement,PRN11/16/11,NFLX-US,Netflix and Miramax Announce Streaming Agreement in the United Kingdom and Ireland,PRN11/15/11,NFLX-US,"Netflix, Inc.(NFLX-US) Schedules UBS Global Media & Communications Conference for 6-December-2011 3:30 PM ET",FCSTEV11/15/11,NFLX-US,"Netflix, Inc.(NFLX-US) Schedules Credit Suisse Technology Conference for 29-November-2011 12:30 PM ET",FCSTEV11/15/11,NFLX-US,Netflix Announces Upcoming Schedule of Events With the Financial Community,PRN11/15/11,NFLX-US,Netflix Unveils New Experience on Android Tablets,PRN11/14/11,NFLX-US,"Market Considerations in Europe Outlook - Featured Research on Netflix, Inc. and Google Inc. ",INW11/14/11,NFLX-US,Netflix and Lionsgate UK Announce Multi-Year Premium Pay TV Window Agreement in the United Kingdom and Ireland,PRN11/9/11,NFLX-US,"Netflix presenta la experiencia ""Solo para niños"" en América Latina",PRNL11/9/11,NFLX-US,"Netflix divulga experiência ""Só para crianças"" seção",PRNL11/8/11,NFLX-US,"Research and Markets: Netflix, Inc. Fundamental Company Report Including Financial, SWOT, Competitors and Industry Analysis",BW11/7/11,NFLX-US,Netflix to Premiere on Barnes & Noble's NOOK Tablet™,PRN11/7/11,NFLX-US,Breaking Bad' Seasons 1-3 Now Available On Netflix in Canada,CNW11/7/11,NFLX-US,Media Alert - 'Breaking Bad' Seasons 1-3 Now Available On Netflix in Canada,CNW11/7/11,NFLX-US,Netflix and MGM Announce Multi-Year Premium Pay TV Window Agreement in the United Kingdom and Ireland,PRN10/30/11,NFLX-US,Netflix and Disney-ABC Television Group Announce Extension of Existing Licensing Agreement to Stream TV Shows,PRN10/26/11,NFLX-US,"Zacks Bull and Bear of the Day Highlights: Celgene, Talisman Energy, Coinstar, Netflix and Select Comfort",PRN10/24/11,NFLX-US,Netflix Releases Third-Quarter 2011 Financial Results,PRN10/24/11,NFLX-US,Netflix to Launch Service in the UK and Ireland for Streaming Movies and TV Shows in Early 2012,PRN10/20/11,NFLX-US,"The Zacks Analyst Blog Highlights: Apple, Google, CME Group, Netflix and IBM",PRN10/19/11,NFLX-US,Netflix Expands Support for Android-Powered Smartphones and Tablets,PRN10/19/11,NFLX-US,Netflix Expands Support For Android-Powered Smartphones and Tablets,CNW10/17/11,NFLX-US,"Zacks Investment Ideas Feature Highlights: Travelzoo, OpenTable, Netflix and Ancestry.com",PRN10/14/11,NFLX-US,Netflix Expanding Asian Movie Selection in Deal With Korea's Top Studio CJ E&M,PRN10/13/11,NFLX-US,Warner Bros. Television Group and CBS Corporation Sign Multi-Year Output Deal With Netflix for CW Network Programming,PRN10/13/11,NFLX-US,"The Zacks Analyst Blog Highlights: Alcoa, J.P. Morgan, Pepsi, Netflix and Hewlett-Packard",PRN10/12/11,NFLX-US,"The Zacks Analyst Blog Highlights: Netflix, AMC Networks, DreamWorks Animation SKG, Apple and Google",PRN10/12/11,NFLX-US,"Research Reports for Top Traded Penny Stocks: eMagin, CEL-SCI & Procera, More Reports for Netflix, NVIDIA & Vertex",PRN10/11/11,NFLX-US,"Critical Stock Alerts for American Capital, Vertex, Kroger, QUALCOMM, Netflix & Gilead",PRN10/10/11,NFLX-US,"Latest Update for VIZIO 8"" Tablet with Wi-Fi Includes Pre-Loaded Netflix App",PRN10/10/11,NFLX-US,DVDs Will Be Staying at Netflix.com,PRN10/7/11,NFLX-US,Netflix and AMC Networks Announce Multi-Year Agreement,PMZ10/4/11,NFLX-US,"Netflix, Inc.(NFLX-US) Schedules Q3 2011 Earnings Call for 24-October-2011 6:00 PM ET",FCSTEV10/4/11,NFLX-US,"Netflix, Inc.(NFLX-US) Schedules Q3 2011 Earnings Release for 24-October-2011",FCSTEV10/4/11,NFLX-US,Netflix to Announce Third-Quarter 2011 Financial Results,PRN10/4/11,NFLX-US,Learn Two Business Lessons from Netflix's Mistakes,PRN10/3/11,NFLX-US,"Research Reports for Top Traded Penny Stocks: Hudson City Bancorp, Level 3 Communications & Kodak, More Reports for Oracle, Netflix & Intuit",PRN10/3/11,NFLX-US,VisualOn Helps Netflix Reach Members in Fragmented Android Market,PRN9/30/11,NFLX-US,"Critical Stock Alerts for Netflix, Nuance, Intuit, Lululemon Athletica, E TRADE & QUALCOMM",PRN9/29/11,NFLX-US,More Than a Third of Americans Use Netflix at Least Once a Month - New Knowledge Networks Report,BW9/29/11,NFLX-US,"BMR Updates Outlooks on Apple, Cisco, Microsoft, NetFlix, and Amazon",PRN9/29/11,NFLX-US,Justin Bieber: Never Say Never Exclusively Available to Stream on Netflix Canada Starting September 30,CNW9/29/11,NFLX-US,* * * * * MEDIA ALERT* * * * * - Justin Bieber: Never Say Never Exclusively Available to Stream on Netflix Canada Starting September 30th,CNW9/28/11,NFLX-US,"Critical Stock Alerts for U.S. Bancorp, Discover Financial Services, salesforce.com, Oracle, Exxon Mobil & Netflix",PRN9/27/11,NFLX-US,"The Zacks Analyst Blog Highlights: The Boeing Company, DISH Network, Netflix, Comcast and Warner Cable",PRN9/26/11,NFLX-US,Netflix and DreamWorks Animation Announce Multi-Year Premium Pay TV Window Agreement in the United States,PRN9/26/11,NFLX-US,"Factors Moving Markets, Worldwide View - Equity Research on Netflix, Inc. and DISH Network Corp. ",INW9/21/11,NFLX-US,Netflix and Discovery Communications Renew and Expand TV Show Streaming Agreement,PRN9/20/11,NFLX-US,Magid Surveys Netflix Subscribers and Looks at Netflix's Challenging Prospects Ahead,PRN9/19/11,NFLX-US,"Zacks Bull and Bear of the Day Highlights: Avis Budget Group, Citi Trends, Netflix, Walt Disney and Sony",PRN9/19/11,NFLX-US,"Global Situation & Resulting Influences - Research Report on Netflix, Inc. and Comcast Corporation ",INW9/19/11,NFLX-US,The Securities Arbitration Law Firm of Klayman & Toskes Launches Investigation On Behalf of Netflix Shareholders With Large Concentrated Positions,BW9/16/11,NFLX-US,"Insider Hot Stock Picks for Netflix, Cognizant Technology Solutions, Intuit, MetroPCS, Rackspace Hosting & QLogic",PRN9/15/11,NFLX-US,Netflix Updates Third-Quarter Guidance,PRN9/12/11,NFLX-US,"Netflix Arrives in Mexico, Central America and the Caribbean",PRN9/8/11,NFLX-US,"The Zacks Analyst Blog Highlights: Netflix, Amazon.com, Apple, Google and Coinstar",PRN9/8/11,NFLX-US,"The Zacks Analyst Blog Highlights: Apple, Netflix, priceline.com, SanDisk and Caterpillar",PRN9/7/11,NFLX-US,"Netflix, Inc.(NFLX-US) Schedules Goldman Sachs Communacopia Conference for 21-September-2011 2:55 PM ET",FCSTEV9/7/11,NFLX-US,Netflix CFO to Present at the 20th Annual Goldman Sachs Communacopia Conference,PRN9/6/11,NFLX-US,"Critical Stock Alerts for Microsoft, Exxon, Apple, Halliburton, Netflix & Dell",PRN9/5/11,NFLX-US,Netflix Arrives In Latin America And The Caribbean,PRN9/1/11,NFLX-US,"Single Touch Systems Cites Patent Ownership in ""Letter of Notification"" to Netflix",BW8/30/11,NFLX-US,"The Zacks Analyst Blog Highlights: DIRECTV, DISH Network, AT&T, Verizon Wireless and Netflix",PRN8/24/11,NFLX-US,"Significant Insider Trading at Exxon, Cisco, EMC, MGM, Coca-Cola & Netflix",PRN8/16/11,NFLX-US,"Netflix Unveils ""Just for Kids"" Experience",PRN8/10/11,NFLX-US,"Factors Moving Markets, Worldwide View - Equity Research on Netflix, Inc. and Coinstar, Inc. ",INW8/4/11,NFLX-US,Netflix Surpasses 1 Million Members Milestone in Canada,CNW7/27/11,NFLX-US,CBS and Netflix Announce International Licensing Agreement for Canadian and Latin American Subscribers,PRN7/27/11,NFLX-US,Mad Men Now Available to Instantly Watch Streaming From Netflix,PRN7/26/11,NFLX-US,DJ pressetext.de: Streaming: Netflix verhandelt mit Dreamworks - Filme könnten bereits an 2013 im virtuellen Ladenregal stehen,DJPA7/25/11,NFLX-US,Netflix Releases Second-Quarter 2011 Financial Results,PRN7/25/11,NFLX-US,TDG: Netflix Subscribers Crying Foul May Be Crying Wolf ,INW7/14/11,NFLX-US,Netflix Customers Offered Blockbuster Total Access With New Everyday Pricing and Free 30-Day Trial With Proof of Netflix Account,PRN7/13/11,NFLX-US,NBCUniversal and Netflix Renew Multi-Year TV and Film Content Agreement,PRN7/13/11,NFLX-US,Critical Insider Trades Found at AAPL Stock Price Between US$323.80 - US$351.92,PRNA7/12/11,NFLX-US,Netflix to Offer New Unlimited DVD Plans and Will Separate Streaming and DVD Plans in the U.S.,PRN7/11/11,NFLX-US,"Netflix, Inc.(NFLX-US) Schedules Q2 2011 Earnings Call for 25-July-2011 6:00 PM ET",FCSTEV7/11/11,NFLX-US,"Netflix, Inc.(NFLX-US) Schedules Q2 2011 Earnings Release for 25-July-2011",FCSTEV7/11/11,NFLX-US,Netflix to Announce Second-Quarter 2011 Financial Results,PRN7/5/11,NFLX-US,Netflix to Launch Service in Latin America and the Caribbean for Streaming TV Shows and Movies Later This Year,PRN6/24/11,NFLX-US,Insider Trading Activity Reported at Apple Inc. Prior to Its AAPL Stock Price Falling,PRNA6/23/11,NFLX-US,Facebook Names Reed Hastings to Its Board of Directors,PRN6/17/11,NFLX-US,"Critical Stock Alerts for Netflix, Xilinx, Acme Packet, Rackspace, Entergy, & Cliffs",PRNA6/13/11,NFLX-US,TDG: Proclivity to Downgrade PayTV Services Increasing Among Netflix Streamers ,INW6/7/11,NFLX-US,"Critical Stock Alerts: Insider Trade for Netflix, Eastman Kodak, United Therapeutics, CA, Tesla, & MetroPCS",PRN6/3/11,NFLX-US,"Netflix, Inc.(NFLX-US) Schedules Annual General Meeting for 3-June-2011 6:00 PM ET",FCSTEV5/25/11,NFLX-US,"Netflix, Inc.(NFLX-US) Schedules Nomura U.S. Media Summit for 2-June-2011 4:15 PM ET",FCSTEV5/25/11,NFLX-US,Netflix Chief Content Officer to Present at the Nomura U.S. Media Summit,PRN5/16/11,NFLX-US,Netflix Announces Strategic Multi-Year Agreement With Miramax,PRN5/11/11,NFLX-US,"Netflix, Inc.(NFLX-US) Schedules Bank of America Merrill Lynch Technology Conference for 1-June-2011 1:50 PM ET",FCSTEV5/11/11,NFLX-US,Netflix CFO to Present at the Bank of America Merrill Lynch 2011 Technology Conference,PRN4/25/11,NFLX-US,Netflix Releases First-Quarter 2011 Financial Results,PRN4/25/11,NFLX-US,"Critical Stock Alerts: Insider Trade for QUALCOMM, Darden Restaurants, Netflix, Liberty, Yahoo, & Biogen Idec",PRN4/18/11,NFLX-US,"Critical Insider Trade Alerts for Mattel, Hewlett-Packard, Coca-Cola, Netflix, Human Genome Sciences, & Flextronics",PRNA4/6/11,NFLX-US,"Netflix, Inc.(NFLX-US) Schedules Q1 2011 Earnings Call for 25-April-2011 6:00 PM ET",FCSTEV4/6/11,NFLX-US,"Netflix, Inc.(NFLX-US) Schedules Q1 2011 Earnings Release for 25-April-2011",FCSTEV4/6/11,NFLX-US,Netflix to Announce First-Quarter 2011 Financial Results,PRN4/5/11,NFLX-US,"Netflix and Lionsgate Unite for Exclusive Syndication Arrangement to Stream Up to Seven Seasons of Acclaimed Series ""Mad Men"" to Netflix Members",PRN4/1/11,NFLX-US,"Twentieth Century Fox and Netflix Announce Distribution Deal Which Makes ""Glee"" and ""Sons of Anarchy"" Available to Watch Instantly From Netflix Starting April 1",PRN3/28/11,NFLX-US,"Critical Stock Alerts: Insider Trade for Cisco, Yahoo, Netflix, Gap, Illumina, & Priceline.com",PRN3/28/11,NFLX-US,Netflix and Paramount Reach Multi-Year Premium Pay TV Window Deal in Canada,CNW3/11/11,NFLX-US,Could Netflix Suffer the Same Fate as Blockbuster? ,INW2/22/11,NFLX-US,CBS and Netflix Announce Two-Year Licensing Agreement for Library Content,PRN2/21/11,NFLX-US,"Critical Insider Trade Alerts for Sunpower, AK Steel, Broadcom, Netflix, Schlumberger, & Entropic",PRNA2/14/11,NFLX-US,"Critical Stock Alerts: Insider Trade for Corning, EMC, CVS, Netflix, Broadcom, & SanDisk",PRNA2/3/11,NFLX-US,Peter Chernin and Barry McCarthy Join Pandora's Board of Directors,PRN1/31/11,NFLX-US,"Critical Insider Trade Alerts for EMC, Johnson & Johnson, Netflix, Texas Instruments, AMR, & UnitedHealth",PRNA1/27/11,NFLX-US,Zacks' Voice of the People Highlights Opportunities With Netflix,PRN1/26/11,NFLX-US,Netflix Up After BUYINS.NET Report Predicted Strength After Earnings,PMZ1/26/11,NFLX-US,Netflix Releases Fourth-Quarter 2010 Financial Results,PRN1/21/11,NFLX-US,"Zacks' Voice of the People Highlights Opportunities Apple, Netflix and F5 Networks",PRN1/12/11,NFLX-US,"Netflix, Inc.(NFLX-US) Schedules Q4 2010 Earnings Call for 26-January-2011 6:00 PM ET",FCSTEV1/12/11,NFLX-US,"Netflix, Inc.(NFLX-US) Schedules Q4 2010 Earnings Release for 26-January-2011 4:05 PM ET",FCSTEV1/12/11,NFLX-US,Netflix to Announce Fourth-Quarter 2010 Financial Results,PRN1/4/11,NFLX-US,Streaming From Netflix Will Soon be Even More Convenient With Netflix One-Click Remotes Introduced by Major Consumer Electronics Makers,PRN12/22/10,NFLX-US,"Zacks Analyst Blog Highlights: Google, Sony Corp, Netflix, Amazon.com and Apple",BW12/13/10,NFLX-US,Netflix Adds Hundreds of New Titles That Its Canadian Members Can Watch Instantly,CNW12/10/10,NFLX-US,"Zacks Analyst Blog Highlights: H&R Block, Intuit, Time Warner Cable, DIRECTV and Netflix",BW