TSLAdate,TSLAnews,TSLAsource03/26/14,American Manganese Inc.: Tesla's Gigafactory Sparks New Interest for Secure Lithium Ion Battery Raw Material Sources,INW05/31/17,"Amazon's Shares Pass $1,000 for the First Time and Tesla Hits Another New Record Close",NEWS_ACW06/21/17,Today's Research Reports on Stocks to Watch: Boeing and Tesla,NEWS_ACW10/18/12,Tesla Selects Cypress's TrueTouch¨ Solution to Implement World's First Fully-Integrated Touchscreen Infotainment System in Model S,BW10/20/11,"Hot Insider Trading of ON Semiconductor, Atmel, Dendreon, Broadcom, Ciena & Tesla Motors",PRN10/31/11,"Research Reports for EMC, U.S. Bancorp, Texas Instruments, Dendreon, Apple & Tesla Motors",PRN09/02/11,"Critical Alerts for Citigroup, Abercrombie & Fitch, Dow Chemical, W.W. Grainger, and Tesla Motors Released by Seven Summits Research",PRN10/03/11,"Research Reports for Top Traded Penny Stocks: Boston Scientific, General Moly & Uranium Energy, More Reports for Tesla Motors, Aruba & H&R Block",PRN06/22/12,,BW03/28/19,"Tender Offer Extension for Acquisition of Maxwell Technologies, Inc.",PMZ06/29/10,NASDAQ OMX Welcomes Tesla Motors to The NASDAQ Stock Market,PMZ09/30/15,DJ pressetext.de: Tesla will 1.000 Kilometer Reichweite knacken - Software-Update soll E-Flitzer in selbstfahrendes Auto verwandeln,DJPA07/08/13,"Tesla Motors, Inc. to Join the NASDAQ-100 Index Beginning July 15, 2013",PMZ03/10/14,Tesla Battery Plant Announcement Lights Up Graphite Space,PMZ10/30/13,Panasonic And Tesla Reach Agreement To Expand Supply Of Automotive-Grade Battery Cells,PRN11/08/11,"Research Reports for Day Traders: Graham, Tesla Motors, Rackspace Hosting, salesforce.com, E*TRADE & Lululemon",PRN04/24/14,DDR Expands Partnership with Tesla,PRN01/08/13,Eric S. Whitaker Appointed as SanDisk's Chief Legal Officer,BW10/28/11,"Critical Stock Alerts for Microsoft, U.S. Bancorp, SanDisk, Dendreon, Cirrus Logic & Tesla Motors",PRN05/23/11,"Daily Insider Trade Alerts for Tesla Motors, 3M, MetLife, Synovus Financial, Infinera, & MasterCard",PRNA03/11/14,Saint Jean Carbon Comments on the Significance of Tesla Motors Announcement of their Giga Factory Lithium Battery Plant,INW11/16/20,DJPressRelease:TeslaSettoJoinS&P500,DJGM10/21/20,DJ Press Release: Tesla Releases Third Quarter 2020 Financial Results,DJGM10/12/20,DJ Press Release: S&PGR Upgrades Tesla Inc. To -2-,DJGM10/12/20,DJ Press Release: S&PGR Upgrades Tesla Inc. To 'BB-'; Outlook Stable,DJGM10/12/20,Headline: DJ S&PGR Upgrades Tesla Inc. To 'BB-'; Outlook Stable,DJGM10/08/20,DJ Press Release: Tesla Announces Date for Third Quarter 2020 Financial Results and Webcast,DJGM10/02/20,DJ Press Release: Tesla Q3 2020 Vehicle Production & Deliveries,DJGM08/21/20,DJ Press Release: Tesla Announces Updates to 2020 Annual Meeting of Stockholders and Battery Day Event,DJGM08/11/20,DJ Press Release: Tesla Announces a Five-for-One Stock Split,DJGM08/05/20,DJ Moody's Assigns Definitive Ratings To Tesla Auto Lease Trust 2020-A Notes,DJGM07/28/20,DJ Press Release: S&PGR Upgrades Tesla Inc. To 'B+'; -2-,DJGM07/28/20,DJ Press Release: S&PGR Upgrades Tesla Inc. To 'B+'; Outlook Stable,DJGM07/28/20,Headline: DJ S&PGR Upgrades Tesla Inc. To 'B+'; Outlook Stable,DJGM07/27/20,DJ Moody's Assigns Provisional Ratings To Tesla Auto Lease Trust 2020-A Notes,DJGM07/23/20,DJ Moody's Upgrades Tesla's Ratings Including Cfr To B2 And Senior Unsecured To B3; The Outlook Is Stable.,DJGM07/22/20,DJ Press Release: Tesla Releases Second Quarter 2020 Financial Results,DJGM07/10/20,DJ Press Release: Update on Tesla's 2020 Annual Meeting of Stockholders; Battery Day,DJGM07/09/20,DJ Press Release: Tesla Announces Date for Second Quarter 2020 Financial Results and Webcast,DJGM07/02/20,DJ Press Release: Tesla Q2 2020 Vehicle Production & Deliveries,DJGM05/29/20,DJ Press Release: Next NASA Advisory Council Meeting Postponed,DJGM05/14/20,DJ Press Release: Development of Elon Musk's Innovative Underground Transportation System Achieves Milestone,DJGM04/30/20,"DJ Moody's Announces Completion Of A Periodic Review Of Ratings Of Tesla, Inc.",DJGM04/29/20,DJ Press Release: Tesla Releases First Quarter 2020 Financial Results,DJGM04/15/20,DJ Press Release: Tesla Announces Date for First Quarter 2020 Financial Results and Webcast,DJGM04/14/20,DJ Press Release: Zoox and Tesla Settle Lawsuit,DJGM04/02/20,DJ Press Release: Tesla Q1 2020 Vehicle Production & Deliveries,DJGM03/19/20,DJ Press Release: Tesla Operational Update,DJGM02/14/20,Headline: DJ S&PGRBulletin: Tesla Offering Plan Helps Financial Flexibility,DJGM02/14/20,DJ Press Release: S&PGRBulletin: Tesla Offering Plan Helps Financial Flexibility,DJGM02/13/20,DJ Press Release: Tesla Announces Offering of Common Stock,DJGM01/29/20,DJ Press Release: Tesla Releases Fourth Quarter and Full Year 2019 Financial Results,DJGM01/17/20,DJ Press Release: Tesla Announces Date for Fourth Quarter and Full Year 2019 Financial Results and Webcast,DJGM01/03/20,DJ Press Release: Tesla Q4 2019 Vehicle Production & Deliveries,DJGM11/27/19,DJ Press Release: S&PGR Affirms Four Ratings On Three SolarCity LMC Rtgs Deals,DJGM11/27/19,Headline: DJ S&PGR Affirms Four Ratings On Three SolarCity LMC Rtgs Deals,DJGM10/23/19,DJ Press Release: Tesla Releases Third Quarter 2019 Financial Results,DJGM