TSLAdate,TSLAnews,TSLAsource01/29/14,Tesla Motors Announces Date for Fourth Quarter & Full Year 2013 Financial Results,INW01/21/14,Tesla breidt Supercharger netwerk uit in Europa,PRNE01/21/14,Tesla erweitert Supercharger-Netzwerk in Europa,PRNE01/21/14,Tesla etend son reseau de Superchargers en Europe,PRNE01/21/14,Tesla Expands Supercharger Network in Europe,PRN01/14/14,Tesla Revenue Expected to Exceed Guidance by 20% in Fourth Quarter,INW01/13/14,"Tesla, Inc.(TSLA-US) Schedules Q4 2013 Sales and Revenue Release for 14-January-2014",FCSTEV01/10/14,Tesla Provides Customers With Upgraded Charging Software and Adapter,INW12/23/13,NHTSA Reaffirms Model S 5-Star Safety Rating in All Categories for Model Year 2014,NEWS_CR12/19/13,Tesla opent nieuwe design store in P.C. Hooftstraat Amsterdam,PRNE12/19/13,"Important Trend Analysis: Tesla Motors Inc, Federal National Mortgage Association, WPCS International Incorporated, Questcor Pharmaceuticals Inc",NEWS_ACW12/19/13,"Opening Buzz: SolarCity Corp, 3D Systems Corporation, pSivida Corp, Alcatel Lucent SA",NEWS_ACW12/19/13,Die ersten Supercharger in Deutschland elektrisieren die route Zwischen MŸnchen und Amsterdam,PRNE12/18/13,"Opening Buzzers: Tesla Motors Inc, Facebook Inc, Intel Corporation, Cisco Systems",NEWS_ACW12/18/13,"New Interactive Exhibition Based on Life, Works of Nikola Tesla Announced by Show Time Exhibitions",PRN12/13/13,First Tesla Supercharger in Switzerland Energizes Route Between Zurich and Geneva,PRNE12/05/13,"SHAREHOLDER ALERT: Brower Piven Encourages Investors With More Than $200,000 in Losses from Investment in Tesla Motors, Inc. to Contact Brower Piven Before the January 7, 2014 Lead Plaintiff Deadline",BW12/05/13,"Bearish Stocks Trend Analysis: Tesla Motors Inc, Apple Inc, J.C. Penney Company, Oculus Innovative Sciences, Mosaic Co",PRN12/02/13,German Federal Motor Transport Authority (Kraftfahrt-Bundesamt) Concludes Review of Model S Incidents,INW12/02/13,"Traders Buzz: Tesla Motors Inc, Sirius XM Radio, Microsoft Corporation, Ariad Pharmaceuticals",NEWS_ACW11/27/13,"Law Offices of Howard G. Smith Announces Investigation on Behalf of Investors of Tesla Motors, Inc.",BW11/27/13,"SCTY, CSIQ, SPWR and FSLR added to Solar Stock Watch List at EPR",NEWS_ACW11/12/13,"TESLA MOTORS, INC. SHAREHOLDER ALERT: Levi & Korsinsky, LLP Reminds Investors of Class Action Against Tesla Motors, Inc. and Its Board of Directors and a Lead Plaintiff Deadline of January 7, 2014 -- TSLA",PMZ11/12/13,"SHAREHOLDER ALERT: Brower Piven Encourages Investors With More Than $200,000 in Losses From Investment in Tesla Motors, Inc. to Contact Brower Piven Before the January 7, 2014 Lead Plaintiff Deadline -- TSLA",PMZ11/08/13,"Pomerantz Law Firm Has Filed a Class Action Against Tesla Motors, Inc. and Certain Officers -- TSLA",PMZ11/05/13,Tesla Motors Releases Third Quarter 2013 Financial Results,INW10/31/13,"Tesla Model S Outsells the Market in Some of America's Wealthiest Cities, Says Edmunds.com",PRN10/31/13,"Tesla, Inc.(TSLA-US) Schedules Robert W Baird and Co Industrial Conference for 6-November-2013 1:00 PM ET",FCSTEV10/30/13,Tesla Energizes West Coast Supercharger Corridor,INW10/30/13,TESLA MOTORS INC : Press Release,NEWS_CR10/30/13,Panasonic and Tesla Reach Agreement to Expand Supply of Automotive-Grade Battery Cells,INW10/28/13,BASF receives Supplier Award from Tesla,PRN10/28/13,"SCTY, AAPL, FCEL and CYOU added to NASDAQ Active Stock Watch List at GSR",NEWS_ACW10/24/13,Tesla Hires Apple VP Doug Field to Lead Vehicle Programs,INW10/23/13,CORRECTION - Tesla Motors Inc: Tesla Motors gibt wichtige Entwicklungen fŸr den Deutschen Markt bekannt,PRNE10/23/13,CORRECTION - Tesla Motors Inc: Tesla Motors Announces Major Developments for Germany,PRNE10/23/13,Tesla Motors gibt wichtige Entwicklungen fŸr den Deutschen Markt bekannt,PRNE10/23/13,Tesla Motors Announces Major Developments for Germany,PRNE10/17/13,"Tesla, Inc.(TSLA-US) Schedules Q3 2013 Earnings Call for 5-November-2013 5:30 PM ET",FCSTEV10/17/13,"Tesla, Inc.(TSLA-US) Schedules Q3 2013 Earnings Release for 5-November-2013 After Market Hours ET",FCSTEV10/17/13,Tesla Motors Announces Date for Third Quarter 2013 Financial Results,INW10/15/13,"TSLA, ARIA, CNDO and AMRN added to NASDAQ Active Stock Watch List at EPR",NEWS_ACW10/09/13,"TSLA, HIMX, AGEN and CLDX added to Nasdaq Active Stock Watch List at EPR",NEWS_ACW10/08/13,Tesla Model S Electric Rental Cars Now Available From Los Angeles All-Green Fleet,PRN10/03/13,"Key to Success, How to Profit: T, TSLA, FOXA and P",INW10/02/13,"Tesla, Inc.(TSLA-US) Schedules Daiwa Investment Conference for 19-November-2013 12:40 AM ET",FCSTEV10/01/13,"TSLA, AGNC, GERN and ZLCS added to Nasdaq Active Stock Watch List at GSR",NEWS_ACW09/25/13,"TSLA, BBRY, AMAT and HIMX added to NASDAQ Active Stock Watch List at EPR",NEWS_ACW09/17/13,"TSLA, AAPL. MNKD and OMER added to NASDAQ Active Stock Watch List at GSR",NEWS_ACW09/10/13,"TSLA, GRPN, AGNC and LULU added to NASDAQ Active Weekly Watch List at EPR",NEWS_ACW09/10/13,Tesla Motors Presents Supercharging at IAA and Announces Plans for European Network Expansion,PRN08/29/13,Tesla Motors Brings Revolutionary Supercharger to Europe With Launch Across Norway,PRN08/28/13,"TSLA, AGNC, FB and CPRX added to NASDAQ Active Stock Watch List at EPR",NEWS_ACW08/27/13,British Americans Help Children in Need at Polo Fundraiser,PRN08/23/13,"Tesla Motors abre una planta de ensamblaje en Tilburg, Pa’ses Bajos",PRNE08/23/13,"The Reason It Trades, What's Moving AAPL, TSLA and MCD",INW08/23/13,Tesla Motors ouvre une usine d'assemblage ˆ Tilburg aux Pays-Bas,PRNE08/22/13,Tesla Motors er_ffnet Montagewerk im niederl_ndischen Tilburg,PRNE08/22/13,"Tesla Motors Opens Assembly Plant in Tilburg, Netherlands",PRN08/20/13,"TSLA, GMCR, NVAX and SLM added to NASDAQ Active Stock Watch List at EPR",NEWS_ACW08/20/13,"Game Changing Insight on JPM, TSLA, C and XOM",INW08/20/13,"SCTY, SPWR, LINE and ZNGA added to NASDAQ Decliners Weekly Watch List at EPR",NEWS_ACW08/19/13,UPDATE: Tesla Model S Achieves Best Safety Rating of Any Car Ever Tested,INW08/19/13,Tesla Model S Achieves Best Safety Rating of Any Car Ever Tested,INW08/17/13,Erste Schweizer Kunden bekommen heute ihr Model S in ZŸrich/Winterthur,PRNE08/14/13,"TSLA, AGNC, OSIR and MU added to NASDAQ Active Stock Watch List at GSR",NEWS_ACW08/13/13,"Tesla, Inc.(TSLA-US) Schedules J.P. Morgan Automotive Conference for 13-August-2013 4:00 PM ET",FCSTEV08/12/13,Tesla Motors' Supply Chain VP to Speak at CSCMP Annual Global Conference; Closing Session to Focus on Personal Development,PRN08/12/13,"Tesla, Inc.(TSLA-US) Schedules Jefferies Global Industrials Conference for 12-August-2013 11:30 AM ET",FCSTEV08/08/13,"TSLA, DRYS, INTC and MDLZ added to NASDAQ Active Stock Watch List at EPR",NEWS_ACW08/07/13,Tesla Motors Releases Second Quarter 2013 Financial Results,INW08/07/13,Tesla Model S ankommer det Europeiske markedet,PRNE07/31/13,"Strategy Behind Our Success, We Get in Early: SNDK, TSLA and X",INW07/30/13,"TSLA, MTGE, AEGR and GT added to NASDAQ Active Stock Watch List at GSR",NEWS_ACW07/25/13,"TSLA, SIRI, ALXN and FB added to NASDAQ Active Stock Watch List at EPR",NEWS_ACW07/22/13,"TSLA, MNKD, HOLX and ACTG added to NASDAQ Active Stock Watch List at GSR",NEWS_ACW07/18/13,Tesla poursuit l'expansion de son r_seau europ_en,PRNE07/18/13,Tesla breidt haar europese netwerk verder uit,PRNE07/16/13,"Tesla, Inc.(TSLA-US) Schedules Q2 2013 Earnings Call for 7-August-2013 5:30 PM ET",FCSTEV07/16/13,"Tesla, Inc.(TSLA-US) Schedules Q2 2013 Earnings Release for 7-August-2013 After Market Hours ET",FCSTEV07/16/13,Tesla Motors Announces Date for Second Quarter 2013 Financial Results,INW07/15/13,"TSLA, LEAP, AGNC and NTAP added to NASDAQ Active Stock Watch List at EPR",NEWS_ACW07/11/13,DJ IRW-PRESS: Tesla Motors Inc.: -2-,DJIR07/10/13,Helios Entertainment Releases eBook Version of Nikola Tesla-Inspired Graphic Novel THE INVENTOR and Album RISE on Tesla's 157th Birthday,PRN07/08/13,"Tesla, Medient, Disney Reinvigorate Public Private Partnerships",NEWS_ACW06/28/13,TeslasupporterspetitionWhiteHousefordirectsales,NEWS_ACW06/28/13,"Zacks Investment Ideas feature highlights: Tesla Motors, coal ETF, Market Vectors Uranium & Nuclear Energy ETF, Guggenheim Solar ETF and PowerShares Wilderhill Clean Energy ETF",PRN06/24/13,Summer in Los Angeles is Going Ultra-Green with the Tesla Model S at MPG Car Rental,PRN06/24/13,Tesla Supercharging Stations at CBL Malls,BW06/24/13,"TSLA, MNKD, AGNC and ARNA added to Nasdaq Active Stock Watch List at EPR",NEWS_ACW06/18/13,"TSLA, NFLX, MU and MSFT added to Nasdaq Gainers Watch List at GSR",NEWS_ACW06/11/13,"Special Offer for Shareholders of RFMD, TSLA and ANR",INW06/03/13,Tesla Motors Announces 2013 Annual Shareholder Meeting Webcast,INW05/30/13,"Tesla Dramatically Expands Supercharger Network, Delivering Convenient, Free long Distance Driving Throughout U.S. and Canada",INW05/29/13,"MEDIA ADVISORY: Tesla Motors Supercharger Announcement Thursday, May 30, 2013",INW05/28/13,"Watch List Initiated: TSLA, BAC, OMTH added at GSR",NEWS_ACW05/25/13,"Ready to Profit? Start Here Now With TSLA, MRK, GNBT and EMC",INW05/24/13,Exclusive Tesla Model S Preview for Biodynamic Wine Lovers in Copenhagen - Turpino 2010 by Querciabella Makes Danish Debut,PRN05/22/13,Tesla Repays Department of Energy Loan Nine Years Early,INW05/22/13,"TSLA, ARMH, UNXL and SNE added to Active Stock Watch List at EPR",NEWS_ACW05/16/13,"The Zacks Analyst Blog Highlights: Tesla Motors, Research In Motion, Apple, Google and Nokia",PRN05/15/13,Tesla Motors Announces Offerings of Common Stock and Convertible Senior Notes,INW05/15/13,"In The Know, Smart Investing in GE, TSLA and INTC",INW05/14/13,"TSLA, ZNGA, NFLX and GRPN added to NASDAQ Active Stock Watch List at EPR",NEWS_ACW05/09/13,"GMCR, TSLA and GRPN added to Watch List at GSR",NEWS_ACW05/08/13,Tesla Motors Releases First Quarter 2013 Financial Results,INW05/06/13,Tesla Hires Aston Martin's Vehicle Engineering Leader,INW05/03/13,Tesla Improves Financing Product With Best Resale Value Guarantee and Lower Monthly Payments,INW05/02/13,"MEDIA ADVISORY: Tesla Motors Announcement Friday, May 3, 2013",INW04/25/13,Media Advisory | Tesla Motors Announcement,INW04/24/13,"Tesla, Inc.(TSLA-US) Schedules Q1 2013 Earnings Call for 8-May-2013 5:30 PM ET",FCSTEV04/24/13,"Tesla, Inc.(TSLA-US) Schedules Q1 2013 Earnings Release for 8-May-2013 After Market Hours ET",FCSTEV04/23/13,TeslaMotorsAnnouncesDateforFirstQuarter2013FinancialResults,INW04/21/13,Poll From Austin Business Journal Shows Overwhelming Public Support for Tesla Motors Selling Electric Cars Direct to Consumers in Texas,INW04/17/13,"Tesla, Inc.(TSLA-US) Schedules Annual General Meeting for 4-June-2013 6:00 PM ET",FCSTEV04/17/13,Tesla Motors Announces 2013 Annual Stockholder Meeting,INW04/17/13,Peretz & Associates: Former Director of Communications Prevails in David vs. Goliath Five-Year Lawsuit Against Tesla Motors,PRN04/16/13,"Blue-chip Movers: Tesla Motors Inc, Hewlett-Packard Company, Pfizer Inc, Eli Lilly & Co.",NEWS_ACW04/03/13,The Tesla Model S Comes to MPG Car Rental,PRN04/02/13,Tesla Unveils Revolutionary New Finance Product,INW04/01/13,"Tesla, Inc.(TSLA-US) Schedules Business Update Call for 2-April-2013 5:00 PM ET",FCSTEV04/01/13,"Media Advisory for Journalists, Analysts and Investors: Tesla Motors Announcement Tuesday, April 2nd",INW04/01/13,"Early Movers: Tesla Motors Inc, Vringo, J.C. Penney Company",NEWS_ACW03/31/13,Tesla Model S Sales Exceed Target,INW03/07/13,Tesla Motors kondigt aan de banden met Nederland nog meer te versterken,PRNE03/05/13,The Duality of Elon Musk (SpaceX) - TSLA,NEWS_ACW02/20/13,Tesla Motors Releases Fourth Quarter & Year-End 2012 Financial Results,INW02/12/13,"Tesla, Inc.(TSLA-US) Schedules Q4 2012 Earnings Release for 20-February-2013 After Market Hours ET",FCSTEV02/12/13,"Tesla, Inc.(TSLA-US) Schedules Q4 2012 Earnings Call for 20-February-2013 5:30 PM ET",FCSTEV02/11/13,Tesla Motors Announces Date for Fourth Quarter & Year-End 2012 Financial Results,INW01/04/13,Tesla Motors Wins Lawsuit Against Auto Dealers in Massachusetts,INW12/20/12,Tesla Motors Sets European Pricing for Model S,INW12/13/12,Intra-Day Update On Selected Stocks: (NASDAQ: SCTY) (NASDAQ: TELK),NEWS_ACW12/12/12,Tesla Motors Announces Major European Distribution Center in the Netherlands,PRN11/29/12,"Tesla, Inc.(TSLA-US) Schedules Deutsche Bank Global Auto Industry Conference for 16-January-2013 9:30 AM ET",FCSTEV11/29/12,Tesla Motors Sets New Pricing for Award-Winning Model S,INW11/16/12,Tesla Motors Opens First Canadian Store,INW11/14/12,Deloitte Announces 2012 Technology Fast 500ª Rankings,PRN11/12/12,Tesla Model S Wins One of Automotive Industry's Highest Honors: Motor Trend 2013 Car of the Year,INW11/05/12,"Tesla, Inc.(TSLA-US) Schedules Robert W. Baird & Co. Industrial Conference for 6-November-2012 11:45 AM ET",FCSTEV11/05/12,Tesla Motors Releases Third Quarter 2012 Financial Results,INW11/01/12,Tesla Motors Brings Model S to the Autobahn for the First Time,INW11/01/12,"Tesla Model S Blows Away the Competition and Wins AUTOMOBILE Magazine's ""Automobile of the Year""",INW10/29/12,Tesla Motors Revises Time for Third Quarter 2012 Financial Results,INW10/17/12,"Tesla, Inc.(TSLA-US) Schedules Q3 2012 Earnings Release for 5-November-2012 Before Market Open ET",FCSTEV10/17/12,"Tesla, Inc.(TSLA-US) Schedules Q3 2012 Earnings Call for 5-November-2012 8:00 AM ET",FCSTEV10/17/12,Tesla Motors Announces Date for Third Quarter 2012 Financial Results,INW09/28/12,Tesla Motors Announces Pricing of Its Follow-On Offering,INW09/25/12,Tesla Motors Announces Follow-on Offering,INW09/25/12,DJ pressetext.de: Tesla startet Elektroauto-Schnellladestationen - Korridore quer durch Amerika und 2013 auch Europa geplant,DJPA09/24/12,Tesla Motors Launches Revolutionary Supercharger Enabling Convenient Long Distance Driving,INW09/21/12,Tesla Motors Accelerates Into Fall With Retail Expansion,INW09/12/12,"Tesla, Inc.(TSLA-US) Schedules Think Equity Growth Conference for 13-September-2012 11:00 AM ET",FCSTEV08/15/12,Tesla Motors Announces Canadian Pricing for Model S,INW08/14/12,"Tesla, Inc.(TSLA-US) Schedules J.P. Morgan Automotive Conference for 14-August-2012 9:20 AM ET",FCSTEV07/25/12,Tesla Motors Releases Second Quarter 2012 Financial Results,INW07/19/12,"Tesla, Inc.(TSLA-US) Schedules Q2 2012 Earnings Release for 25-July-2012 After Market Hours ET",FCSTEV07/19/12,"Tesla, Inc.(TSLA-US) Schedules Q2 2012 Earnings Call for 25-July-2012 5:30 PM ET",FCSTEV07/19/12,Tesla Motors Announces Date for Second Quarter 2012 Financial Results,INW06/22/12,Tesla Motors Delivers World's First Premium Electric Sedan to Customers,INW06/21/12,Tesla Motors and Wells Fargo Announce Retail Financing Relationship,INW05/24/12,Tesla Expands Retail Network Before Model S Deliveries,INW05/22/12,Tesla Motors to Begin Customer Deliveries of Model S on June 22nd,INW05/14/12,"Tesla, Inc.(TSLA-US) Schedules Deutsche Bank Clean Tech, Utilities and Power Conference for 14-May-2012 8:00 AM ET",FCSTEV05/09/12,Tesla Motors Releases First Quarter 2012 Financial Results,INW05/02/12,"Tesla, Inc.(TSLA-US) Schedules Annual General Meeting for 6-June-2012 12:00 PM ET",FCSTEV05/02/12,Tesla Motors Announces 2012 Annual Shareholder Meeting,INW04/12/12,"Tesla, Inc.(TSLA-US) Schedules Q1 2012 Earnings Call for 9-May-2012 5:30 PM ET",FCSTEV04/12/12,"Tesla, Inc.(TSLA-US) Schedules Q1 2012 Earnings Release for 9-May-2012 After Market Hours ET",FCSTEV04/12/12,Tesla Motors Announces Date for First Quarter 2012 Financial Results,INW04/11/12,Tesla Expands Its European Footprint,PRN03/06/12,Tesla Motors and Athlon Car Lease Announce First Model S Leasing Program,PRN02/15/12,Tesla Motors Releases Fourth Quarter & Full Year 2011 Financial Results,INW02/14/12,"Model X, Fastest Selling Tesla Ever",INW02/10/12,Video: Tesla Unveils Model X at Its Los Angeles Design Studio,INW01/30/12,"Tesla, Inc.(TSLA-US) Schedules Q4 2011 Earnings Call for 15-February-2012 5:30 PM ET",FCSTEV01/30/12,"Tesla, Inc.(TSLA-US) Schedules Q4 2011 Earnings Release for 15-February-2012 After Market Hours ET",FCSTEV01/30/12,Tesla Motors Announces Date for Fourth Quarter and Full Year 2011 Financial Results,INW01/16/12,"Tesla, Inc.(TSLA-US) Schedules Business Update Call for 17-January-2012 8:00 AM ET",FCSTEV01/15/12,Tesla Motors Announces Date for Company Update Conference Call,INW01/10/12,Tesla Updates Iconic Roadster for 2012 in Limited Markets,PRN01/03/12,"Tesla, Inc.(TSLA-US) Schedules Deutsche Bank Global Auto Industry Conference for 11-January-2012 11:45 AM ET",FCSTEV11/29/11,"Tesla, Inc.(TSLA-US) Schedules Robert W. Baird & Co. Clean Technology Conference for 1-December-2011 11:00 AM ET",FCSTEV11/23/11,Tesla Puts Model S Technology on Display,INW11/03/11,Tesla Opening Three New Stores in North America,INW11/02/11,Tesla Motors Releases Third Quarter 2011 Financial Results,INW10/21/11,"Tesla, Inc.(TSLA-US) Schedules Q3 2011 Earnings Release for 2-November-2011 After Market Hours ET",FCSTEV10/21/11,"Tesla, Inc.(TSLA-US) Schedules Q3 2011 Earnings Call for 2-November-2011 5:30 PM ET",FCSTEV10/21/11,Tesla Motors Announces Date for Third Quarter 2011 Financial Results,INW09/28/11,TeslaOpensShowroomandServiceCenterinEindhovenTheNetherlands,PRN09/07/11,"Tesla, Inc.(TSLA-US) Schedules Bank of America Merrill Lynch Cleantech Conclave Conference for 13-September-2011",FCSTEV08/10/11,"Tesla, Inc.(TSLA-US) Schedules J.P. Morgan Auto Conference for 10-August-2011 1:55 PM ET",FCSTEV08/09/11,Tesla Adds New Talent to Management Team,INW08/03/11,Tesla Motors Releases Second Quarter 2011 Financial Results,INW07/13/11,"Tesla, Inc.(TSLA-US) Schedules Q2 2011 Earnings Release for 3-August-2011 After Market Hours ET",FCSTEV07/13/11,"Tesla, Inc.(TSLA-US) Schedules Q2 2011 Earnings Call for 3-August-2011 5:30 PM ET",FCSTEV07/01/11,Tesla Roadster Breaks Ground by Recording Time at Goodwood,PRNE06/09/11,Tesla Launches Model S Reservations in Canada,INW06/03/11,"Tesla Motors, Inc. Announces Pricing of Its Follow-On Offering",INW06/02/11,"Latest Tesla Store Opens in Park Meadows, Colorado",INW05/25/11,Tesla Announces Follow-On Offering of Common Stock,INW05/18/11,Tesla Unveils High Power Charging Network From Lands End to John o'Groats,PRNE05/18/11,"Tesla Owner Drives Roadster More Than 100,000 Kilometers",PRN05/04/11,Tesla Motors Reports First Quarter 2011 Results,BW04/20/11,Tesla Takes Auto Retail High-Tech With Digital Design Studio,BW04/18/11,"Tesla, Inc.(TSLA-US) Schedules Q1 2011 Earnings Release for 4-May-2011 After Market Hours ET",FCSTEV04/18/11,"Tesla, Inc.(TSLA-US) Schedules Q1 2011 Earnings Call for 4-May-2011 5:00 PM ET",FCSTEV04/18/11,Tesla Motors Announces Date for First Quarter 2011 Results,BW04/14/11,Electric Vehicle Manufacturer Tesla Motors and ProTech Monte-Carlo are Celebrating Their Partnership With the Launch of the Plug and Clean Service,PRN04/13/11,Tesla Reinvents the Car Buying Experience,BW04/06/11,Tesla Cleans up Again at the 5th Monte Carlo Alternative Energy Rally,PRN03/28/11,Tesla Roadster Drives 10 Million Miles and Counting,BW03/15/11,"Tesla Launches ""Oz Goes Electric"" Tour",BW02/28/11,Tesla Grows in Europe With Additional Sales and Service,BW02/28/11,Tesla's Groundbreaking Vehicle Engineering on Display in Geneva,BW02/25/11,"Tesla, Inc.(TSLA-US) Schedules Annual General Meeting for 1-June-2011 12:00 PM ET",FCSTEV02/25/11,Tesla Motors Announces 2011 Annual Stockholder Meeting,BW02/15/11,Tesla Motors Reports Fourth Quarter and Full Year 2010 Results,BW02/15/11,Tesla Launches First Italian Store in Europe's Fashion Capital,PRN02/10/11,"Tesla Motors Signs 3,469 RSF 5-Yr Showroom Lease at The Lenkin Company and Tower Companies' 1050 K Street",PRN02/10/11,"Tesla Motors Opens Washington, D.C. Showroom",BW01/27/11,Tesla Launches Battery Recycling Program Throughout Europe,PRN01/24/11,"Tesla, Inc.(TSLA-US) Schedules Q4 2010 Earnings Release for 15-February-2011 After Market Hours ET",FCSTEV01/24/11,Tesla Motors Announces Date for Fourth Quarter and Full Year 2010 Results,BW01/18/11,Tesla Roadster Drives Environmental Responsibility During Berlin Fashion Week,BW01/10/11,Tesla's Groundbreaking Vehicle Engineering on Display in Detroit,BW01/10/11,"Tesla Exceeds 1,500 Roadster Deliveries Worldwide",BW12/14/10,"Tesla, Inc.(TSLA-US) Schedules Deutsche Bank Global Auto Industry Conference for 12-January-2011 8:45 AM ET",FCSTEV11/09/10,Tesla Motors Reports Third Quarter Results,BW11/09/10,"Tuesday Afternoon Watch List: Citigroup Inc., Bank of America, Ford Motor, Hecla Mining Co., Atlas Energy Inc., dPollution International Inc.",INW11/09/10,"Tuesday Watch List: Citigroup Inc., Bank of America, Ford Motor, General Electric Co., Tesla Motors Inc., Lithium Technology Corp., dPollution International Inc.",INW10/27/10,Tesla Motors Opens Tesla Factory - Home of the Model S,BW10/26/10,Tesla Motors to Officially Open Tesla Factory - Home of the Model S,BW10/25/10,"Tesla, Inc.(TSLA-US) Schedules Q3 2010 Earnings Call for 9-November-2010 5:00 PM ET",FCSTTS10/25/10,"Tesla, Inc.(TSLA-US) Schedules Q3 2010 Earnings Release for 9-November-2010 After Market Hours ET",FCSTTS10/25/10,Tesla Motors Announces Date for Third Quarter 2010 Results,BW10/01/10,TeslaInitiatesVoluntaryRecallAfterSingleCustomerIncident,BW09/29/10,Tesla Announces Go Electric Roadster Tour,BW09/28/10,Tesla Motors Selects Dassault Systèmes' V6 PLM Solution,BW09/21/10,Tesla to Open Paris Store Next Week,BW08/04/10,Tesla Motors Reports Second Quarter Results,BW07/28/10,Tesla and TAG Heuer World Tour Arrives in Los Angeles,BW07/28/10,"Tesla, Inc.(TSLA-US) Schedules Q2 2010 Earnings Call for 4-August-2010 5:00 PM ET",FCSTTS07/28/10,"Tesla, Inc.(TSLA-US) Schedules Q2 2010 Earnings Release for 4-August-2010 After Market Hours ET",FCSTTS07/28/10,Tesla Motors Announces Date for Second Quarter 2010 Results,BW07/14/10,AllPennyStocks.com News: Electric Car Companies All the Rage As Consumers Demand Oil Alternatives,NEWS_ACW07/13/10,Tesla Launches New Website,BW07/08/10,"Tesla Hires Apple, Gap Veteran to Revolutionize Car Buying Experience",BW07/01/10,Tesla Unveils Roadster 2.5 at Newest Stores in Europe and North America,BW06/30/10,Tesla Announces Pricing of Initial Public Offering,BW06/30/10,"EurocarsUS & Tesla Motors Present 'MN Drives the Future', July 2nd",PRN06/28/10,Tesla Announces Pricing of Initial Public Offering,BW05/25/10,Tesla Announces Electric Summer Roadster Tour,BW05/20/10,"Tesla Motors and Toyota Motor Corporation Intend to Work Jointly on EV Development, TMC to Invest in Tesla",CNW05/20/10,"The City of Downey Says Tesla Motors Goes for the Cash, Moves Jobs to Vacant Toyota Plant",PMZ05/19/10,Tesla Debuts at Madrid Auto Show,BW04/11/10,Tesla Roadster World Tour Heads for Hallowed Grounds of Nikola Tesla,BW02/16/10,Tesla Roadster Takes Switzerland by Storm,BW02/03/10,Tesla Hires Toyota Manufacturing Expert,BW01/29/10,Tesla Files S-1 Registration Statement for Initial Public Offering,BW01/08/10,Tesla Wraps Up Historic Roadster Road Trip on Schedule,BW01/07/10,Tesla Hires Fiat Strategist to Head European Operations,BW11/21/17,"Rosen Law Firm Reminds Tesla, Inc. Investors of Important Deadline in First Filed Class Action - TSLA",PMZ11/07/17,"EQUITY ALERT: Rosen Law Firm Announces Filing of Securities Class Action Lawsuit Against Tesla, Inc. - TSLA",PMZ05/15/14,Tesla Provides Best Connected Vehicle User Experience says Strategy Analytics,PRNA06/29/10,TAG Heuer MERIDIIST GMT New Feature and Enhanced Design,PRNE12/17/17,DAMAC Properties' Dubai Shopping Festival Car Promotion Back with Tesla Guaranteed,NEWS_CR02/23/12,Tesla Accelerates Continuous Improvement with Apriso,BW09/08/10,Tesla Motors Selects Apriso's Manufacturing Execution System to Accelerate Production,BW08/01/16,Tesla and SolarCity Announce Call to Discuss Combination,INW03/26/10,2010 Social Innovation Award Winners Named,PRNE06/28/10,Tesla Motors (TSLA) to Ring The NASDAQ Stock Market Opening Bell,PMZ07/07/10,"Skymark Research Initiates Independent Research Coverage on Tesla Motors, Inc.",PMZ11/20/17,"EQUITY ALERT: Levi & Korsinsky, LLP Reminds Shareholders of Tesla, Inc. of a Class Action Lawsuit and a Lead Plaintiff Deadline of December 11, 2017 - TSLA",PMZ10/16/17,"INVESTOR ALERT: Levi & Korsinsky, LLP Reminds Investors of an Investigation Involving Possible Securities Fraud Violations by the Board of Directors of Tesla, Inc.",BW10/11/17,"SHAREHOLDER ALERT: Levi & Korsinsky, LLP Notifies Investors of an Investigation Involving Possible Securities Fraud Violations by the Board of Directors of Tesla, Inc. -TSLA",BW05/25/10,"Toyota-Tesla Deal: Get Analysis, Commentary and Perspective",PRN05/28/15,Tesla and Gaelectric to Introduce Tesla Battery Storage to Ireland,PRNE11/21/17,"SHAREHOLDER ALERT: Pomerantz Law Firm Reminds Shareholders with Losses on their Investment in Tesla, Inc. of Class Action Lawsuit and Upcoming Deadline - TSLA",BW11/03/10,Panasonic Invests $30 Million in Tesla: Companies Strengthen Collaborative Relationship,BW10/13/10,Tesla Notifies SEC of Agreement with Toyota to Develop Electric Version of RAV4,BW06/26/12,"The Zacks Analyst Blog Highlights: Alcoa, Tesla Motors, Aluminum Corporation of China, RioTinto and Goldman Sachs",PRN09/20/10,Tesla Motors' Model S Pulls Up to Its New Home in the Autodesk Gallery at One Market in San Francisco,BW09/20/10,Photo of Tesla Motors' Model S Pulling Up to its New Home in the Autodesk Gallery at One Market in San Francisco is Available on Business Wire's Web Site and AP PhotoExpress,BW