Date,Symbol,Headline,Source10/20/17,TSLA-US,"TSLA INVESTOR ALERT: The Law Offices of Vincent Wong Reminds Investors of an Investigation Involving Possible Securities Fraud Violations by the Board of Directors of Tesla, Inc.",BW10/19/17,TSLA-US,"INVESTOR ALERT: Goldberg Law PC Announces the Filing of a Securities Class Action Lawsuit Against Tesla, Inc. and Encourages Investors With Losses Exceeding $100,000 to Contact the Firm",BW10/19/17,TSLA-US,"TSLA SHAREHOLDER ALERT: The Law Offices of Vincent Wong Notifies Investors of an Investigation Involving Possible Securities Fraud Violations by the Board of Directors of Tesla, Inc.",BW10/19/17,TSLA-US,"Tesla, Inc.(TSLA-US) Schedules Q3 2017 Earnings Release for 1-November-2017 After Market Hours ET",FCSTEV10/19/17,TSLA-US,"Tesla, Inc.(TSLA-US) Schedules Q3 2017 Earnings Call for 1-November-2017 5:30 PM ET",FCSTEV10/19/17,TSLA-US,Tesla Announces Date for Third Quarter 2017 Financial Results and Webcast,PMZ10/18/17,TSLA-US,"TSLA LOSS NOTICE: Rosen Law Firm Reminds Tesla, Inc. Investors of Important Deadline in First Filed Class Action - TSLA",BW10/11/17,TSLA-US,"IMPORTANT INVESTOR ALERT: Khang & Khang LLP Announces an Investigation of Tesla, Inc. and Encourages Investors with Losses Over $100,000 to Contact the Firm",BW10/11/17,TSLA-US,"Federman & Sherwood Announces Filing of Securities Class Action Lawsuit Against Tesla, Inc.",PMZ10/11/17,TSLA-US,"INVESTOR ALERT: Goldberg Law PC Announces an Investigation of Tesla, Inc. and Encourages Investors with Losses Exceeding $100,000 to Contact the Firm",BW10/10/17,TSLA-US,"EQUITY ALERT: Rosen Law Firm Files Securities Class Action Lawsuit Against Tesla, Inc. - TSLA",BW10/10/17,TSLA-US,"IMPORTANT SHAREHOLDER ALERT: Khang & Khang LLP Announces an Investigation of Tesla, Inc. and Encourages Investors with Losses Over $100,000 to Contact the Firm",BW10/10/17,TSLA-US,"(TSLA) Alert:  Johnson Fistel Investigates Tesla, Inc. Following Report of Vehicle Deliveries and Production; Encourages Investors to Contact the Firm",PRN10/9/17,TSLA-US,"SHAREHOLDER ALERT: Goldberg Law PC Announces an Investigation of Tesla, Inc.",BW10/9/17,TSLA-US,"SHAREHOLDER ALERT: Bronstein, Gewirtz & Grossman, LLC Announces Investigation of Tesla, Inc. (TSLA)",PRN10/9/17,TSLA-US,"SHAREHOLDER ALERT: Pomerantz Law Firm Investigates Claims On Behalf of Investors of Tesla, Inc.  - TSLA",PRN10/2/17,TSLA-US,Tesla Q3 2017 Vehicle Deliveries and Production,PMZ10/1/17,TSLA-US,"Tesla, Inc.(TSLA-US) Schedules Q3 2017 Sales and Revenue Release - Production Results for 2-October-2017",FCSTEV8/11/17,TSLA-US,Tesla Agrees to Issue and Sell $1.80 Billion of Senior Notes,PMZ8/8/17,TSLA-US,"Tesla, Inc.(TSLA-US) Schedules Deutsche Bank Technology Conference for 12-September-2017 12:00 PM ET",FCSTEV8/7/17,TSLA-US,Tesla Announces Proposed $1.5 Billion Offering of Senior Notes,PMZ8/2/17,TSLA-US,Tesla Releases Second Quarter 2017 Financial Results,PMZ8/2/17,TSLA-US,Tesla Motors Reports Second Quarter 2017 Financial Results,NEWS_CR7/11/17,TSLA-US,"Tesla, Inc.(TSLA-US) Schedules Q2 2017 Earnings Call for 2-August-2017 5:30 PM ET",FCSTEV7/11/17,TSLA-US,"Tesla, Inc.(TSLA-US) Schedules Q2 2017 Earnings Release for 2-August-2017 After Market Hours ET",FCSTEV7/11/17,TSLA-US,Tesla Announces Date for Second Quarter 2017 Financial Results and Webcast,PMZ7/7/17,TSLA-US,UPDATE - Tesla Q2 2017 Vehicle Production and Deliveries,PMZ7/3/17,TSLA-US,Tesla Q2 2017 Vehicle Production and Deliveries,PMZ7/2/17,TSLA-US,"Tesla, Inc.(TSLA-US) Schedules Q2 2017 Sales and Revenue Release - Production Results for 7-July-2017",FCSTEV6/22/17,TSLA-US,Corporate News Blog - NTSB Gives Clean Chit to Tesla in the Fatal May 2016 Car Crash Investigation,NEWS_ACW6/7/17,TSLA-US,Today's Research Reports on Stocks to Watch: Tesla and AMD,NEWS_ACW6/6/17,TSLA-US,"Tesla, Inc.(TSLA-US) Schedules Baird Global Consumer, Technology and Services Conference for 6-June-2017 2:35 PM ET",FCSTEV5/9/17,TSLA-US,"Investor Network: Maxwell Technologies, Inc. to Host Earnings Call",NEWS_ACW5/5/17,TSLA-US,Today's Research Reports on Stocks to Watch: Apple and Tesla,NEWS_ACW5/3/17,TSLA-US,"IMPORTANT SHAREHOLDER ALERT: Khang & Khang LLP Announces an Investigation of Tesla, Inc. and Encourages Investors with Losses to Contact the Firm",BW5/3/17,TSLA-US,Tesla Releases First Quarter 2017 Financial Results,INW5/3/17,TSLA-US,"Tesla Motors, Inc. First Quarter 2017 Financial Results",NEWS_CR5/3/17,TSLA-US,"EQUITY ALERT: Rosen Law Firm Announces Investigation of Securities Claims Against Tesla, Inc. - TSLA",BW5/3/17,TSLA-US,"SHAREHOLDER ALERT: Bronstein, Gewirtz & Grossman, LLC Announces Investigation of Tesla, Inc. (TSLA)",PRN4/23/17,TSLA-US,"Tesla, Inc.(TSLA-US) Schedules Annual General Meeting for 6-June-2017 5:30 PM ET",FCSTTS4/19/17,TSLA-US,Hagens Berman: Tesla Owners Hit Automaker with Class-Action Lawsuit for Nonfunctional Autopilot and Missing Standard Safety Features,BW4/17/17,TSLA-US,Today's Research Reports on Automotive Stocks to Watch: Tesla and Ford,NEWS_ACW4/13/17,TSLA-US,"Tesla, Inc.(TSLA-US) Schedules Q1 2017 Earnings Call for 3-May-2017 5:30 PM ET",FCSTEV4/13/17,TSLA-US,"Tesla Motors, Inc.(TSLA-US) Schedules Q1 2017 Earnings Release for 3-May-2017 After Market Hours ET",FCSTEV4/13/17,TSLA-US,Tesla Announces Date for First Quarter 2017 Financial Results and Webcast,INW4/4/17,TSLA-US,Tesla in the Spotlight as it Surpasses Ford in Market Value,NEWS_ACW4/2/17,TSLA-US,Tesla Q1 2017 Vehicle Production and Deliveries,INW4/1/17,TSLA-US,"Tesla, Inc.(TSLA-US) Schedules Q1 2017 Sales and Revenue Release for 2-April-2017",FCSTTS3/20/17,TSLA-US,DGAP-News: Ex-Tesla Deutschland Chef wird Aufsichtsrat der salesheads AG erweitern,NEWS_DGAP3/15/17,TSLA-US,Tesla Announces Offerings of Common Stock and Convertible Senior Notes,INW3/13/17,TSLA-US,Post Earnings Coverage as Tesla's Quarterly Revenue Surged 88.4%; Net Loss Narrowed,NEWS_ACW3/2/17,TSLA-US,Teslas Cousin ist Wegbereiter für revolutionäres öffentliches Angebot,PRNE2/28/17,TSLA-US,Dow Hits Record Close for 12th Consecutive Session: Today's Research Reports on Tesla and NVIDIA,NEWS_ACW2/22/17,TSLA-US,Tesla Releases Fourth Quarter and Full Year 2016 Financial Results,INW2/22/17,TSLA-US,Tesla Fourth Quarter 2016 Shareholder Letter,NEWS_CR2/15/17,TSLA-US,DJ IRW-PRESS: Tesla Motors Inc.: Millionendepot: Tesla - Kursziel auf 350 von 330 Euro erhöht,DJIR2/9/17,TSLA-US,Today's Reports on Trending Tickers: Tesla and Western Digital,NEWS_ACW2/2/17,TSLA-US,"Tesla, Inc.(TSLA-US) Schedules Q4 2016 Earnings Call for 22-February-2017 5:30 PM ET",FCSTEV2/2/17,TSLA-US,"Tesla, Inc.(TSLA-US) Schedules Q4 2016 Earnings Release for 22-February-2017 After Market Hours ET",FCSTEV2/2/17,TSLA-US,Tesla Announces Date for Fourth Quarter and Full Year 2016 Financial Results and Webcast,INW1/4/17,TSLA-US,DJ Telsa Motors - Hoffnung trotz enttäuschender Verkaufszahlen,DJPA1/4/17,TSLA-US,DJ pressetext.de: Telsa Motors - Hoffnung trotz enttäuschender Verkaufszahlen,DJPA1/4/17,TSLA-US,DJ Telsa Motors - Hoffnung trotz enttäuschender -2-,DJPA1/4/17,TSLA-US,DJ pressetext.de: Telsa Motors - Hoffnung trotz -2-,DJPA1/3/17,TSLA-US,Tesla Q4 2016 Production and Deliveries,INW1/2/17,TSLA-US,"Tesla, Inc.(TSLA-US) Schedules Q4 2016 Sales and Revenue Release for 3-January-2017",FCSTTS12/28/16,TSLA-US,Blog Coverage Panasonic and Tesla Motor Signs Agreement to Start Solar Cell Production at New York Facility,NEWS_ACW12/27/16,TSLA-US,DJ IRW-PRESS: Tesla Motors Inc.: Millionendepot: Tesla - Kursziel auf 330 Euro erhöht,DJIR12/27/16,TSLA-US,DJ IRW-PRESS: Tesla Motors Inc.: Millionendepot: -2-,DJIR11/15/16,TSLA-US,Tesla Announces Special Meeting of Shareholders and Public Webcast,INW11/4/16,TSLA-US,PostEarningsCoverageasTeslaReportsBlockbusterQuarterwithRevenueRocketing1.45andNetOrdersSoaring0.68NEWS_ACW,11/3/16,TSLA-US,Compañía holandesa por delante de Tesla con el desarrollo de tejas solares,PRNE11/3/16,TSLA-US,Une société néerlandaise devance Tesla avec la création de ses tuiles solaires,PRNE11/3/16,TSLA-US,_ _________ _____ __,PRNA11/2/16,TSLA-US,Niederländisches Unternehmen ist Tesla bei der Entwicklung des Solardachziegels voraus,PRNE11/2/16,TSLA-US,Una compañía holandesa se adelanta a Tesla con el desarrollo de tejas solares para techos,PRNL10/31/16,TSLA-US,"Tesla, Inc.(TSLA-US) Schedules Acquisition of SolarCity Corp by Tesla Motors Inc Call for 1-November-2016 5:00 PM ET",FCSTEV10/31/16,TSLA-US,Question & Answer Webcast to Discuss Tesla's Pending Acquisition of SolarCity,INW10/28/16,TSLA-US,Blog Coverage SolarCity and Balfour Beatty Communities Help Air Force Housing Across Four States Go Green,NEWS_ACW10/26/16,TSLA-US,Tesla Motors Reports Third Quarter 2016 Financial Results,NEWS_CR10/26/16,TSLA-US,Tesla Releases Third Quarter 2016 Financial Results,INW10/15/16,TSLA-US,"Tesla, Inc.(TSLA-US) Schedules Extraordinary Shareholders Meeting for 17-November-2016 4:00 PM ET",FCSTEV10/13/16,TSLA-US,"DEADLINE ALERT: Bronstein, Gewirtz & Grossman, LLC Notifies Investors of Class Action Against SolarCity Corporation (SCTY) & Lead Plaintiff Deadline - October 14, 2016",NEWS_ACW10/7/16,TSLA-US,"Tesla, Inc.(TSLA-US) Schedules Q3 2016 Earnings Call for 26-October-2016 5:30 PM ET",FCSTEV10/7/16,TSLA-US,"Tesla, Inc.(TSLA-US) Schedules Q3 2016 Earnings Release for 26-October-2016 After Market Hours ET",FCSTEV10/7/16,TSLA-US,Tesla Announces Release Date for Third Quarter 2016 Financial Results,INW10/7/16,TSLA-US,"SHAREHOLDER ALERT - Bronstein, Gewirtz & Grossman, LLC Notifies Investors of Class Action Against SolarCity Corporation (SCTY) & Lead Plaintiff Deadline - October 14, 2016",NEWS_ACW10/5/16,TSLA-US,"SHAREHOLDER ALERT - Bronstein, Gewirtz & Grossman, LLC Notifies Investors of Class Action Against SolarCity Corporation (SCTY) & Lead Plaintiff Deadline: October 14, 2016",NEWS_ACW10/2/16,TSLA-US,Tesla Q3 2016 Production and Deliveries,INW10/1/16,TSLA-US,"Tesla, Inc.(TSLA-US) Schedules Q3 2016 Sales and Revenue Release - Production Results for 2-October-2016",FCSTEV9/30/16,TSLA-US,"SHAREHOLDER ALERT: Bronstein, Gewirtz & Grossman, LLC Notifies Investors of Class Action Against SolarCity Corporation (SCTY) & Lead Plaintiff Deadline: October 14, 2016",NEWS_ACW9/29/16,TSLA-US,"STOCKHOLDER ALERT: Levi & Korsinsky, LLP Has Commenced a Lawsuit Against Elon Musk and Others Concerning Tesla's Proposed Acquisition of SolarCity",NEWS_ACW9/23/16,TSLA-US,"Eric Branderiz to Join Tesla as Vice President, Corporate Controller and Chief Accounting Officer",INW9/15/16,TSLA-US,"Tesla, Inc.(TSLA-US) Schedules Dougherty & Company Institutional Investor Conference for 28-September-2016",FCSTEV8/7/16,TSLA-US,DJ IRW-PRESS: Tesla Motors Inc.: Millionendepot: Tesla Motors Kursziel 300 Euro,DJIR8/3/16,TSLA-US,Tesla Releases Second Quarter 2016 Financial Results,INW8/3/16,TSLA-US,Tesla Motors Reports Second Quarter 2016 Financial Results,NEWS_CR8/1/16,TSLA-US,"Tesla, Inc.(TSLA-US) Schedules J.P. Morgan Auto Conference for 10-August-2016 11:30 AM ET",FCSTEV8/1/16,TSLA-US,"SHAREHOLDER ALERT: Levi & Korsinsky, LLP Announces an Investigation Concerning the Fairness of the Sale of SolarCity Corporation to Tesla Motors, Inc. - SCTY",NEWS_ACW8/1/16,TSLA-US,"Tesla, Inc.(TSLA-US) Schedules Acquisition of SolarCity Corp by Tesla Motors, Inc Update Call for 1-August-2016 8:00 AM ET",FCSTEV7/19/16,TSLA-US,"Tesla, Inc.(TSLA-US) Schedules Q2 2016 Earnings Release for 3-August-2016 After Market Hours ET",FCSTEV7/19/16,TSLA-US,"Tesla, Inc.(TSLA-US) Schedules Q2 2016 Earnings Call for 3-August-2016 5:30 PM ET",FCSTEV7/19/16,TSLA-US,Tesla Announces Release Date for Second Quarter 2016 Financial Results,INW7/3/16,TSLA-US,Tesla Q2 2016 Vehicle Production and Deliveries,INW7/2/16,TSLA-US,"Tesla, Inc.(TSLA-US) Schedules Q2 2016 Sales and Revenue Release for 3-July-2016",FCSTEV6/28/16,TSLA-US,Battery Market for Plug-in Vehicles to Rise to $10 Billion in 2020,INW6/22/16,TSLA-US,"Tesla, Inc.(TSLA-US) Schedules Acquisition of SolarCity Corp by Tesla Motors, Inc Call for 22-June-2016 7:30 AM ET",FCSTEV6/21/16,TSLA-US,Tesla Announces Call to Discuss Offer to Acquire SolarCity,INW5/18/16,TSLA-US,Tesla Raising Money to Accelerate the Ramp of Model 3,INW5/4/16,TSLA-US,Tesla Releases First Quarter 2016 Financial Results,INW5/4/16,TSLA-US,Tesla Motors Reports First Quarter 2016 Financial Results,NEWS_CR4/20/16,TSLA-US,"Tesla, Inc.(TSLA-US) Schedules Q1 2016 Earnings Call for 4-May-2016 5:30 PM ET",FCSTEV4/20/16,TSLA-US,"Tesla, Inc.(TSLA-US) Schedules Q1 2016 Earnings Release for 4-May-2016 After Market Hours ET",FCSTEV4/20/16,TSLA-US,Tesla Announces Release Date for First Quarter 2016 Financial Results,INW4/20/16,TSLA-US,"Tesla, Inc.(TSLA-US) Schedules Annual General Meeting for 31-May-2016 5:00 PM ET",FCSTEV4/10/16,TSLA-US,DJ IRW-PRESS: Tesla Motors Inc.: Perlentrader: Tesla EURO 350 Kursziel wegen Model 3?,DJIR4/10/16,TSLA-US,DJ IRW-PRESS: Tesla Motors Inc.: Perlentrader: Tesla -2-,DJIR4/4/16,TSLA-US,"Tesla Delivers 14,820 Vehicles in Q1 2016; On Track for Full-Year Delivery Guidance",INW4/3/16,TSLA-US,"Tesla, Inc.(TSLA-US) Schedules Q1 2016 Sales and Revenue Release for 4-April-2016",FCSTEV3/22/16,TSLA-US,Devonshire Research Group Announces the Issuance of Tesla's Intellectual Property Research Analysis,INW3/6/16,TSLA-US,DJ IRW-PRESS: Tesla Motors Inc.: Perlentrader: Tesla Motors Der Shortqueeze wird kommen! Kaufen sie weiterhin Aktien,DJIR3/6/16,TSLA-US,DJ IRW-PRESS: Tesla Motors Inc.: Perlentrader: Tesla -2-,DJIR2/10/16,TSLA-US,Tesla Releases Fourth Quarter and Full Year 2015 Financial Results,INW2/10/16,TSLA-US,"Tesla Motors, Inc.Reports Fourth Quarter 2015 Financial Results",NEWS_CR2/9/16,TSLA-US,DJ IRW-PRESS: Tesla Motors Inc.: Perlentrader: Tesla Die Zahlen zum dritten Quartal,DJIR2/4/16,TSLA-US,Tesla Motors' CEO Elon Musk Confirmed the Concept of Mobile Batteries as Range Extenders,PRN1/25/16,TSLA-US,"Tesla, Inc.(TSLA-US) Schedules Q4 2015 Earnings Release for 10-February-2016 After Market Hours ET",FCSTEV1/25/16,TSLA-US,"Tesla, Inc.(TSLA-US) Schedules Q4 2015 Earnings Call for 10-February-2016 5:30 PM ET",FCSTEV1/25/16,TSLA-US,Tesla Announces Release Date for Fourth Quarter and Full Year 2015 Financial Results,INW1/3/16,TSLA-US,"Tesla Delivers 17,400 Vehicles in Q4 2015; Total 2015 Deliveries Were 50,580",INW12/16/15,TSLA-US,"Direction of Market Influences - Analyst Notes on Maxwell Technologies, Organovo Holdings, Abraxas Petroleum and Versartis",NEWS_ACW12/1/15,TSLA-US,Tesla elektrisiert Düsseldorf mit einem Store auf der Königsallee,PRNE11/30/15,TSLA-US,Tesla erweitert Supercharger netz in der Schweiz,PRNE11/26/15,TSLA-US,Tesla eröffnet Basel City Store am St.-Alban-Graben,PRNE11/23/15,TSLA-US,"Tesla, Inc.(TSLA-US) Schedules Credit Suisse Global Industrials Conference for 3-December-2015 1:30 PM ET",FCSTTS11/20/15,TSLA-US,"Beyond the Chart, What Price Data Reveals - Research on Maxwell Technologies, Cloud Peak Energy, Sequenom and Care.com",NEWS_ACW11/11/15,TSLA-US,"Tesla, Inc.(TSLA-US) Schedules Robert W. Baird & Co. Industrial Conference for 11-November-2015 2:00 PM ET",FCSTTS11/3/15,TSLA-US,"Tesla Announces New Leadership in Finance, Sales & Service",INW11/3/15,TSLA-US,Tesla Releases Third Quarter 2015 Financial Results,INW11/3/15,TSLA-US,Tesla Third Quarter 2015 Shareholder Letter,NEWS_CR10/21/15,TSLA-US,DJ IRW-PRESS: Tesla Motors Inc.: Das Millionendepot: Tesla Motors Bei Schwäche kaufen mit Kursziel 300 Euro,DJIR10/21/15,TSLA-US,DJ IRW-PRESS: Tesla Motors Inc.: Das Millionendepot: -2-,DJIR10/19/15,TSLA-US,"Tesla, Inc.(TSLA-US) Schedules Q3 2015 Earnings Release for 3-November-2015 After Market Hours ET",FCSTEV10/19/15,TSLA-US,"Tesla, Inc.(TSLA-US) Schedules Q3 2015 Earnings Call for 3-November-2015 5:30 PM ET",FCSTTS10/19/15,TSLA-US,Tesla Announces Release Date for Third Quarter 2015 Financial Results,INW10/2/15,TSLA-US,"Tesla Delivers 11,580 Vehicles in Q3 of 2015",INW10/1/15,TSLA-US,"Tesla, Inc.(TSLA-US) Schedules Q3 2015 Sales and Revenue Release for 2-October-2015",FCSTTS9/28/15,TSLA-US,Tesla eröffnet werk in Tilburg für die auslieferung des Model S in Europa,PRNE9/28/15,TSLA-US,Tesla apre l'impianto di Tilburg per la fornitura di vetture Model S in tutta Europa,PRNE8/17/15,TSLA-US,Tesla eröffnet neues Service Center und Supercharger Station in Graz,PRNE8/13/15,TSLA-US,Tesla Announces $500 Million Common Stock Offering,INW8/5/15,TSLA-US,Tesla Releases Second Quarter 2015 Financial Results,INW8/5/15,TSLA-US,"Tesla Motors, Inc. Second Quarter 2015 Shareholder Letter and Financial Results",NEWS_CR8/3/15,TSLA-US,"Tesla, Inc.(TSLA-US) Schedules J.P. Morgan Auto Conference for 12-August-2015 11:20 AM ET",FCSTTS7/22/15,TSLA-US,Teslas Supercharger Station eröffnet in Dietlikon,PRNE7/22/15,TSLA-US,"Tesla, Inc.(TSLA-US) Schedules Q2 2015 Earnings Release for 5-August-2015 After Market Hours ET",FCSTEV7/22/15,TSLA-US,"Tesla, Inc.(TSLA-US) Schedules Q2 2015 Earnings Call for 5-August-2015 5:30 PM ET",FCSTTS7/22/15,TSLA-US,Tesla Announces Release Date for Second Quarter 2015 Financial Results,INW7/21/15,TSLA-US,DJ IRW-PRESS: Tesla Motors Inc.: Millionendepot: -2-,DJIR7/21/15,TSLA-US,DJ IRW-PRESS: Tesla Motors Inc.: Millionendepot: Tesla Motors Inc.: Das Kursziel beträgt weiterhin 350 US Dollar,DJIR7/16/15,TSLA-US,Tesla Invites America to Join the Next Billion,INW7/13/15,TSLA-US,Women and Men Are Mostly in Favor of the Tesla Manufacturer-Direct Car Shopping Model,INW7/6/15,TSLA-US,"La rete Supercharger Tesla si espande verso sud, rendendo ancora più agevoli gli spostamenti all'interno dell'Europa",PRNE7/6/15,TSLA-US,Das Supercharger-Netz von Tesla expandiert nach Süden - damit wird das reisen in ganz Europa noch leichter,PRNE7/2/15,TSLA-US,"Tesla Delivers 11,507 Vehicles in Q2 of 2015",INW7/1/15,TSLA-US,"Tesla, Inc.(TSLA-US) Schedules Q2 2015 Sales and Revenue Release for 2-July-2015",FCSTTS6/23/15,TSLA-US,"""One billion miles"": Tesla Model S - mehr als eine milliarde gefahrene elektrische Meilen",PRNE6/23/15,TSLA-US,La Model S di Tesla supera il miliardo di miglia elettriche,PRNE6/19/15,TSLA-US,"Tesla eröffnet neue Supercharger-Station in Villach, Kärnten",PRNE5/18/15,TSLA-US,Tesla digitalisiert den Leasingprozess,PRNE5/7/15,TSLA-US,Select Registry Teams with Tesla Motors,PRN5/6/15,TSLA-US,Tesla Releases First Quarter 2015 Financial Results,INW5/6/15,TSLA-US,"Tesla Motors, Inc. First Quarter 2015 Shareholder Letter and Financial Results",NEWS_CR5/5/15,TSLA-US,NRStor and Opus One partner to bring Tesla Home Battery to Canada,CNW4/30/15,TSLA-US,Jackson Family Wines Collaborates with Tesla Energy to Pilot Stationary Energy Storage Systems,BW4/30/15,TSLA-US,MEDIA ALERT: Tesla Energy Event,INW4/26/15,TSLA-US,DJ IRW-PRESS: Tesla Motors Inc.: Das Millionendepot: Tesla Motors Inc. Kursexplosion auf 300 Euro danke Neubewertung möglich,DJIR4/26/15,TSLA-US,DJ IRW-PRESS: Tesla Motors Inc.: Das Millionendepot: -2-,DJIR4/22/15,TSLA-US,"Tesla, Inc.(TSLA-US) Schedules Annual General Meeting for 9-June-2015 5:00 PM ET",FCSTTS4/22/15,TSLA-US,Tesla Announces 2015 Annual Stockholder Meeting and Public Webcast,INW4/22/15,TSLA-US,"Tesla, Inc.(TSLA-US)SchedulesQ12015EarningsCallfor421305:30PMET",FCSTTS4/22/15,TSLA-US,"Tesla, Inc.(TSLA-US) Schedules Q1 2015 Earnings Release for 6-May-2015 After Market Hours ET",FCSTEV4/22/15,TSLA-US,Tesla Announces Release Date for First Quarter 2015 Financial Results,INW4/3/15,TSLA-US,"Tesla, Inc.(TSLA-US) Schedules Q1 2015 Sales and Revenue Release for 3-April-2015",FCSTTS4/3/15,TSLA-US,"Tesla Delivers 10,030 Vehicles in Q1 of 2015",INW3/26/15,TSLA-US,Tesla eröffnet Deutschlands 30. Supercharger-Station in Waldlaubersheim,PRNE3/16/15,TSLA-US,Tesla Opent Nieuwe Locatie In Amsterdam,PRNE3/11/15,TSLA-US,Tesla introcuceert innovatieve financiering met Tesla Verkoopoptie,PRNE3/11/15,TSLA-US,Tesla annonce le lancement d'un systeme de financement innovant avec garantie de valeur de reprise pour ses clients en Belgique,PRNE3/11/15,TSLA-US,Tesla annuncia l'innovativo programma di finanziamento Garanzia del Valore di Rivendita,PRNE3/11/15,TSLA-US,Tesla tilbyder nu innovativ finansiering med tilbagekøbs-garanti,PRNE3/11/15,TSLA-US,Tesla lanserar innovativ finansiering med återköpsgaranti,PRNE3/11/15,TSLA-US,Tesla kündigt innovative Finanzierung mit Restwertgarantie an,PRNE3/11/15,TSLA-US,Tesla annonce le lancement d'un systeme de financement innovant avec garantie de valeur de reprise pour ses clients en France,PRNE3/10/15,TSLA-US,Tesla bietet Finanzierung in Österreich an,PRNE2/26/15,TSLA-US,"Tesla, Inc.(TSLA-US) Schedules ROTH Growth Stock Conference for 10-March-2015 12:00 PM ET",FCSTTS2/16/15,TSLA-US,Una stazione Tesla Supercharger apre a Monte Ceneri,PRNE2/16/15,TSLA-US,Teslas Supercharger Station eröffnet am Monte Ceneri Pass,PRNE2/11/15,TSLA-US,"Tesla Motors, Inc. Fourth Quarter 2014 Shareholder Letter and Financial Results",NEWS_CR2/11/15,TSLA-US,CORRECTION - Tesla Releases Fourth Quarter and Full Year 2014 Financial Results,INW2/11/15,TSLA-US,Tesla Releases Fourth Quarter and Full Year 2014 Financial Results,INW2/10/15,TSLA-US,"Tesla Announces Same Day, New Time for Fourth Quarter and Full Year 2014 Financial Results",INW1/29/15,TSLA-US,"Tesla, Inc.(TSLA-US) Schedules Q4 2014 Earnings Release for 11-February-2015 After Market Hours ET",FCSTEV1/29/15,TSLA-US,"Tesla, Inc.(TSLA-US) Schedules Q4 2014 Earnings Call for 11-February-2015 7:30 PM ET",FCSTTS1/29/15,TSLA-US,Tesla Announces Release Date for Fourth Quarter and Full Year 2014 Financial Results,INW1/15/15,TSLA-US,DJ IRW-PRESS: Tesla Motors Inc.: AktienCheck24.com: Tesla Motors Inc. Warum die Aktie trotz der derzeit schlechten Nachrichtenlage leicht die 250 Euro erreichen wird,DJIR1/5/15,TSLA-US,"Tesla, Inc.(TSLA-US) Schedules Deutsche Bank Global Auto Industry Conference for 14-January-2015 12:30 PM ET",FCSTTS12/19/14,TSLA-US,DJ IRW-PRESS: Tesla Motors Inc.: AktienCheck24.com - Tesla Motors Inc.: Das Kursziel ist mindestens 300 Euro,DJIR12/12/14,TSLA-US,Tesla'S Supercharger expansion in der Schweiz geht weiter,PRNE12/12/14,TSLA-US,Tesla Supercharger Network in Switzerland Keeps Growing,PRNE12/9/14,TSLA-US,Tesla Officially Launches in Australia,INW11/26/14,TSLA-US,"Tesla, Inc.(TSLA-US) Schedules Credit Suisse Global Industrials Conference for 3-December-2014 3:45 PM ET",FCSTTS11/11/14,TSLA-US,"Tesla, Inc.(TSLA-US) Schedules Robert W. Baird & Co. Inc Industrial Conference for 11-November-2014 1:30 PM ET",FCSTTS11/6/14,TSLA-US,DJ IRW-PRESS: Tesla Motors Inc.: www.Perlentrader.com Tesla Motors Inc. Ist die Wachstumsstory nach den Quartalszahlen noch intakt?,DJIR11/5/14,TSLA-US,Tesla Releases Third Quarter 2014 Financial Results,INW11/5/14,TSLA-US,"Tesla Motors, Inc. Third Quarter 2014 Shareholder Letter and Financial Results",NEWS_CR11/5/14,TSLA-US,Tesla ouvre un nouveau Store au centre-ville de Genève,PRNE11/5/14,TSLA-US,Tesla Opens New Flagship Store Geneva City Center,PRNE11/3/14,TSLA-US,Tesla's Supercharger Expansion in der Schweiz geht weiter,PRNE10/27/14,TSLA-US,DJ IRW-PRESS: Tesla Motors Inc.: www.Perlentrader.com Tesla Motors Inc. Wie wird sich der Kurs nach dem Ausstieg von Daimler und Toyota entwickeln?,DJIR10/22/14,TSLA-US,"Automakers say yes to extended EV ranges, no to Tesla's battery technology",PRN10/21/14,TSLA-US,"Tesla, Inc.(TSLA-US) Schedules Q3 2014 Earnings Call for 5-November-2014 5:30 PM ET",FCSTTS10/21/14,TSLA-US,"Tesla, Inc.(TSLA-US) Schedules Q3 2014 Earnings Release for 5-November-2014 After Market Hours ET",FCSTEV10/21/14,TSLA-US,Tesla Announces Release Date for Third Quarter Financial Results,INW10/9/14,TSLA-US,Elon Musk's $2 Billion Tweet,PMZ10/8/14,TSLA-US,Tesla eröffnet neue Stores in Hamburg und Berlin,PRNE10/6/14,TSLA-US,Tesla präsentiert von Grund auf neu entwickeltes Finanzierungskonzept,PRNE10/3/14,TSLA-US,Orange Business Services to Provide Wireless Connectivity for Tesla Cars in France,BW9/19/14,TSLA-US,Tesla ouvre son premier Service Center à Genève,PRNE9/19/14,TSLA-US,"Tesla Opens First Service Center in Geneva, Switzerland",PRNE9/17/14,TSLA-US,Tesla's Supercharger Netzwerk wächst weiter,PRNE9/16/14,TSLA-US,Tesla Gigafactory Will Require 8 New Graphite Mines; Great Lakes Graphite is Fast Tracked to Production,PMZ9/9/14,TSLA-US,Tesla's supercharger expansion in Deutschland geht weiter,PRNE9/8/14,TSLA-US,"Tesla Acts Quick, Crowning Nevada As The $5B Gigafactory Host",NEWS_ACW8/20/14,TSLA-US,Tesla Opens New Service Center with Showroom in Antwerp,PRNE8/20/14,TSLA-US,Tesla Opent Nieuw Service Center met Showroom in Antwerpen,PRNE8/15/14,TSLA-US,Tesla erweitert Supercharger-netzwerk in der Schweiz,PRNE8/15/14,TSLA-US,Tesla Expands Supercharger Network in Switzerland,PRNE8/12/14,TSLA-US,Tesla ouvre sa 50ème station Superchargeur en Europe,PRNE8/12/14,TSLA-US,Tesla åpner Supercharger NR. 50 i Europa,PRNE8/12/14,TSLA-US,Tesla åbner Supercharger-station nummer 50 i Europa,PRNE8/12/14,TSLA-US,Tesla opent 50ste Supercharger locatie in Europa,PRNE8/12/14,TSLA-US,Tesla apre la 50[a]stazione Supercharger in Europa,PRNE8/12/14,TSLA-US,Tesla Opens 50th Supercharger Site in Europe,PRN8/12/14,TSLA-US,Tesla öppnar den 50:E Superchargern i Europa,PRNE8/12/14,TSLA-US,Tesla eröffnet 50. Supercharger in Europa,PRNE8/11/14,TSLA-US,"Tesla, Inc.(TSLA-US) Schedules J.P. Morgan Auto Conference for 12-August-2014 2:15 PM ET",FCSTTS7/31/14,TSLA-US,Tesla Releases Second Quarter 2014 Financial Results,INW7/30/14,TSLA-US,Tesla continue l'expansion de son réseau de Superchargeurs en France,PRNE7/17/14,TSLA-US,"Tesla, Inc.(TSLA-US) Schedules Q2 2014 Earnings Release for 31-July-2014 After Market Hours ET",FCSTTS7/17/14,TSLA-US,"Tesla, Inc.(TSLA-US) Schedules Q2 2014 Earnings Call for 31-July-2014 5:30 PM ET",FCSTTS