TSLAdate,TSLAnews,TSLAsource10/10/17,"EQUITY ALERT: Rosen Law Firm Files Securities Class Action Lawsuit Against Tesla, Inc. - TSLA",BW10/10/17,"IMPORTANT SHAREHOLDER ALERT: Khang & Khang LLP Announces an Investigation of Tesla, Inc. and Encourages Investors with Losses Over $100,000 to Contact the Firm",BW10/10/17,"(TSLA) Alert:  Johnson Fistel Investigates Tesla, Inc. Following Report of Vehicle Deliveries and Production; Encourages Investors to Contact the Firm",PRN10/09/17,"SHAREHOLDER ALERT: Goldberg Law PC Announces an Investigation of Tesla, Inc.",BW10/09/17,"SHAREHOLDER ALERT: Bronstein, Gewirtz & Grossman, LLC Announces Investigation of Tesla, Inc. (TSLA)",PRN10/09/17,"SHAREHOLDER ALERT: Pomerantz Law Firm Investigates Claims On Behalf of Investors of Tesla, Inc.  - TSLA",PRN10/02/17,Tesla Q3 2017 Vehicle Deliveries and Production,PMZ10/01/17,"Tesla, Inc.(TSLA-US) Schedules Q3 2017 Sales and Revenue Release - Production Results for 2-October-2017",FCSTEV08/11/17,Tesla Agrees to Issue and Sell $1.80 Billion of Senior Notes,PMZ08/08/17,"Tesla, Inc.(TSLA-US) Schedules Deutsche Bank Technology Conference for 12-September-2017 12:00 PM ET",FCSTEV08/07/17,Tesla Announces Proposed $1.5 Billion Offering of Senior Notes,PMZ08/02/17,Tesla Releases Second Quarter 2017 Financial Results,PMZ08/02/17,Tesla Motors Reports Second Quarter 2017 Financial Results,NEWS_CR07/11/17,"Tesla, Inc.(TSLA-US) Schedules Q2 2017 Earnings Call for 2-August-2017 5:30 PM ET",FCSTEV07/11/17,"Tesla, Inc.(TSLA-US) Schedules Q2 2017 Earnings Release for 2-August-2017 After Market Hours ET",FCSTEV07/11/17,Tesla Announces Date for Second Quarter 2017 Financial Results and Webcast,PMZ07/07/17,UPDATE - Tesla Q2 2017 Vehicle Production and Deliveries,PMZ07/03/17,Tesla Q2 2017 Vehicle Production and Deliveries,PMZ07/02/17,"Tesla, Inc.(TSLA-US) Schedules Q2 2017 Sales and Revenue Release - Production Results for 7-July-2017",FCSTEV06/22/17,Corporate News Blog - NTSB Gives Clean Chit to Tesla in the Fatal May 2016 Car Crash Investigation,NEWS_ACW06/07/17,Today's Research Reports on Stocks to Watch: Tesla and AMD,NEWS_ACW06/06/17,"Tesla, Inc.(TSLA-US) Schedules Baird Global Consumer, Technology and Services Conference for 6-June-2017 2:35 PM ET",FCSTEV05/09/17,"Investor Network: Maxwell Technologies, Inc. to Host Earnings Call",NEWS_ACW05/05/17,Today's Research Reports on Stocks to Watch: Apple and Tesla,NEWS_ACW05/03/17,"IMPORTANT SHAREHOLDER ALERT: Khang & Khang LLP Announces an Investigation of Tesla, Inc. and Encourages Investors with Losses to Contact the Firm",BW05/03/17,Tesla Releases First Quarter 2017 Financial Results,INW05/03/17,"Tesla Motors, Inc. First Quarter 2017 Financial Results",NEWS_CR05/03/17,"EQUITY ALERT: Rosen Law Firm Announces Investigation of Securities Claims Against Tesla, Inc. - TSLA",BW05/03/17,"SHAREHOLDER ALERT: Bronstein, Gewirtz & Grossman, LLC Announces Investigation of Tesla, Inc. (TSLA)",PRN04/23/17,"Tesla, Inc.(TSLA-US) Schedules Annual General Meeting for 6-June-2017 5:30 PM ET",FCSTTS04/19/17,Hagens Berman: Tesla Owners Hit Automaker with Class-Action Lawsuit for Nonfunctional Autopilot and Missing Standard Safety Features,BW04/17/17,Today's Research Reports on Automotive Stocks to Watch: Tesla and Ford,NEWS_ACW04/13/17,"Tesla, Inc.(TSLA-US) Schedules Q1 2017 Earnings Call for 3-May-2017 5:30 PM ET",FCSTEV04/13/17,"Tesla Motors, Inc.(TSLA-US) Schedules Q1 2017 Earnings Release for 3-May-2017 After Market Hours ET",FCSTEV04/13/17,Tesla Announces Date for First Quarter 2017 Financial Results and Webcast,INW04/04/17,Tesla in the Spotlight as it Surpasses Ford in Market Value,NEWS_ACW04/02/17,Tesla Q1 2017 Vehicle Production and Deliveries,INW04/01/17,"Tesla, Inc.(TSLA-US) Schedules Q1 2017 Sales and Revenue Release for 2-April-2017",FCSTTS03/20/17,DGAP-News: Ex-Tesla Deutschland Chef wird Aufsichtsrat der salesheads AG erweitern,NEWS_DGAP03/15/17,Tesla Announces Offerings of Common Stock and Convertible Senior Notes,INW03/13/17,Post Earnings Coverage as Tesla's Quarterly Revenue Surged 88.4%; Net Loss Narrowed,NEWS_ACW03/02/17,Teslas Cousin ist Wegbereiter fŸr revolution_res _ffentliches Angebot,PRNE02/28/17,Dow Hits Record Close for 12th Consecutive Session: Today's Research Reports on Tesla and NVIDIA,NEWS_ACW02/22/17,Tesla Releases Fourth Quarter and Full Year 2016 Financial Results,INW02/22/17,Tesla Fourth Quarter 2016 Shareholder Letter,NEWS_CR02/15/17,DJ IRW-PRESS: Tesla Motors Inc.: Millionendepot: Tesla - Kursziel auf 350 von 330 Euro erh_ht,DJIR02/09/17,Today's Reports on Trending Tickers: Tesla and Western Digital,NEWS_ACW02/02/17,"Tesla, Inc.(TSLA-US) Schedules Q4 2016 Earnings Call for 22-February-2017 5:30 PM ET",FCSTEV02/02/17,"Tesla, Inc.(TSLA-US) Schedules Q4 2016 Earnings Release for 22-February-2017 After Market Hours ET",FCSTEV02/02/17,Tesla Announces Date for Fourth Quarter and Full Year 2016 Financial Results and Webcast,INW01/04/17,DJ Telsa Motors - Hoffnung trotz entt_uschender Verkaufszahlen,DJPA01/04/17,DJ pressetext.de: Telsa Motors - Hoffnung trotz entt_uschender Verkaufszahlen,DJPA01/04/17,DJ Telsa Motors - Hoffnung trotz entt_uschender -2-,DJPA01/04/17,DJ pressetext.de: Telsa Motors - Hoffnung trotz -2-,DJPA01/03/17,Tesla Q4 2016 Production and Deliveries,INW01/02/17,"Tesla, Inc.(TSLA-US) Schedules Q4 2016 Sales and Revenue Release for 3-January-2017",FCSTTS12/28/16,Blog Coverage Panasonic and Tesla Motor Signs Agreement to Start Solar Cell Production at New York Facility,NEWS_ACW12/27/16,DJ IRW-PRESS: Tesla Motors Inc.: Millionendepot: Tesla - Kursziel auf 330 Euro erh_ht,DJIR12/27/16,DJ IRW-PRESS: Tesla Motors Inc.: Millionendepot: -2-,DJIR11/15/16,Tesla Announces Special Meeting of Shareholders and Public Webcast,INW11/04/16,PostEarningsCoverageasTeslaReportsBlockbusterQuarterwithRevenueRocketing1.45andNetOrdersSoaring0.68NEWS_ACW,11/03/16,Compa–’a holandesa por delante de Tesla con el desarrollo de tejas solares,PRNE11/03/16,Une soci_t_ n_erlandaise devance Tesla avec la cr_ation de ses tuiles solaires,PRNE11/03/16,_ _________ _____ __,PRNA11/02/16,Niederl_ndisches Unternehmen ist Tesla bei der Entwicklung des Solardachziegels voraus,PRNE11/02/16,Una compa–’a holandesa se adelanta a Tesla con el desarrollo de tejas solares para techos,PRNL10/31/16,"Tesla, Inc.(TSLA-US) Schedules Acquisition of SolarCity Corp by Tesla Motors Inc Call for 1-November-2016 5:00 PM ET",FCSTEV10/31/16,Question & Answer Webcast to Discuss Tesla's Pending Acquisition of SolarCity,INW10/28/16,Blog Coverage SolarCity and Balfour Beatty Communities Help Air Force Housing Across Four States Go Green,NEWS_ACW10/26/16,Tesla Motors Reports Third Quarter 2016 Financial Results,NEWS_CR10/26/16,Tesla Releases Third Quarter 2016 Financial Results,INW10/15/16,"Tesla, Inc.(TSLA-US) Schedules Extraordinary Shareholders Meeting for 17-November-2016 4:00 PM ET",FCSTEV10/13/16,"DEADLINE ALERT: Bronstein, Gewirtz & Grossman, LLC Notifies Investors of Class Action Against SolarCity Corporation (SCTY) & Lead Plaintiff Deadline - October 14, 2016",NEWS_ACW10/07/16,"Tesla, Inc.(TSLA-US) Schedules Q3 2016 Earnings Call for 26-October-2016 5:30 PM ET",FCSTEV10/07/16,"Tesla, Inc.(TSLA-US) Schedules Q3 2016 Earnings Release for 26-October-2016 After Market Hours ET",FCSTEV10/07/16,Tesla Announces Release Date for Third Quarter 2016 Financial Results,INW10/07/16,"SHAREHOLDER ALERT - Bronstein, Gewirtz & Grossman, LLC Notifies Investors of Class Action Against SolarCity Corporation (SCTY) & Lead Plaintiff Deadline - October 14, 2016",NEWS_ACW10/05/16,"SHAREHOLDER ALERT - Bronstein, Gewirtz & Grossman, LLC Notifies Investors of Class Action Against SolarCity Corporation (SCTY) & Lead Plaintiff Deadline: October 14, 2016",NEWS_ACW10/02/16,Tesla Q3 2016 Production and Deliveries,INW10/01/16,"Tesla, Inc.(TSLA-US) Schedules Q3 2016 Sales and Revenue Release - Production Results for 2-October-2016",FCSTEV09/30/16,"SHAREHOLDER ALERT: Bronstein, Gewirtz & Grossman, LLC Notifies Investors of Class Action Against SolarCity Corporation (SCTY) & Lead Plaintiff Deadline: October 14, 2016",NEWS_ACW09/29/16,"STOCKHOLDER ALERT: Levi & Korsinsky, LLP Has Commenced a Lawsuit Against Elon Musk and Others Concerning Tesla's Proposed Acquisition of SolarCity",NEWS_ACW09/23/16,"Eric Branderiz to Join Tesla as Vice President, Corporate Controller and Chief Accounting Officer",INW09/15/16,"Tesla, Inc.(TSLA-US) Schedules Dougherty & Company Institutional Investor Conference for 28-September-2016",FCSTEV08/07/16,DJ IRW-PRESS: Tesla Motors Inc.: Millionendepot: Tesla Motors Kursziel 300 Euro,DJIR08/03/16,Tesla Releases Second Quarter 2016 Financial Results,INW08/03/16,Tesla Motors Reports Second Quarter 2016 Financial Results,NEWS_CR08/01/16,"Tesla, Inc.(TSLA-US) Schedules J.P. Morgan Auto Conference for 10-August-2016 11:30 AM ET",FCSTEV08/01/16,"SHAREHOLDER ALERT: Levi & Korsinsky, LLP Announces an Investigation Concerning the Fairness of the Sale of SolarCity Corporation to Tesla Motors, Inc. - SCTY",NEWS_ACW08/01/16,"Tesla, Inc.(TSLA-US) Schedules Acquisition of SolarCity Corp by Tesla Motors, Inc Update Call for 1-August-2016 8:00 AM ET",FCSTEV07/19/16,"Tesla, Inc.(TSLA-US) Schedules Q2 2016 Earnings Release for 3-August-2016 After Market Hours ET",FCSTEV07/19/16,"Tesla, Inc.(TSLA-US) Schedules Q2 2016 Earnings Call for 3-August-2016 5:30 PM ET",FCSTEV07/19/16,Tesla Announces Release Date for Second Quarter 2016 Financial Results,INW07/03/16,Tesla Q2 2016 Vehicle Production and Deliveries,INW07/02/16,"Tesla, Inc.(TSLA-US) Schedules Q2 2016 Sales and Revenue Release for 3-July-2016",FCSTEV06/28/16,Battery Market for Plug-in Vehicles to Rise to $10 Billion in 2020,INW06/22/16,"Tesla, Inc.(TSLA-US) Schedules Acquisition of SolarCity Corp by Tesla Motors, Inc Call for 22-June-2016 7:30 AM ET",FCSTEV06/21/16,Tesla Announces Call to Discuss Offer to Acquire SolarCity,INW05/18/16,Tesla Raising Money to Accelerate the Ramp of Model 3,INW05/04/16,Tesla Releases First Quarter 2016 Financial Results,INW05/04/16,Tesla Motors Reports First Quarter 2016 Financial Results,NEWS_CR04/20/16,"Tesla, Inc.(TSLA-US) Schedules Q1 2016 Earnings Call for 4-May-2016 5:30 PM ET",FCSTEV04/20/16,"Tesla, Inc.(TSLA-US) Schedules Q1 2016 Earnings Release for 4-May-2016 After Market Hours ET",FCSTEV04/20/16,Tesla Announces Release Date for First Quarter 2016 Financial Results,INW04/20/16,"Tesla, Inc.(TSLA-US) Schedules Annual General Meeting for 31-May-2016 5:00 PM ET",FCSTEV04/10/16,DJ IRW-PRESS: Tesla Motors Inc.: Perlentrader: Tesla EURO 350 Kursziel wegen Model 3?,DJIR04/10/16,DJ IRW-PRESS: Tesla Motors Inc.: Perlentrader: Tesla -2-,DJIR04/04/16,"Tesla Delivers 14,820 Vehicles in Q1 2016; On Track for Full-Year Delivery Guidance",INW04/03/16,"Tesla, Inc.(TSLA-US) Schedules Q1 2016 Sales and Revenue Release for 4-April-2016",FCSTEV03/22/16,Devonshire Research Group Announces the Issuance of Tesla's Intellectual Property Research Analysis,INW03/06/16,DJ IRW-PRESS: Tesla Motors Inc.: Perlentrader: Tesla Motors Der Shortqueeze wird kommen! Kaufen sie weiterhin Aktien,DJIR03/06/16,DJ IRW-PRESS: Tesla Motors Inc.: Perlentrader: Tesla -2-,DJIR02/10/16,Tesla Releases Fourth Quarter and Full Year 2015 Financial Results,INW02/10/16,"Tesla Motors, Inc.Reports Fourth Quarter 2015 Financial Results",NEWS_CR02/09/16,DJ IRW-PRESS: Tesla Motors Inc.: Perlentrader: Tesla Die Zahlen zum dritten Quartal,DJIR02/04/16,Tesla Motors' CEO Elon Musk Confirmed the Concept of Mobile Batteries as Range Extenders,PRN01/25/16,"Tesla, Inc.(TSLA-US) Schedules Q4 2015 Earnings Release for 10-February-2016 After Market Hours ET",FCSTEV01/25/16,"Tesla, Inc.(TSLA-US) Schedules Q4 2015 Earnings Call for 10-February-2016 5:30 PM ET",FCSTEV01/25/16,Tesla Announces Release Date for Fourth Quarter and Full Year 2015 Financial Results,INW01/03/16,"Tesla Delivers 17,400 Vehicles in Q4 2015; Total 2015 Deliveries Were 50,580",INW12/16/15,"Direction of Market Influences - Analyst Notes on Maxwell Technologies, Organovo Holdings, Abraxas Petroleum and Versartis",NEWS_ACW12/01/15,Tesla elektrisiert DŸsseldorf mit einem Store auf der K_nigsallee,PRNE11/30/15,Tesla erweitert Supercharger netz in der Schweiz,PRNE11/26/15,Tesla er_ffnet Basel City Store am St.-Alban-Graben,PRNE11/23/15,"Tesla, Inc.(TSLA-US) Schedules Credit Suisse Global Industrials Conference for 3-December-2015 1:30 PM ET",FCSTTS11/20/15,"Beyond the Chart, What Price Data Reveals - Research on Maxwell Technologies, Cloud Peak Energy, Sequenom and Care.com",NEWS_ACW11/11/15,"Tesla, Inc.(TSLA-US) Schedules Robert W. Baird & Co. Industrial Conference for 11-November-2015 2:00 PM ET",FCSTTS11/03/15,"Tesla Announces New Leadership in Finance, Sales & Service",INW11/03/15,Tesla Releases Third Quarter 2015 Financial Results,INW11/03/15,Tesla Third Quarter 2015 Shareholder Letter,NEWS_CR10/21/15,DJ IRW-PRESS: Tesla Motors Inc.: Das Millionendepot: Tesla Motors Bei Schw_che kaufen mit Kursziel 300 Euro,DJIR10/21/15,DJ IRW-PRESS: Tesla Motors Inc.: Das Millionendepot: -2-,DJIR10/19/15,"Tesla, Inc.(TSLA-US) Schedules Q3 2015 Earnings Release for 3-November-2015 After Market Hours ET",FCSTEV10/19/15,"Tesla, Inc.(TSLA-US) Schedules Q3 2015 Earnings Call for 3-November-2015 5:30 PM ET",FCSTTS10/19/15,Tesla Announces Release Date for Third Quarter 2015 Financial Results,INW10/02/15,"Tesla Delivers 11,580 Vehicles in Q3 of 2015",INW10/01/15,"Tesla, Inc.(TSLA-US) Schedules Q3 2015 Sales and Revenue Release for 2-October-2015",FCSTTS09/28/15,Tesla er_ffnet werk in Tilburg fŸr die auslieferung des Model S in Europa,PRNE09/28/15,Tesla apre l'impianto di Tilburg per la fornitura di vetture Model S in tutta Europa,PRNE08/17/15,Tesla er_ffnet neues Service Center und Supercharger Station in Graz,PRNE08/13/15,Tesla Announces $500 Million Common Stock Offering,INW08/05/15,Tesla Releases Second Quarter 2015 Financial Results,INW08/05/15,"Tesla Motors, Inc. Second Quarter 2015 Shareholder Letter and Financial Results",NEWS_CR08/03/15,"Tesla, Inc.(TSLA-US) Schedules J.P. Morgan Auto Conference for 12-August-2015 11:20 AM ET",FCSTTS07/22/15,Teslas Supercharger Station er_ffnet in Dietlikon,PRNE07/22/15,"Tesla, Inc.(TSLA-US) Schedules Q2 2015 Earnings Release for 5-August-2015 After Market Hours ET",FCSTEV07/22/15,"Tesla, Inc.(TSLA-US) Schedules Q2 2015 Earnings Call for 5-August-2015 5:30 PM ET",FCSTTS07/22/15,Tesla Announces Release Date for Second Quarter 2015 Financial Results,INW07/21/15,DJ IRW-PRESS: Tesla Motors Inc.: Millionendepot: -2-,DJIR07/21/15,DJ IRW-PRESS: Tesla Motors Inc.: Millionendepot: Tesla Motors Inc.: Das Kursziel betr_gt weiterhin 350 US Dollar,DJIR07/16/15,Tesla Invites America to Join the Next Billion,INW07/13/15,Women and Men Are Mostly in Favor of the Tesla Manufacturer-Direct Car Shopping Model,INW07/06/15,"La rete Supercharger Tesla si espande verso sud, rendendo ancora più agevoli gli spostamenti all'interno dell'Europa",PRNE07/06/15,Das Supercharger-Netz von Tesla expandiert nach SŸden - damit wird das reisen in ganz Europa noch leichter,PRNE07/02/15,"Tesla Delivers 11,507 Vehicles in Q2 of 2015",INW07/01/15,"Tesla, Inc.(TSLA-US) Schedules Q2 2015 Sales and Revenue Release for 2-July-2015",FCSTTS06/23/15,"""One billion miles"": Tesla Model S - mehr als eine milliarde gefahrene elektrische Meilen",PRNE06/23/15,La Model S di Tesla supera il miliardo di miglia elettriche,PRNE06/19/15,"Tesla er_ffnet neue Supercharger-Station in Villach, K_rnten",PRNE05/18/15,Tesla digitalisiert den Leasingprozess,PRNE05/07/15,Select Registry Teams with Tesla Motors,PRN05/06/15,Tesla Releases First Quarter 2015 Financial Results,INW05/06/15,"Tesla Motors, Inc. First Quarter 2015 Shareholder Letter and Financial Results",NEWS_CR05/05/15,NRStor and Opus One partner to bring Tesla Home Battery to Canada,CNW04/30/15,Jackson Family Wines Collaborates with Tesla Energy to Pilot Stationary Energy Storage Systems,BW04/30/15,MEDIA ALERT: Tesla Energy Event,INW04/26/15,DJ IRW-PRESS: Tesla Motors Inc.: Das Millionendepot: Tesla Motors Inc. Kursexplosion auf 300 Euro danke Neubewertung m_glich,DJIR04/26/15,DJ IRW-PRESS: Tesla Motors Inc.: Das Millionendepot: -2-,DJIR04/22/15,"Tesla, Inc.(TSLA-US) Schedules Annual General Meeting for 9-June-2015 5:00 PM ET",FCSTTS04/22/15,Tesla Announces 2015 Annual Stockholder Meeting and Public Webcast,INW04/22/15,"Tesla, Inc.(TSLA-US)SchedulesQ12015EarningsCallfor421305:30PMET",FCSTTS04/22/15,"Tesla, Inc.(TSLA-US) Schedules Q1 2015 Earnings Release for 6-May-2015 After Market Hours ET",FCSTEV04/22/15,Tesla Announces Release Date for First Quarter 2015 Financial Results,INW04/03/15,"Tesla, Inc.(TSLA-US) Schedules Q1 2015 Sales and Revenue Release for 3-April-2015",FCSTTS04/03/15,"Tesla Delivers 10,030 Vehicles in Q1 of 2015",INW03/26/15,Tesla er_ffnet Deutschlands 30. Supercharger-Station in Waldlaubersheim,PRNE03/16/15,Tesla Opent Nieuwe Locatie In Amsterdam,PRNE03/11/15,Tesla introcuceert innovatieve financiering met Tesla Verkoopoptie,PRNE03/11/15,Tesla annonce le lancement d'un systeme de financement innovant avec garantie de valeur de reprise pour ses clients en Belgique,PRNE03/11/15,Tesla annuncia l'innovativo programma di finanziamento Garanzia del Valore di Rivendita,PRNE03/11/15,Tesla tilbyder nu innovativ finansiering med tilbagek¿bs-garanti,PRNE03/11/15,Tesla lanserar innovativ finansiering med Œterk_psgaranti,PRNE03/11/15,Tesla kŸndigt innovative Finanzierung mit Restwertgarantie an,PRNE03/11/15,Tesla annonce le lancement d'un systeme de financement innovant avec garantie de valeur de reprise pour ses clients en France,PRNE03/10/15,Tesla bietet Finanzierung in …sterreich an,PRNE02/26/15,"Tesla, Inc.(TSLA-US) Schedules ROTH Growth Stock Conference for 10-March-2015 12:00 PM ET",FCSTTS02/16/15,Una stazione Tesla Supercharger apre a Monte Ceneri,PRNE02/16/15,Teslas Supercharger Station er_ffnet am Monte Ceneri Pass,PRNE02/11/15,"Tesla Motors, Inc. Fourth Quarter 2014 Shareholder Letter and Financial Results",NEWS_CR02/11/15,CORRECTION - Tesla Releases Fourth Quarter and Full Year 2014 Financial Results,INW02/11/15,Tesla Releases Fourth Quarter and Full Year 2014 Financial Results,INW02/10/15,"Tesla Announces Same Day, New Time for Fourth Quarter and Full Year 2014 Financial Results",INW01/29/15,"Tesla, Inc.(TSLA-US) Schedules Q4 2014 Earnings Release for 11-February-2015 After Market Hours ET",FCSTEV01/29/15,"Tesla, Inc.(TSLA-US) Schedules Q4 2014 Earnings Call for 11-February-2015 7:30 PM ET",FCSTTS01/29/15,Tesla Announces Release Date for Fourth Quarter and Full Year 2014 Financial Results,INW01/15/15,DJ IRW-PRESS: Tesla Motors Inc.: AktienCheck24.com: Tesla Motors Inc. Warum die Aktie trotz der derzeit schlechten Nachrichtenlage leicht die 250 Euro erreichen wird,DJIR01/05/15,"Tesla, Inc.(TSLA-US) Schedules Deutsche Bank Global Auto Industry Conference for 14-January-2015 12:30 PM ET",FCSTTS12/19/14,DJ IRW-PRESS: Tesla Motors Inc.: AktienCheck24.com - Tesla Motors Inc.: Das Kursziel ist mindestens 300 Euro,DJIR12/12/14,Tesla'S Supercharger expansion in der Schweiz geht weiter,PRNE12/12/14,Tesla Supercharger Network in Switzerland Keeps Growing,PRNE12/09/14,Tesla Officially Launches in Australia,INW11/26/14,"Tesla, Inc.(TSLA-US) Schedules Credit Suisse Global Industrials Conference for 3-December-2014 3:45 PM ET",FCSTTS11/11/14,"Tesla, Inc.(TSLA-US) Schedules Robert W. Baird & Co. Inc Industrial Conference for 11-November-2014 1:30 PM ET",FCSTTS11/06/14,DJ IRW-PRESS: Tesla Motors Inc.: www.Perlentrader.com Tesla Motors Inc. Ist die Wachstumsstory nach den Quartalszahlen noch intakt?,DJIR11/05/14,Tesla Releases Third Quarter 2014 Financial Results,INW11/05/14,"Tesla Motors, Inc. Third Quarter 2014 Shareholder Letter and Financial Results",NEWS_CR11/05/14,Tesla ouvre un nouveau Store au centre-ville de Genève,PRNE11/05/14,Tesla Opens New Flagship Store Geneva City Center,PRNE11/03/14,Tesla's Supercharger Expansion in der Schweiz geht weiter,PRNE10/27/14,DJ IRW-PRESS: Tesla Motors Inc.: www.Perlentrader.com Tesla Motors Inc. Wie wird sich der Kurs nach dem Ausstieg von Daimler und Toyota entwickeln?,DJIR10/22/14,"Automakers say yes to extended EV ranges, no to Tesla's battery technology",PRN10/21/14,"Tesla, Inc.(TSLA-US) Schedules Q3 2014 Earnings Call for 5-November-2014 5:30 PM ET",FCSTTS10/21/14,"Tesla, Inc.(TSLA-US) Schedules Q3 2014 Earnings Release for 5-November-2014 After Market Hours ET",FCSTEV10/21/14,Tesla Announces Release Date for Third Quarter Financial Results,INW10/09/14,Elon Musk's $2 Billion Tweet,PMZ10/08/14,Tesla er_ffnet neue Stores in Hamburg und Berlin,PRNE10/06/14,Tesla pr_sentiert von Grund auf neu entwickeltes Finanzierungskonzept,PRNE10/03/14,Orange Business Services to Provide Wireless Connectivity for Tesla Cars in France,BW09/19/14,Tesla ouvre son premier Service Center ˆ Genève,PRNE09/19/14,"Tesla Opens First Service Center in Geneva, Switzerland",PRNE09/17/14,Tesla's Supercharger Netzwerk w_chst weiter,PRNE09/16/14,Tesla Gigafactory Will Require 8 New Graphite Mines; Great Lakes Graphite is Fast Tracked to Production,PMZ09/09/14,Tesla's supercharger expansion in Deutschland geht weiter,PRNE09/08/14,"Tesla Acts Quick, Crowning Nevada As The $5B Gigafactory Host",NEWS_ACW08/20/14,Tesla Opens New Service Center with Showroom in Antwerp,PRNE08/20/14,Tesla Opent Nieuw Service Center met Showroom in Antwerpen,PRNE08/15/14,Tesla erweitert Supercharger-netzwerk in der Schweiz,PRNE08/15/14,Tesla Expands Supercharger Network in Switzerland,PRNE08/12/14,Tesla ouvre sa 50ème station Superchargeur en Europe,PRNE08/12/14,Tesla Œpner Supercharger NR. 50 i Europa,PRNE08/12/14,Tesla Œbner Supercharger-station nummer 50 i Europa,PRNE08/12/14,Tesla opent 50ste Supercharger locatie in Europa,PRNE08/12/14,Tesla apre la 50[a]stazione Supercharger in Europa,PRNE08/12/14,Tesla Opens 50th Supercharger Site in Europe,PRN08/12/14,Tesla _ppnar den 50:E Superchargern i Europa,PRNE08/12/14,Tesla er_ffnet 50. Supercharger in Europa,PRNE08/11/14,"Tesla, Inc.(TSLA-US) Schedules J.P. Morgan Auto Conference for 12-August-2014 2:15 PM ET",FCSTTS07/31/14,Tesla Releases Second Quarter 2014 Financial Results,INW07/30/14,Tesla continue l'expansion de son r_seau de Superchargeurs en France,PRNE07/17/14,"Tesla, Inc.(TSLA-US) Schedules Q2 2014 Earnings Release for 31-July-2014 After Market Hours ET",FCSTTS07/17/14,"Tesla, Inc.(TSLA-US) Schedules Q2 2014 Earnings Call for 31-July-2014 5:30 PM ET",FCSTTS07/17/14,Tesla Announces Release Date for Second Quarter Financial Results,INW07/17/14,Tesla's Supercharger Expansion in Deutschland geht weiter,PRNE07/15/14,Les nouveaux Superchargeurs Tesla operationnels le long de l'autoroute du soleil,PRNE06/19/14,Tesla est sur le point d'_lectrifier la route vers la C™te d'Azur avec ses Superchargeurs,PRNE06/19/14,Tesla erweitert Supercharger-Netzwerk in Deutschland,PRNE06/16/14,Tesla Motors inaugure sa nouvelle implantation dans le Sud de la France,PRNE06/07/14,Right Hand Drive Model S Arrives in the UK,PRNE06/05/14,Tesla erweitert Supercharger-Netzwerk in DACH Region,PRNE06/04/14,Energiewende Pr_mie fŸr Tesla Model S Kunden,PRNE05/31/14,Expert Opinion on the New Tesla Model S by Steve Tsingas,INW05/09/14,Tesla baut Standbein in Schweiz weiter aus und er_ffnet neues Service Center fŸr Basel,PRNE05/07/14,Tesla Releases First Quarter 2014 Financial Results,INW05/02/14,Tesla Announces 2014 Annual Stockholder Meeting and Public Webcast,INW04/26/14,"Tesla, Inc.(TSLA-US) Schedules Annual General Meeting for 3-June-2014 2:00 PM ET",FCSTTS04/22/14,Tesla und Sixt Leasing kŸndigen strategische Partnerschaft in der Schweiz an,PRNE04/18/14,"Tesla, Inc.(TSLA-US) Schedules Q1 2014 Earnings Call for 7-May-2014 5:30 PM ET",FCSTTS04/18/14,"Tesla, Inc.(TSLA-US) Schedules Q1 2014 Earnings Release for 7-May-2014 After Market Hours ET",FCSTEV04/18/14,"Tesla, Inc.(TSLA-US) Schedules Q1 2014 Earnings Release for 7-May-2014 After Market Hours ET",FCSTEV04/18/14,Tesla Motors Announces Date for First Quarter 2014 Financial Results,INW04/15/14,Tesla Motors No Longer Able to Sell Cars Directly to Customers in New Jersey,NEWS_ACW04/03/14,"Earnings Cheat Sheet: GACR, TSLA, PLUG, BLDP",NEWS_ACW03/13/14,New Jersey Law Bans Tesla from Selling Its Battery-Power Cars as of Apr. 1,NEWS_ACW03/12/14,"Tesla Motors Chooses Fast, Battery-Powered Rotary Lift Shockwaveª Lifts to Service Its Fast, Battery-Powered Cars",PRN03/04/14,Tesla s'engage ˆ accro”tre sa pr_sence en Europe,PRNE03/04/14,Tesla forts_tter expansionen i Europa,PRNE03/04/14,Tesla forplikter seg til videre ekspansjon i Europa,PRNE03/04/14,Tesla expandiert weiter in Europa,PRNE03/04/14,Tesla breidt verder uit in Europa,PRNE03/04/14,Tesla continua ad espandersi anche in Europa,PRNE03/04/14,Tesla forts_tter ekspansionen i Europa,PRNE03/04/14,Tesla Commits to Further Expansion in Europe,PRN02/26/14,Tesla Announces $1.6 Billion Convertible Notes Offering,INW02/21/14,"Tesla er_ffnet erstes Service Center in Wien, …sterreich",PRNE02/19/14,UHNW Valuation Update - Elon Musk's Net Worth Rises To US$9.7 Billion After Tesla's Stocks Soar On Q4 Profits,PRN02/19/14,Tesla Releases Fourth Quarter & Full Year 2013 Financial Results,INW02/18/14,Tesla Motors Announces Date for Fourth Quarter & Full Year 2013 Financial Results,NEWS_CR02/03/14,Tesla und Sixt Leasing schlie§en strategische Partnerschaft,PRNE01/29/14,"Tesla, Inc.(TSLA-US) Schedules Q4 2013 Earnings Call for 19-February-2014 5:30 PM ET",FCSTEV01/29/14,"Tesla, Inc.(TSLA-US) Schedules Q4 2013 Earnings Release for 19-February-2014 After Market Hours ET",FCSTEV